CODEST,FECHA,RVIENTO,TMIN,TMAX,TMED,TMINABS,TMAXABS,HRMIN,HRMAX,HRMED,HRMINABS,HRMAXABS,PREC,HORAS0,HORAS7,ETO_PM_FAO,FECHA_2,AÑO,ESTACION
AL41,01/01/1994,121.68,5.9,19.1,12.87,5.9,19.1,39.3,86.7,63.48,39.3,86.7,0.0,0.0,3.0,2.928228186,1994-01-01,1994,INVIERNO
AL41,02/01/1994,104.76,2.9,20.8,11.75,2.9,20.8,38.5,84.5,62.61,38.5,84.5,0.0,0.0,9.0,2.928228186,1994-01-02,1994,INVIERNO
AL41,03/01/1994,94.32,2.8,19.4,10.56,2.8,19.4,43.2,92.1,71.77,43.2,92.1,0.0,0.0,8.0,2.928228186,1994-01-03,1994,INVIERNO
AL41,04/01/1994,153.36,8.3,15.6,12.2,8.3,15.6,38.4,78.6,60.12,38.4,78.6,0.0,0.0,0.0,2.928228186,1994-01-04,1994,INVIERNO
AL41,05/01/1994,151.92,-0.4,16.1,8.55,-0.4,16.1,35.5,88.8,63.18,35.5,88.8,0.0,3.0,8.0,2.928228186,1994-01-05,1994,INVIERNO
AL41,06/01/1994,159.48,7.4,14.8,10.22,7.4,14.8,55.6,82.3,64.07,55.6,82.3,0.5,0.0,0.0,2.928228186,1994-01-06,1994,INVIERNO
AL41,07/01/1994,163.44,3.3,14.2,8.48,3.3,14.2,32.5,83.1,56.26,32.5,83.1,0.0,0.0,9.0,2.928228186,1994-01-07,1994,INVIERNO
AL41,08/01/1994,79.2,0.8,15.4,8.06,0.8,15.4,38.9,79.4,58.73,38.9,79.4,0.0,0.0,11.0,2.928228186,1994-01-08,1994,INVIERNO
AL41,09/01/1994,98.28,4.0,19.4,11.2,4.0,19.4,48.4,88.4,69.14,48.4,88.4,0.0,0.0,6.0,2.928228186,1994-01-09,1994,INVIERNO
AL41,10/01/1994,281.52,4.6,16.4,10.96,4.6,16.4,33.9,95.0,60.57,33.9,95.0,0.3,0.0,3.0,2.928228186,1994-01-10,1994,INVIERNO
AL41,11/01/1994,141.12,3.8,17.1,10.7,3.8,17.1,36.5,71.8,54.2,36.5,71.8,0.0,0.0,4.0,2.928228186,1994-01-11,1994,INVIERNO
AL41,12/01/1994,141.12,6.1,23.1,14.65,6.1,23.1,44.7,81.8,64.4,44.7,81.8,0.0,0.0,3.0,2.928228186,1994-01-12,1994,INVIERNO
AL41,13/01/1994,92.52,2.6,20.2,9.92,2.6,20.2,37.8,99.2,78.06,37.8,99.2,0.0,0.0,9.0,2.928228186,1994-01-13,1994,INVIERNO
AL41,14/01/1994,161.64,1.9,18.5,9.9,1.9,18.5,41.9,99.0,70.99,41.9,99.0,0.0,0.0,9.0,2.928228186,1994-01-14,1994,INVIERNO
AL41,15/01/1994,152.28,5.2,20.0,10.97,5.2,20.0,26.8,84.7,57.98,26.8,84.7,0.0,0.0,7.0,2.928228186,1994-01-15,1994,INVIERNO
AL41,16/01/1994,149.04,4.8,13.0,9.32,4.8,13.0,42.1,64.1,50.21,42.1,64.1,0.0,0.0,4.0,2.928228186,1994-01-16,1994,INVIERNO
AL41,17/01/1994,311.4,7.1,12.8,9.55,7.1,12.8,33.6,52.3,43.61,33.6,52.3,0.0,0.0,0.0,2.928228186,1994-01-17,1994,INVIERNO
AL41,18/01/1994,391.32,3.0,8.4,5.9,3.0,8.4,34.7,90.7,63.55,34.7,90.7,1.6,0.0,17.0,2.928228186,1994-01-18,1994,INVIERNO
AL41,19/01/1994,427.32,6.3,9.9,8.06,6.3,9.9,55.7,77.3,64.74,55.7,77.3,0.2,0.0,5.0,2.928228186,1994-01-19,1994,INVIERNO
AL41,20/01/1994,346.68,6.3,10.5,8.15,6.3,10.5,32.8,57.7,45.35,32.8,57.7,0.0,0.0,5.0,2.928228186,1994-01-20,1994,INVIERNO
AL41,21/01/1994,133.56,-2.8,11.0,5.25,-2.8,11.0,41.9,90.1,63.91,41.9,90.1,0.0,5.0,10.0,2.928228186,1994-01-21,1994,INVIERNO
AL41,22/01/1994,139.68,0.7,10.2,5.73,0.7,10.2,64.6,97.7,86.56,64.6,97.7,0.0,0.0,16.0,2.928228186,1994-01-22,1994,INVIERNO
AL41,23/01/1994,64.08,-3.1,14.7,4.02,-3.1,14.7,29.1,99.4,74.87,29.1,99.4,0.0,11.0,16.0,2.928228186,1994-01-23,1994,INVIERNO
AL41,24/01/1994,66.6,-3.2,19.2,5.91,-3.2,19.2,26.0,93.7,69.94,26.0,93.7,0.0,9.0,14.0,2.928228186,1994-01-24,1994,INVIERNO
AL41,25/01/1994,59.04,-0.3,21.4,7.65,-0.3,21.4,26.2,93.3,67.1,26.2,93.3,0.0,1.0,14.0,2.928228186,1994-01-25,1994,INVIERNO
AL41,26/01/1994,186.48,0.4,19.9,11.11,0.4,19.9,37.0,90.2,56.82,37.0,90.2,0.0,0.0,7.0,2.928228186,1994-01-26,1994,INVIERNO
AL41,27/01/1994,55.08,-1.9,19.8,7.46,-1.9,19.8,31.6,98.2,75.99,31.6,98.2,0.0,5.0,13.0,2.928228186,1994-01-27,1994,INVIERNO
AL41,28/01/1994,96.84,0.0,23.0,10.2,0.0,23.0,26.2,99.4,61.89,26.2,99.4,0.0,0.0,9.0,2.928228186,1994-01-28,1994,INVIERNO
AL41,29/01/1994,96.84,-0.3,17.8,9.03,-0.3,17.8,50.5,93.9,74.06,50.5,93.9,0.0,1.0,10.0,2.928228186,1994-01-29,1994,INVIERNO
AL41,30/01/1994,52.92,2.5,17.5,8.047,2.5,17.5,42.0,99.0,82.02,42.0,99.0,0.0,0.0,14.0,2.928228186,1994-01-30,1994,INVIERNO
AL41,31/01/1994,61.2,-2.2,18.9,6.97,-2.2,18.9,30.7,97.4,77.33,30.7,97.4,0.0,5.0,13.0,2.928228186,1994-01-31,1994,INVIERNO
AL41,01/02/1994,60.48,-1.0,19.9,8.04,-1.0,19.9,31.5,98.2,78.42,31.5,98.2,0.0,3.0,13.0,2.928228186,1994-02-01,1994,INVIERNO
AL41,02/02/1994,81.0,-1.5,17.7,7.69,-1.5,17.7,38.1,97.4,77.78,38.1,97.4,0.0,4.0,11.0,2.928228186,1994-02-02,1994,INVIERNO
AL41,03/02/1994,104.76,4.9,16.1,10.45,4.9,16.1,46.0,93.7,70.87,46.0,93.7,0.0,0.0,8.0,2.928228186,1994-02-03,1994,INVIERNO
AL41,04/02/1994,208.44,4.3,11.7,8.42,4.3,11.7,32.8,61.9,47.97,32.8,61.9,0.0,0.0,6.0,2.928228186,1994-02-04,1994,INVIERNO
AL41,05/02/1994,250.92,1.2,11.6,7.02,1.2,11.6,36.2,54.9,44.69,36.2,54.9,0.0,0.0,11.0,2.928228186,1994-02-05,1994,INVIERNO
AL41,06/02/1994,79.2,-3.1,15.8,6.58,-3.1,15.8,23.6,71.0,47.9,23.6,71.0,0.0,3.0,15.0,2.928228186,1994-02-06,1994,INVIERNO
AL41,07/02/1994,70.92,0.5,14.8,7.6,0.5,14.8,49.6,78.2,66.21,49.6,78.2,0.0,0.0,11.0,2.928228186,1994-02-07,1994,INVIERNO
AL41,08/02/1994,447.84,7.1,14.7,10.95,7.1,14.7,34.0,68.9,46.6,34.0,68.9,0.0,0.0,0.0,2.928228186,1994-02-08,1994,INVIERNO
AL41,09/02/1994,214.92,3.0,18.8,11.35,3.0,18.8,25.3,72.0,42.3,25.3,72.0,0.0,0.0,3.0,2.928228186,1994-02-09,1994,INVIERNO
AL41,10/02/1994,94.68,-0.7,22.4,10.28,-0.7,22.4,29.6,74.1,52.77,29.6,74.1,0.0,1.0,9.0,2.928228186,1994-02-10,1994,INVIERNO
AL41,11/02/1994,146.52,4.1,22.6,11.88,4.1,22.6,26.2,68.4,50.0,26.2,68.4,0.0,0.0,9.0,2.928228186,1994-02-11,1994,INVIERNO
AL41,12/02/1994,93.6,1.8,23.0,11.68,1.8,23.0,24.8,72.8,49.68,24.8,72.8,0.0,0.0,9.0,2.928228186,1994-02-12,1994,INVIERNO
AL41,13/02/1994,114.12,2.6,21.3,11.67,2.6,21.3,32.0,88.2,56.58,32.0,88.2,0.0,0.0,5.0,2.928228186,1994-02-13,1994,INVIERNO
AL41,14/02/1994,190.08,6.2,19.1,11.85,6.2,19.1,27.6,94.5,60.15,27.6,94.5,0.0,0.0,3.0,2.928228186,1994-02-14,1994,INVIERNO
AL41,15/02/1994,127.08,5.8,16.5,10.39,5.8,16.5,37.7,85.8,61.53,37.7,85.8,0.0,0.0,3.0,2.928228186,1994-02-15,1994,INVIERNO
AL41,16/02/1994,187.2,7.9,11.9,10.09,7.9,11.9,66.3,95.3,83.86,66.3,95.3,0.0,0.0,0.0,2.928228186,1994-02-16,1994,INVIERNO
AL41,17/02/1994,227.16,5.2,15.5,11.05,5.2,15.5,46.9,93.5,67.47,46.9,93.5,0.0,0.0,2.0,2.928228186,1994-02-17,1994,INVIERNO
AL41,18/02/1994,106.92,4.6,20.0,11.85,4.6,20.0,32.1,97.0,67.75,32.1,97.0,0.0,0.0,9.0,2.928228186,1994-02-18,1994,INVIERNO
AL41,19/02/1994,,,,,,,,,,,,,,,,1994-02-19,1994,INVIERNO
AL41,20/02/1994,,,,,,,,,,,,,,,,1994-02-20,1994,INVIERNO
AL41,21/02/1994,104.04,7.6,20.4,15.26,7.6,20.4,38.0,93.7,60.01,38.0,93.7,0.0,0.0,0.0,2.928228186,1994-02-21,1994,INVIERNO
AL41,22/02/1994,82.8,4.5,22.0,11.9,4.5,22.0,36.2,94.3,70.82,36.2,94.3,0.0,0.0,9.0,2.928228186,1994-02-22,1994,INVIERNO
AL41,23/02/1994,207.72,3.0,24.2,14.37,3.0,24.2,29.4,98.5,55.9,29.4,98.5,0.0,0.0,8.0,2.928228186,1994-02-23,1994,INVIERNO
AL41,24/02/1994,90.0,5.9,22.0,13.23,5.9,22.0,35.5,93.2,64.38,35.5,93.2,0.0,0.0,2.0,2.928228186,1994-02-24,1994,INVIERNO
AL41,25/02/1994,83.16,2.2,22.6,11.56,2.2,22.6,33.3,94.7,67.05,33.3,94.7,0.0,0.0,9.0,2.928228186,1994-02-25,1994,INVIERNO
AL41,26/02/1994,145.08,5.8,20.6,11.94,5.8,20.6,36.6,98.2,75.44,36.6,98.2,0.0,0.0,3.0,2.928228186,1994-02-26,1994,INVIERNO
AL41,27/02/1994,128.52,8.8,19.9,13.58,8.8,19.9,35.2,92.8,65.65,35.2,92.8,0.4,0.0,0.0,2.928228186,1994-02-27,1994,INVIERNO
AL41,28/02/1994,137.52,4.3,16.3,10.67,4.3,16.3,57.0,94.0,75.87,57.0,94.0,1.5,0.0,2.0,2.928228186,1994-02-28,1994,INVIERNO
AL41,01/03/1994,235.8,8.7,15.5,12.25,8.7,15.5,51.5,91.0,65.08,51.5,91.0,0.0,0.0,0.0,2.928228186,1994-03-01,1994,INVIERNO
AL41,02/03/1994,170.28,6.0,20.2,12.6,6.0,20.2,39.2,92.8,67.88,39.2,92.8,0.0,0.0,0.0,2.928228186,1994-03-02,1994,INVIERNO
AL41,03/03/1994,93.24,2.2,23.5,11.32,2.2,23.5,28.8,97.4,68.38,28.8,97.4,0.0,0.0,9.0,2.928228186,1994-03-03,1994,INVIERNO
AL41,04/03/1994,103.32,3.9,22.5,12.41,3.9,22.5,33.9,87.9,62.4,33.9,87.9,0.0,0.0,8.0,2.928228186,1994-03-04,1994,INVIERNO
AL41,05/03/1994,96.84,2.4,20.7,11.73,2.4,20.7,39.1,90.4,68.03,39.1,90.4,2.4,0.0,9.0,2.928228186,1994-03-05,1994,INVIERNO
AL41,06/03/1994,199.44,8.3,16.9,12.79,8.3,16.9,52.1,94.7,76.27,52.1,94.7,0.8,0.0,0.0,2.928228186,1994-03-06,1994,INVIERNO
AL41,07/03/1994,157.68,4.1,20.1,12.33,4.1,20.1,43.7,94.9,68.68,43.7,94.9,0.0,0.0,3.0,2.928228186,1994-03-07,1994,INVIERNO
AL41,08/03/1994,113.76,3.0,21.0,11.99,3.0,21.0,34.9,97.1,66.73,34.9,97.1,0.0,0.0,6.0,2.928228186,1994-03-08,1994,INVIERNO
AL41,09/03/1994,83.52,1.0,22.0,11.53,1.0,22.0,31.0,91.2,59.23,31.0,91.2,0.0,0.0,9.0,2.928228186,1994-03-09,1994,INVIERNO
AL41,10/03/1994,101.4,0.7,20.7,10.95,0.7,20.7,35.5,89.7,67.35,35.5,89.7,0.0,0.0,9.0,2.928228186,1994-03-10,1994,INVIERNO
AL41,11/03/1994,115.56,10.3,17.6,13.03,10.3,17.6,51.8,90.7,74.6,51.8,90.7,0.0,0.0,0.0,2.928228186,1994-03-11,1994,INVIERNO
AL41,12/03/1994,83.16,4.1,20.4,11.77,4.1,20.4,43.6,98.9,77.82,43.6,98.9,0.0,0.0,5.0,2.928228186,1994-03-12,1994,INVIERNO
AL41,13/03/1994,80.28,6.8,19.0,12.48,6.8,19.0,47.7,95.0,75.32,47.7,95.0,0.0,0.0,1.0,2.928228186,1994-03-13,1994,INVIERNO
AL41,14/03/1994,85.68,7.7,20.5,13.3,7.7,20.5,41.5,92.7,68.96,41.5,92.7,0.0,0.0,0.0,2.928228186,1994-03-14,1994,INVIERNO
AL41,15/03/1994,75.96,2.8,23.0,12.06,2.8,23.0,31.3,96.0,67.06,31.3,96.0,0.0,0.0,9.0,2.928228186,1994-03-15,1994,INVIERNO
AL41,16/03/1994,147.6,3.7,23.2,13.29,3.7,23.2,31.9,92.5,66.22,31.9,92.5,0.0,0.0,5.0,2.928228186,1994-03-16,1994,INVIERNO
AL41,17/03/1994,92.52,4.0,20.8,11.92,4.0,20.8,43.2,99.1,78.59,43.2,99.1,0.1,0.0,7.0,2.928228186,1994-03-17,1994,INVIERNO
AL41,18/03/1994,91.8,3.9,21.4,11.46,3.9,21.4,40.1,97.1,79.78,40.1,97.1,0.0,0.0,7.0,2.928228186,1994-03-18,1994,INVIERNO
AL41,19/03/1994,102.24,4.8,24.8,13.81,4.8,24.8,36.7,96.3,65.24,36.7,96.3,0.0,0.0,7.0,2.928228186,1994-03-19,1994,INVIERNO
AL41,20/03/1994,129.96,6.7,27.0,15.29,6.7,27.0,26.5,88.8,61.96,26.5,88.8,0.0,0.0,3.0,2.928228186,1994-03-20,1994,INVIERNO
AL41,21/03/1994,102.96,10.5,21.8,14.93,10.5,21.8,41.8,93.3,75.52,41.8,93.3,0.0,0.0,0.0,2.928228186,1994-03-21,1994,PRIMAVERA
AL41,22/03/1994,136.08,6.6,14.0,11.12,6.6,14.0,73.4,95.5,86.9,73.4,95.5,1.1,0.0,1.0,2.928228186,1994-03-22,1994,PRIMAVERA
AL41,23/03/1994,231.12,10.7,19.6,14.06,10.7,19.6,40.2,89.9,67.02,40.2,89.9,0.0,0.0,0.0,2.928228186,1994-03-23,1994,PRIMAVERA
AL41,24/03/1994,254.16,9.5,23.8,15.91,9.5,23.8,27.3,80.8,50.4,27.3,80.8,0.0,0.0,0.0,2.928228186,1994-03-24,1994,PRIMAVERA
AL41,25/03/1994,196.92,11.3,26.8,17.49,11.3,26.8,22.5,68.6,40.56,22.5,68.6,0.0,0.0,0.0,2.928228186,1994-03-25,1994,PRIMAVERA
AL41,26/03/1994,92.88,6.7,27.3,15.43,6.7,27.3,29.0,89.7,65.3,29.0,89.7,0.2,0.0,2.0,2.928228186,1994-03-26,1994,PRIMAVERA
AL41,27/03/1994,121.32,5.3,23.2,13.92,5.3,23.2,35.3,97.8,68.9,35.3,97.8,0.0,0.0,5.0,2.928228186,1994-03-27,1994,PRIMAVERA
AL41,28/03/1994,105.84,6.7,22.2,14.77,6.7,22.2,40.5,98.2,69.3,40.5,98.2,0.0,0.0,1.0,2.928228186,1994-03-28,1994,PRIMAVERA
AL41,29/03/1994,212.76,10.4,22.2,15.29,10.4,22.2,30.1,94.6,62.6,30.1,94.6,0.0,0.0,0.0,2.928228186,1994-03-29,1994,PRIMAVERA
AL41,30/03/1994,143.28,8.4,23.5,15.71,8.4,23.5,37.3,89.1,55.55,37.3,89.1,0.0,0.0,0.0,2.928228186,1994-03-30,1994,PRIMAVERA
AL41,31/03/1994,87.84,8.2,25.1,15.79,8.2,25.1,32.1,97.5,71.65,32.1,97.5,0.0,0.0,0.0,2.928228186,1994-03-31,1994,PRIMAVERA
AL41,01/04/1994,188.28,11.0,28.8,19.47,11.0,28.8,27.4,87.3,48.05,27.4,87.3,0.0,0.0,0.0,2.928228186,1994-04-01,1994,PRIMAVERA
AL41,02/04/1994,270.0,11.4,23.0,16.79,11.4,23.0,18.7,59.7,32.58,18.7,59.7,0.0,0.0,0.0,2.928228186,1994-04-02,1994,PRIMAVERA
AL41,03/04/1994,235.08,9.9,21.0,15.26,9.9,21.0,25.6,68.6,37.57,25.6,68.6,0.0,0.0,0.0,2.928228186,1994-04-03,1994,PRIMAVERA
AL41,04/04/1994,127.8,5.8,23.8,14.55,5.8,23.8,28.2,72.8,49.04,28.2,72.8,0.0,0.0,2.0,2.928228186,1994-04-04,1994,PRIMAVERA
AL41,05/04/1994,142.56,5.9,25.9,15.86,5.9,25.9,29.4,84.8,58.45,29.4,84.8,0.0,0.0,2.0,2.928228186,1994-04-05,1994,PRIMAVERA
AL41,06/04/1994,165.6,4.6,23.7,14.9,4.6,23.7,21.7,96.8,54.23,21.7,96.8,0.0,0.0,2.0,2.928228186,1994-04-06,1994,PRIMAVERA
AL41,07/04/1994,142.56,9.4,28.0,18.65,9.4,28.0,22.5,74.7,42.04,22.5,74.7,0.0,0.0,0.0,2.928228186,1994-04-07,1994,PRIMAVERA
AL41,08/04/1994,213.48,11.4,23.0,17.59,11.4,23.0,24.9,88.1,47.73,24.9,88.1,0.0,0.0,0.0,2.928228186,1994-04-08,1994,PRIMAVERA
AL41,09/04/1994,96.84,5.9,25.3,16.2,5.9,25.3,26.5,96.8,58.72,26.5,96.8,0.0,0.0,3.0,2.928228186,1994-04-09,1994,PRIMAVERA
AL41,10/04/1994,261.36,13.9,24.8,19.49,13.9,24.8,29.2,40.8,35.23,29.2,40.8,0.0,0.0,0.0,2.928228186,1994-04-10,1994,PRIMAVERA
AL41,11/04/1994,342.0,11.2,19.4,15.7,11.2,19.4,20.0,42.0,30.04,20.0,42.0,0.0,0.0,0.0,2.928228186,1994-04-11,1994,PRIMAVERA
AL41,12/04/1994,236.16,8.6,20.9,13.95,8.6,20.9,24.4,73.1,35.45,24.4,73.1,0.0,0.0,0.0,2.928228186,1994-04-12,1994,PRIMAVERA
AL41,13/04/1994,166.32,1.9,19.9,12.2,1.9,19.9,33.4,86.8,56.06,33.4,86.8,0.0,0.0,8.0,2.928228186,1994-04-13,1994,PRIMAVERA
AL41,14/04/1994,174.6,10.3,18.4,13.92,10.3,18.4,47.5,78.4,60.96,47.5,78.4,0.0,0.0,0.0,2.928228186,1994-04-14,1994,PRIMAVERA
AL41,15/04/1994,140.4,8.8,11.6,10.46,8.8,11.6,82.2,96.6,90.37,82.2,96.6,21.9,0.0,0.0,2.928228186,1994-04-15,1994,PRIMAVERA
AL41,16/04/1994,303.84,6.6,12.1,8.81,6.6,12.1,44.7,93.5,71.73,44.7,93.5,5.4,0.0,1.0,2.928228186,1994-04-16,1994,PRIMAVERA
AL41,17/04/1994,138.96,1.3,17.6,9.87,1.3,17.6,30.9,89.7,60.12,30.9,89.7,0.0,0.0,9.0,2.928228186,1994-04-17,1994,PRIMAVERA
AL41,18/04/1994,147.6,2.0,19.4,11.5,2.0,19.4,30.1,98.2,64.89,30.1,98.2,0.0,0.0,9.0,2.928228186,1994-04-18,1994,PRIMAVERA
AL41,19/04/1994,138.6,7.9,17.1,11.69,7.9,17.1,50.9,93.0,74.37,50.9,93.0,7.2,0.0,0.0,2.928228186,1994-04-19,1994,PRIMAVERA
AL41,20/04/1994,76.68,4.3,16.4,10.26,4.3,16.4,50.7,97.8,80.09,50.7,97.8,2.2,0.0,9.0,2.928228186,1994-04-20,1994,PRIMAVERA
AL41,21/04/1994,79.92,4.3,20.9,12.23,4.3,20.9,32.7,96.8,70.0,32.7,96.8,0.0,0.0,6.0,2.928228186,1994-04-21,1994,PRIMAVERA
AL41,22/04/1994,123.84,5.7,21.4,14.07,5.7,21.4,36.4,94.7,64.41,36.4,94.7,0.0,0.0,3.0,2.928228186,1994-04-22,1994,PRIMAVERA
AL41,23/04/1994,147.24,9.9,22.8,17.42,9.9,22.8,41.8,82.2,56.87,41.8,82.2,0.0,0.0,0.0,2.928228186,1994-04-23,1994,PRIMAVERA
AL41,24/04/1994,219.96,9.9,21.7,16.24,9.9,21.7,26.4,89.9,51.18,26.4,89.9,0.0,0.0,0.0,2.928228186,1994-04-24,1994,PRIMAVERA
AL41,25/04/1994,104.76,7.6,22.6,14.75,7.6,22.6,30.7,76.9,53.09,30.7,76.9,0.0,0.0,0.0,2.928228186,1994-04-25,1994,PRIMAVERA
AL41,26/04/1994,135.72,7.8,25.5,15.76,7.8,25.5,27.5,87.1,53.3,27.5,87.1,0.0,0.0,0.0,2.928228186,1994-04-26,1994,PRIMAVERA
AL41,27/04/1994,111.24,6.2,25.3,16.03,6.2,25.3,27.3,91.2,54.78,27.3,91.2,0.0,0.0,3.0,2.928228186,1994-04-27,1994,PRIMAVERA
AL41,28/04/1994,101.16,6.2,26.4,16.97,6.2,26.4,29.6,87.2,53.3,29.6,87.2,0.0,0.0,3.0,2.928228186,1994-04-28,1994,PRIMAVERA
AL41,29/04/1994,131.4,7.4,26.5,17.66,7.4,26.5,32.7,91.5,57.61,32.7,91.5,0.0,0.0,0.0,2.928228186,1994-04-29,1994,PRIMAVERA
AL41,30/04/1994,100.08,7.5,27.5,17.98,7.5,27.5,27.6,94.5,57.18,27.6,94.5,0.0,0.0,0.0,2.928228186,1994-04-30,1994,PRIMAVERA
AL41,01/05/1994,92.52,6.2,25.9,17.24,6.2,25.9,32.3,90.5,56.98,32.3,90.5,0.0,0.0,2.0,2.928228186,1994-05-01,1994,PRIMAVERA
AL41,02/05/1994,122.76,8.1,29.0,18.78,8.1,29.0,31.3,83.4,54.11,31.3,83.4,0.0,0.0,0.0,2.928228186,1994-05-02,1994,PRIMAVERA
AL41,03/05/1994,96.48,9.9,29.8,19.71,9.9,29.8,37.3,80.5,58.29,37.3,80.5,0.0,0.0,0.0,2.928228186,1994-05-03,1994,PRIMAVERA
AL41,04/05/1994,120.24,9.8,30.6,19.99,9.8,30.6,20.1,95.6,53.01,20.1,95.6,0.0,0.0,0.0,2.928228186,1994-05-04,1994,PRIMAVERA
AL41,05/05/1994,129.24,13.2,24.3,18.9,13.2,24.3,46.7,89.3,65.46,46.7,89.3,0.0,0.0,0.0,2.928228186,1994-05-05,1994,PRIMAVERA
AL41,06/05/1994,153.72,14.2,25.7,19.41,14.2,25.7,40.9,91.5,65.41,40.9,91.5,0.0,0.0,0.0,2.928228186,1994-05-06,1994,PRIMAVERA
AL41,07/05/1994,195.12,14.3,26.5,18.87,14.3,26.5,34.6,90.2,67.57,34.6,90.2,0.1,0.0,0.0,2.928228186,1994-05-07,1994,PRIMAVERA
AL41,08/05/1994,107.64,12.5,26.6,18.51,12.5,26.6,36.3,96.1,70.9,36.3,96.1,0.5,0.0,0.0,2.928228186,1994-05-08,1994,PRIMAVERA
AL41,09/05/1994,115.56,12.1,26.0,19.47,12.1,26.0,25.9,95.5,53.46,25.9,95.5,0.0,0.0,0.0,2.928228186,1994-05-09,1994,PRIMAVERA
AL41,10/05/1994,136.8,7.9,27.3,18.24,7.9,27.3,29.6,83.9,55.47,29.6,83.9,0.0,0.0,0.0,2.928228186,1994-05-10,1994,PRIMAVERA
AL41,11/05/1994,134.28,12.4,26.7,19.38,12.4,26.7,26.1,93.9,56.57,26.1,93.9,0.0,0.0,0.0,2.928228186,1994-05-11,1994,PRIMAVERA
AL41,12/05/1994,132.12,12.2,24.3,18.12,12.2,24.3,26.3,71.7,37.22,26.3,71.7,0.0,0.0,0.0,2.928228186,1994-05-12,1994,PRIMAVERA
AL41,13/05/1994,130.68,8.2,20.5,14.93,8.2,20.5,39.2,79.3,64.46,39.2,79.3,0.0,0.0,0.0,2.928228186,1994-05-13,1994,PRIMAVERA
AL41,14/05/1994,113.04,5.5,23.2,15.69,5.5,23.2,37.3,86.3,58.17,37.3,86.3,0.0,0.0,3.0,2.928228186,1994-05-14,1994,PRIMAVERA
AL41,15/05/1994,132.12,9.1,27.2,17.51,9.1,27.2,32.8,91.3,63.83,32.8,91.3,0.0,0.0,0.0,2.928228186,1994-05-15,1994,PRIMAVERA
AL41,16/05/1994,141.84,13.8,25.8,19.79,13.8,25.8,33.8,89.1,59.51,33.8,89.1,0.0,0.0,0.0,2.928228186,1994-05-16,1994,PRIMAVERA
AL41,17/05/1994,183.24,13.4,23.5,18.06,13.4,23.5,38.9,87.4,58.38,38.9,87.4,7.1,0.0,0.0,2.928228186,1994-05-17,1994,PRIMAVERA
AL41,18/05/1994,233.64,12.1,24.0,18.36,12.1,24.0,29.7,70.9,45.77,29.7,70.9,0.0,0.0,0.0,2.928228186,1994-05-18,1994,PRIMAVERA
AL41,19/05/1994,170.28,12.1,24.1,19.3,12.1,24.1,39.0,66.2,49.38,39.0,66.2,0.0,0.0,0.0,2.928228186,1994-05-19,1994,PRIMAVERA
AL41,20/05/1994,200.16,15.4,26.0,21.24,15.4,26.0,38.2,68.4,50.84,38.2,68.4,0.0,0.0,0.0,2.928228186,1994-05-20,1994,PRIMAVERA
AL41,21/05/1994,121.32,12.5,29.7,21.81,12.5,29.7,34.0,78.9,51.1,34.0,78.9,0.0,0.0,0.0,2.928228186,1994-05-21,1994,PRIMAVERA
AL41,22/05/1994,133.56,12.5,29.4,21.62,12.5,29.4,37.5,89.0,59.32,37.5,89.0,0.0,0.0,0.0,2.928228186,1994-05-22,1994,PRIMAVERA
AL41,23/05/1994,155.16,15.2,29.4,21.82,15.2,29.4,38.1,91.1,61.75,38.1,91.1,0.0,0.0,0.0,2.928228186,1994-05-23,1994,PRIMAVERA
AL41,24/05/1994,135.36,18.7,29.3,22.91,18.7,29.3,40.6,75.9,58.77,40.6,75.9,0.0,0.0,0.0,2.928228186,1994-05-24,1994,PRIMAVERA
AL41,25/05/1994,153.0,15.0,30.3,22.82,15.0,30.3,41.0,85.8,62.53,41.0,85.8,0.0,0.0,0.0,2.928228186,1994-05-25,1994,PRIMAVERA
AL41,26/05/1994,134.28,13.7,30.6,22.84,13.7,30.6,31.4,95.4,59.2,31.4,95.4,0.0,0.0,0.0,2.928228186,1994-05-26,1994,PRIMAVERA
AL41,27/05/1994,175.32,15.6,28.9,21.16,15.6,28.9,43.2,89.2,67.65,43.2,89.2,0.6,0.0,0.0,2.928228186,1994-05-27,1994,PRIMAVERA
AL41,28/05/1994,143.64,15.2,28.9,22.31,15.2,28.9,43.0,94.8,66.58,43.0,94.8,0.0,0.0,0.0,2.928228186,1994-05-28,1994,PRIMAVERA
AL41,29/05/1994,126.72,14.4,27.2,20.57,14.4,27.2,48.3,96.1,74.98,48.3,96.1,0.0,0.0,0.0,2.928228186,1994-05-29,1994,PRIMAVERA
AL41,30/05/1994,107.64,17.8,27.1,21.43,17.8,27.1,49.6,90.3,73.97,49.6,90.3,0.0,0.0,0.0,2.928228186,1994-05-30,1994,PRIMAVERA
AL41,31/05/1994,123.12,19.6,30.6,24.67,19.6,30.6,40.0,76.6,57.03,40.0,76.6,0.0,0.0,0.0,2.928228186,1994-05-31,1994,PRIMAVERA
AL41,01/06/1994,182.52,20.6,32.5,25.83,20.6,32.5,35.0,83.7,52.24,35.0,83.7,0.0,0.0,0.0,2.928228186,1994-06-01,1994,PRIMAVERA
AL41,02/06/1994,199.44,19.2,31.0,24.53,19.2,31.0,27.9,84.1,47.47,27.9,84.1,0.0,0.0,0.0,2.928228186,1994-06-02,1994,PRIMAVERA
AL41,03/06/1994,174.24,14.4,34.1,23.68,14.4,34.1,25.7,62.8,42.22,25.7,62.8,0.0,0.0,0.0,2.928228186,1994-06-03,1994,PRIMAVERA
AL41,04/06/1994,122.76,11.9,33.0,23.09,11.9,33.0,29.9,71.2,49.23,29.9,71.2,0.0,0.0,0.0,2.928228186,1994-06-04,1994,PRIMAVERA
AL41,05/06/1994,151.56,12.9,33.2,23.23,12.9,33.2,29.1,82.0,57.13,29.1,82.0,0.0,0.0,0.0,2.928228186,1994-06-05,1994,PRIMAVERA
AL41,06/06/1994,180.0,18.6,28.6,22.66,18.6,28.6,42.6,91.0,65.76,42.6,91.0,0.0,0.0,0.0,2.928228186,1994-06-06,1994,PRIMAVERA
AL41,07/06/1994,121.68,13.0,28.5,21.36,13.0,28.5,30.3,90.8,61.19,30.3,90.8,0.0,0.0,0.0,2.928228186,1994-06-07,1994,PRIMAVERA
AL41,08/06/1994,128.16,13.3,29.5,21.88,13.3,29.5,36.1,83.2,57.1,36.1,83.2,0.0,0.0,0.0,2.928228186,1994-06-08,1994,PRIMAVERA
AL41,09/06/1994,163.08,15.8,23.6,20.4,15.8,23.6,59.4,88.7,70.08,59.4,88.7,0.8,0.0,0.0,2.928228186,1994-06-09,1994,PRIMAVERA
AL41,10/06/1994,162.0,12.0,26.1,19.41,12.0,26.1,39.4,97.1,67.35,39.4,97.1,0.0,0.0,0.0,2.928228186,1994-06-10,1994,PRIMAVERA
AL41,11/06/1994,159.84,15.0,27.2,20.32,15.0,27.2,37.8,88.1,63.01,37.8,88.1,0.0,0.0,0.0,2.928228186,1994-06-11,1994,PRIMAVERA
AL41,12/06/1994,159.48,12.9,20.1,17.25,12.9,20.1,43.8,88.3,68.31,43.8,88.3,0.0,0.0,0.0,2.928228186,1994-06-12,1994,PRIMAVERA
AL41,13/06/1994,127.8,7.2,25.5,16.76,7.2,25.5,35.8,97.5,65.74,35.8,97.5,0.0,0.0,0.0,2.928228186,1994-06-13,1994,PRIMAVERA
AL41,14/06/1994,129.96,8.0,28.1,19.48,8.0,28.1,27.6,95.0,57.12,27.6,95.0,0.0,0.0,0.0,2.928228186,1994-06-14,1994,PRIMAVERA
AL41,15/06/1994,132.12,10.4,30.2,21.7,10.4,30.2,24.6,91.7,50.89,24.6,91.7,0.0,0.0,0.0,2.928228186,1994-06-15,1994,PRIMAVERA
AL41,16/06/1994,113.76,10.3,32.0,21.85,10.3,32.0,28.9,66.6,45.29,28.9,66.6,0.0,0.0,0.0,2.928228186,1994-06-16,1994,PRIMAVERA
AL41,17/06/1994,237.96,19.9,30.8,25.58,19.9,30.8,32.4,70.2,45.73,32.4,70.2,0.0,0.0,0.0,2.928228186,1994-06-17,1994,PRIMAVERA
AL41,18/06/1994,131.04,17.3,32.4,24.5,17.3,32.4,33.7,94.2,62.07,33.7,94.2,0.0,0.0,0.0,2.928228186,1994-06-18,1994,PRIMAVERA
AL41,19/06/1994,180.36,15.4,33.4,25.65,15.4,33.4,26.9,93.1,44.92,26.9,93.1,0.0,0.0,0.0,2.928228186,1994-06-19,1994,PRIMAVERA
AL41,20/06/1994,171.0,13.4,30.2,22.88,13.4,30.2,36.6,90.0,61.81,36.6,90.0,0.0,0.0,0.0,2.928228186,1994-06-20,1994,PRIMAVERA
AL41,21/06/1994,168.48,16.4,29.9,22.81,16.4,29.9,40.8,95.3,68.9,40.8,95.3,0.0,0.0,0.0,2.928228186,1994-06-21,1994,VERANO
AL41,22/06/1994,211.68,17.9,29.6,23.53,17.9,29.6,33.9,88.0,58.29,33.9,88.0,0.0,0.0,0.0,2.928228186,1994-06-22,1994,VERANO
AL41,23/06/1994,219.6,17.3,30.6,24.07,17.3,30.6,36.0,76.9,54.28,36.0,76.9,0.0,0.0,0.0,2.928228186,1994-06-23,1994,VERANO
AL41,24/06/1994,175.32,19.6,32.0,25.48,19.6,32.0,33.6,84.5,53.7,33.6,84.5,0.0,0.0,0.0,2.928228186,1994-06-24,1994,VERANO
AL41,25/06/1994,161.64,17.3,35.4,26.16,17.3,35.4,12.9,95.4,54.98,12.9,95.4,0.0,0.0,0.0,2.928228186,1994-06-25,1994,VERANO
AL41,26/06/1994,241.92,18.1,30.0,24.17,18.1,30.0,24.6,74.9,34.45,24.6,74.9,0.0,0.0,0.0,2.928228186,1994-06-26,1994,VERANO
AL41,27/06/1994,147.96,12.0,29.3,21.86,12.0,29.3,31.5,88.2,55.27,31.5,88.2,0.0,0.0,0.0,2.928228186,1994-06-27,1994,VERANO
AL41,28/06/1994,116.28,12.0,31.1,21.94,12.0,31.1,31.8,80.1,54.09,31.8,80.1,0.0,0.0,0.0,2.928228186,1994-06-28,1994,VERANO
AL41,29/06/1994,110.52,12.8,33.9,23.96,12.8,33.9,28.6,83.2,52.26,28.6,83.2,0.0,0.0,0.0,2.928228186,1994-06-29,1994,VERANO
AL41,30/06/1994,95.04,13.1,37.8,26.22,13.1,37.8,24.8,70.9,44.61,24.8,70.9,0.0,0.0,0.0,2.928228186,1994-06-30,1994,VERANO
AL41,01/07/1994,109.44,15.6,38.0,27.69,15.6,38.0,26.0,72.8,45.18,26.0,72.8,0.0,0.0,0.0,2.928228186,1994-07-01,1994,VERANO
AL41,02/07/1994,136.44,19.8,39.0,29.41,19.8,39.0,26.7,61.6,43.0,26.7,61.6,0.0,0.0,0.0,2.928228186,1994-07-02,1994,VERANO
AL41,03/07/1994,106.56,19.3,38.0,29.37,19.3,38.0,32.2,86.8,54.86,32.2,86.8,0.1,0.0,0.0,2.928228186,1994-07-03,1994,VERANO
AL41,04/07/1994,112.32,18.6,44.4,32.1,18.6,44.4,22.7,70.8,41.77,22.7,70.8,0.0,0.0,0.0,2.928228186,1994-07-04,1994,VERANO
AL41,05/07/1994,115.56,20.6,42.3,32.16,20.6,42.3,23.2,71.5,45.14,23.2,71.5,0.0,0.0,0.0,2.928228186,1994-07-05,1994,VERANO
AL41,06/07/1994,191.52,19.0,43.5,31.38,19.0,43.5,17.8,80.4,48.3,17.8,80.4,0.0,0.0,0.0,2.928228186,1994-07-06,1994,VERANO
AL41,07/07/1994,157.32,19.7,31.5,26.11,19.7,31.5,42.8,94.9,67.68,42.8,94.9,0.0,0.0,0.0,2.928228186,1994-07-07,1994,VERANO
AL41,08/07/1994,133.56,19.3,31.9,25.48,19.3,31.9,43.7,89.3,67.23,43.7,89.3,0.0,0.0,0.0,2.928228186,1994-07-08,1994,VERANO
AL41,09/07/1994,178.2,20.8,32.0,25.95,20.8,32.0,41.1,88.8,65.36,41.1,88.8,0.0,0.0,0.0,2.928228186,1994-07-09,1994,VERANO
AL41,10/07/1994,127.08,17.9,33.8,25.55,17.9,33.8,37.1,94.6,66.73,37.1,94.6,0.0,0.0,0.0,2.928228186,1994-07-10,1994,VERANO
AL41,11/07/1994,132.84,15.9,33.3,24.91,15.9,33.3,41.4,94.8,69.41,41.4,94.8,0.0,0.0,0.0,2.928228186,1994-07-11,1994,VERANO
AL41,12/07/1994,141.12,20.8,33.1,26.54,20.8,33.1,36.9,91.4,62.72,36.9,91.4,0.0,0.0,0.0,2.928228186,1994-07-12,1994,VERANO
AL41,13/07/1994,130.32,15.4,33.5,25.21,15.4,33.5,29.8,93.7,52.32,29.8,93.7,0.0,0.0,0.0,2.928228186,1994-07-13,1994,VERANO
AL41,14/07/1994,158.04,14.9,34.5,25.95,14.9,34.5,27.9,77.7,48.73,27.9,77.7,0.0,0.0,0.0,2.928228186,1994-07-14,1994,VERANO
AL41,15/07/1994,159.48,22.2,36.0,28.83,22.2,36.0,27.3,60.8,43.21,27.3,60.8,0.0,0.0,0.0,2.928228186,1994-07-15,1994,VERANO
AL41,16/07/1994,133.2,22.7,35.0,28.79,22.7,35.0,30.3,74.1,45.9,30.3,74.1,0.0,0.0,0.0,2.928228186,1994-07-16,1994,VERANO
AL41,17/07/1994,118.44,18.6,35.5,26.77,18.6,35.5,33.1,89.9,63.43,33.1,89.9,0.0,0.0,0.0,2.928228186,1994-07-17,1994,VERANO
AL41,18/07/1994,152.64,17.2,38.0,27.96,17.2,38.0,24.4,87.5,57.66,24.4,87.5,0.0,0.0,0.0,2.928228186,1994-07-18,1994,VERANO
AL41,19/07/1994,132.12,19.5,35.7,26.57,19.5,35.7,37.8,95.0,70.94,37.8,95.0,0.0,0.0,0.0,2.928228186,1994-07-19,1994,VERANO
AL41,20/07/1994,124.2,19.7,33.6,26.53,19.7,33.6,43.4,93.8,70.5,43.4,93.8,0.0,0.0,0.0,2.928228186,1994-07-20,1994,VERANO
AL41,21/07/1994,140.04,23.6,33.5,27.43,23.6,33.5,40.8,82.5,64.84,40.8,82.5,0.0,0.0,0.0,2.928228186,1994-07-21,1994,VERANO
AL41,22/07/1994,121.68,18.6,32.8,25.84,18.6,32.8,42.6,91.3,68.4,42.6,91.3,0.0,0.0,0.0,2.928228186,1994-07-22,1994,VERANO
AL41,23/07/1994,160.92,21.6,34.2,26.83,21.6,34.2,40.2,86.8,67.0,40.2,86.8,0.0,0.0,0.0,2.928228186,1994-07-23,1994,VERANO
AL41,24/07/1994,113.04,20.1,33.8,26.43,20.1,33.8,42.0,93.2,69.18,42.0,93.2,0.0,0.0,0.0,2.928228186,1994-07-24,1994,VERANO
AL41,25/07/1994,137.88,23.0,35.4,27.58,23.0,35.4,30.4,85.0,65.19,30.4,85.0,0.0,0.0,0.0,2.928228186,1994-07-25,1994,VERANO
AL41,26/07/1994,135.0,21.5,33.9,27.63,21.5,33.9,39.5,85.8,62.88,39.5,85.8,0.0,0.0,0.0,2.928228186,1994-07-26,1994,VERANO
AL41,27/07/1994,135.36,19.3,35.1,27.4,19.3,35.1,32.2,90.2,57.06,32.2,90.2,0.0,0.0,0.0,2.928228186,1994-07-27,1994,VERANO
AL41,28/07/1994,142.92,15.4,35.0,26.13,15.4,35.0,29.4,85.4,52.23,29.4,85.4,0.0,0.0,0.0,2.928228186,1994-07-28,1994,VERANO
AL41,29/07/1994,207.72,20.3,34.3,27.26,20.3,34.3,32.4,73.8,51.43,32.4,73.8,0.0,0.0,0.0,2.928228186,1994-07-29,1994,VERANO
AL41,30/07/1994,129.6,17.5,34.5,26.29,17.5,34.5,40.1,81.9,60.18,40.1,81.9,0.0,0.0,0.0,2.928228186,1994-07-30,1994,VERANO
AL41,31/07/1994,141.12,21.2,34.8,27.49,21.2,34.8,29.6,93.1,60.53,29.6,93.1,0.0,0.0,0.0,2.928228186,1994-07-31,1994,VERANO
AL41,01/08/1994,205.92,21.2,34.9,28.4,21.2,34.9,32.0,71.1,43.06,32.0,71.1,0.0,0.0,0.0,2.928228186,1994-08-01,1994,VERANO
AL41,02/08/1994,115.92,17.6,34.2,26.03,17.6,34.2,40.3,78.9,58.93,40.3,78.9,0.0,0.0,0.0,2.928228186,1994-08-02,1994,VERANO
AL41,03/08/1994,205.92,22.3,33.6,27.31,22.3,33.6,38.4,90.7,66.47,38.4,90.7,0.0,0.0,0.0,2.928228186,1994-08-03,1994,VERANO
AL41,04/08/1994,166.68,22.8,32.7,27.38,22.8,32.7,43.4,88.6,66.8,43.4,88.6,0.0,0.0,0.0,2.928228186,1994-08-04,1994,VERANO
AL41,05/08/1994,113.76,20.9,35.7,27.38,20.9,35.7,43.0,94.6,71.16,43.0,94.6,0.0,0.0,0.0,2.928228186,1994-08-05,1994,VERANO
AL41,06/08/1994,105.48,22.7,33.9,27.48,22.7,33.9,47.4,91.5,72.47,47.4,91.5,0.0,0.0,0.0,2.928228186,1994-08-06,1994,VERANO
AL41,07/08/1994,136.44,19.5,35.2,28.12,19.5,35.2,37.4,95.4,64.55,37.4,95.4,0.0,0.0,0.0,2.928228186,1994-08-07,1994,VERANO
AL41,08/08/1994,99.72,18.8,38.1,28.47,18.8,38.1,30.3,91.6,57.56,30.3,91.6,0.0,0.0,0.0,2.928228186,1994-08-08,1994,VERANO
AL41,09/08/1994,121.68,17.0,37.2,28.25,17.0,37.2,23.9,93.6,57.3,23.9,93.6,0.0,0.0,0.0,2.928228186,1994-08-09,1994,VERANO
AL41,10/08/1994,152.28,20.0,33.2,28.37,20.0,33.2,29.6,66.2,38.28,29.6,66.2,0.0,0.0,0.0,2.928228186,1994-08-10,1994,VERANO
AL41,11/08/1994,182.16,19.8,34.4,28.14,19.8,34.4,29.4,68.6,43.45,29.4,68.6,0.0,0.0,0.0,2.928228186,1994-08-11,1994,VERANO
AL41,12/08/1994,111.24,18.9,33.4,25.82,18.9,33.4,40.6,80.1,58.3,40.6,80.1,0.0,0.0,0.0,2.928228186,1994-08-12,1994,VERANO
AL41,13/08/1994,127.44,20.7,32.8,26.42,20.7,32.8,42.1,92.7,67.87,42.1,92.7,0.0,0.0,0.0,2.928228186,1994-08-13,1994,VERANO
AL41,14/08/1994,178.56,21.5,32.9,27.0,21.5,32.9,45.0,91.6,67.82,45.0,91.6,0.0,0.0,0.0,2.928228186,1994-08-14,1994,VERANO
AL41,15/08/1994,196.2,23.8,33.8,27.95,23.8,33.8,40.4,80.3,59.28,40.4,80.3,0.3,0.0,0.0,2.928228186,1994-08-15,1994,VERANO
AL41,16/08/1994,125.28,19.7,34.6,27.64,19.7,34.6,42.6,87.7,65.67,42.6,87.7,0.0,0.0,0.0,2.928228186,1994-08-16,1994,VERANO
AL41,17/08/1994,127.44,21.1,36.0,27.65,21.1,36.0,39.4,93.8,70.75,39.4,93.8,0.0,0.0,0.0,2.928228186,1994-08-17,1994,VERANO
AL41,18/08/1994,132.48,20.5,35.2,27.51,20.5,35.2,42.1,94.5,70.81,42.1,94.5,0.0,0.0,0.0,2.928228186,1994-08-18,1994,VERANO
AL41,19/08/1994,118.44,22.9,35.5,27.82,22.9,35.5,41.6,89.4,69.45,41.6,89.4,0.0,0.0,0.0,2.928228186,1994-08-19,1994,VERANO
AL41,20/08/1994,120.6,21.5,35.8,26.79,21.5,35.8,43.2,93.9,74.15,43.2,93.9,0.0,0.0,0.0,2.928228186,1994-08-20,1994,VERANO
AL41,21/08/1994,128.16,19.7,39.6,29.46,19.7,39.6,24.5,94.6,58.95,24.5,94.6,0.0,0.0,0.0,2.928228186,1994-08-21,1994,VERANO
AL41,22/08/1994,113.76,22.1,37.8,29.21,22.1,37.8,38.0,91.0,63.59,38.0,91.0,0.0,0.0,0.0,2.928228186,1994-08-22,1994,VERANO
AL41,23/08/1994,117.36,21.7,39.6,28.9,21.7,39.6,25.0,94.1,63.44,25.0,94.1,0.0,0.0,0.0,2.928228186,1994-08-23,1994,VERANO
AL41,24/08/1994,149.04,17.2,34.2,26.18,17.2,34.2,28.1,82.3,58.33,28.1,82.3,0.1,0.0,0.0,2.928228186,1994-08-24,1994,VERANO
AL41,25/08/1994,129.96,19.3,35.2,26.85,19.3,35.2,24.2,85.2,50.48,24.2,85.2,0.3,0.0,0.0,2.928228186,1994-08-25,1994,VERANO
AL41,26/08/1994,131.76,17.5,35.6,26.48,17.5,35.6,26.3,94.1,56.9,26.3,94.1,0.2,0.0,0.0,2.928228186,1994-08-26,1994,VERANO
AL41,27/08/1994,110.16,16.6,35.5,25.75,16.6,35.5,35.9,77.6,58.6,35.9,77.6,0.0,0.0,0.0,2.928228186,1994-08-27,1994,VERANO
AL41,28/08/1994,95.04,16.8,35.7,26.54,16.8,35.7,35.3,91.6,61.17,35.3,91.6,0.3,0.0,0.0,2.928228186,1994-08-28,1994,VERANO
AL41,29/08/1994,124.56,18.7,34.7,26.34,18.7,34.7,35.6,90.0,64.38,35.6,90.0,0.1,0.0,0.0,2.928228186,1994-08-29,1994,VERANO
AL41,30/08/1994,105.84,19.0,33.7,25.76,19.0,33.7,45.2,92.8,72.2,45.2,92.8,0.2,0.0,0.0,2.928228186,1994-08-30,1994,VERANO
AL41,31/08/1994,115.2,18.3,34.3,26.35,18.3,34.3,32.7,92.1,61.23,32.7,92.1,0.3,0.0,0.0,2.928228186,1994-08-31,1994,VERANO
AL41,01/09/1994,140.76,18.0,35.5,26.65,18.0,35.5,26.3,95.2,54.3,26.3,95.2,0.3,0.0,0.0,2.928228186,1994-09-01,1994,VERANO
AL41,02/09/1994,136.44,19.6,31.1,25.43,19.6,31.1,46.7,93.1,71.93,46.7,93.1,0.1,0.0,0.0,2.928228186,1994-09-02,1994,VERANO
AL41,03/09/1994,162.0,21.9,31.6,26.25,21.9,31.6,47.6,89.3,70.61,47.6,89.3,0.7,0.0,0.0,2.928228186,1994-09-03,1994,VERANO
AL41,04/09/1994,155.88,16.9,35.0,24.47,16.9,35.0,23.7,96.4,65.95,23.7,96.4,0.2,0.0,0.0,2.928228186,1994-09-04,1994,VERANO
AL41,05/09/1994,105.84,16.6,30.6,23.56,16.6,30.6,35.5,87.2,63.16,35.5,87.2,0.0,0.0,0.0,2.928228186,1994-09-05,1994,VERANO
AL41,06/09/1994,95.04,13.5,31.4,22.37,13.5,31.4,36.8,90.6,66.24,36.8,90.6,0.0,0.0,0.0,2.928228186,1994-09-06,1994,VERANO
AL41,07/09/1994,101.52,12.6,33.3,23.44,12.6,33.3,28.0,93.8,64.35,28.0,93.8,0.0,0.0,0.0,2.928228186,1994-09-07,1994,VERANO
AL41,08/09/1994,111.96,15.9,35.3,25.78,15.9,35.3,23.5,94.6,58.8,23.5,94.6,0.0,0.0,0.0,2.928228186,1994-09-08,1994,VERANO
AL41,09/09/1994,180.0,20.5,32.8,26.32,20.5,32.8,23.9,76.0,34.67,23.9,76.0,0.0,0.0,0.0,2.928228186,1994-09-09,1994,VERANO
AL41,10/09/1994,118.8,13.6,34.8,23.27,13.6,34.8,22.4,84.1,52.61,22.4,84.1,0.0,0.0,0.0,2.928228186,1994-09-10,1994,VERANO
AL41,11/09/1994,108.72,12.7,33.3,23.39,12.7,33.3,27.1,86.7,59.3,27.1,86.7,0.0,0.0,0.0,2.928228186,1994-09-11,1994,VERANO
AL41,12/09/1994,110.88,13.7,34.5,24.33,13.7,34.5,28.1,92.0,60.24,28.1,92.0,0.0,0.0,0.0,2.928228186,1994-09-12,1994,VERANO
AL41,13/09/1994,114.84,14.9,33.3,24.64,14.9,33.3,27.2,94.0,60.25,27.2,94.0,0.0,0.0,0.0,2.928228186,1994-09-13,1994,VERANO
AL41,14/09/1994,278.28,19.2,28.7,24.32,19.2,28.7,21.7,42.7,31.0,21.7,42.7,0.0,0.0,0.0,2.928228186,1994-09-14,1994,VERANO
AL41,15/09/1994,176.4,14.7,27.7,20.5,14.7,27.7,28.5,65.1,41.73,28.5,65.1,0.0,0.0,0.0,2.928228186,1994-09-15,1994,VERANO
AL41,16/09/1994,75.24,9.5,28.5,19.2,9.5,28.5,28.7,85.3,58.6,28.7,85.3,0.0,0.0,0.0,2.928228186,1994-09-16,1994,VERANO
AL41,17/09/1994,146.16,14.3,27.5,21.46,14.3,27.5,33.6,87.4,60.2,33.6,87.4,0.0,0.0,0.0,2.928228186,1994-09-17,1994,VERANO
AL41,18/09/1994,149.04,14.7,25.9,19.89,14.7,25.9,44.8,85.0,64.77,44.8,85.0,0.0,0.0,0.0,2.928228186,1994-09-18,1994,VERANO
AL41,19/09/1994,73.08,9.5,27.4,18.13,9.5,27.4,30.6,93.0,65.19,30.6,93.0,0.0,0.0,0.0,2.928228186,1994-09-19,1994,VERANO
AL41,20/09/1994,114.84,9.7,28.1,18.8,9.7,28.1,39.9,92.9,68.3,39.9,92.9,0.0,0.0,0.0,2.928228186,1994-09-20,1994,VERANO
AL41,21/09/1994,160.2,12.8,23.6,17.46,12.8,23.6,57.6,98.3,81.3,57.6,98.3,26.8,0.0,0.0,2.928228186,1994-09-21,1994,VERANO
AL41,22/09/1994,132.48,14.3,20.4,16.53,14.3,20.4,65.7,93.7,82.0,65.7,93.7,3.6,0.0,0.0,2.928228186,1994-09-22,1994,VERANO
AL41,23/09/1994,148.68,11.4,21.7,16.15,11.4,21.7,35.6,94.6,67.15,35.6,94.6,0.3,0.0,0.0,2.928228186,1994-09-23,1994,OTOÑO
AL41,24/09/1994,89.64,7.6,24.9,15.79,7.6,24.9,35.5,94.8,66.8,35.5,94.8,0.0,0.0,0.0,2.928228186,1994-09-24,1994,OTOÑO
AL41,25/09/1994,69.12,8.8,26.6,16.53,8.8,26.6,27.2,94.6,69.89,27.2,94.6,0.0,0.0,0.0,2.928228186,1994-09-25,1994,OTOÑO
AL41,26/09/1994,71.28,11.7,27.9,17.88,11.7,27.9,31.7,94.9,74.05,31.7,94.9,0.0,0.0,0.0,2.928228186,1994-09-26,1994,OTOÑO
AL41,27/09/1994,84.24,10.2,25.9,17.65,10.2,25.9,37.8,95.4,72.89,37.8,95.4,0.0,0.0,0.0,2.928228186,1994-09-27,1994,OTOÑO
AL41,28/09/1994,156.96,16.3,19.8,18.0,16.3,19.8,69.2,92.7,84.92,69.2,92.7,13.7,0.0,0.0,2.928228186,1994-09-28,1994,OTOÑO
AL41,29/09/1994,169.92,17.1,25.2,19.7,17.1,25.2,48.2,94.4,72.13,48.2,94.4,0.0,0.0,0.0,2.928228186,1994-09-29,1994,OTOÑO
AL41,30/09/1994,68.76,15.3,23.9,18.84,15.3,23.9,53.8,94.9,81.35,53.8,94.9,0.5,0.0,0.0,2.928228186,1994-09-30,1994,OTOÑO
AL41,01/10/1994,81.72,13.5,24.0,18.67,13.5,24.0,51.3,94.6,77.96,51.3,94.6,0.0,0.0,0.0,2.928228186,1994-10-01,1994,OTOÑO
AL41,02/10/1994,55.8,13.4,24.9,18.05,13.4,24.9,44.7,94.1,79.25,44.7,94.1,0.0,0.0,0.0,2.928228186,1994-10-02,1994,OTOÑO
AL41,03/10/1994,74.52,12.2,27.9,18.85,12.2,27.9,38.4,95.4,76.24,38.4,95.4,0.1,0.0,0.0,2.928228186,1994-10-03,1994,OTOÑO
AL41,04/10/1994,76.32,13.0,27.6,19.94,13.0,27.6,34.5,93.7,66.82,34.5,93.7,0.0,0.0,0.0,2.928228186,1994-10-04,1994,OTOÑO
AL41,05/10/1994,158.4,15.7,23.5,19.94,15.7,23.5,55.5,94.6,77.16,55.5,94.6,0.0,0.0,0.0,2.928228186,1994-10-05,1994,OTOÑO
AL41,06/10/1994,263.88,16.0,20.6,18.41,16.0,20.6,51.1,90.8,68.66,51.1,90.8,0.0,0.0,0.0,2.928228186,1994-10-06,1994,OTOÑO
AL41,07/10/1994,206.28,15.5,21.3,17.66,15.5,21.3,51.1,86.9,65.17,51.1,86.9,0.0,0.0,0.0,2.928228186,1994-10-07,1994,OTOÑO
AL41,08/10/1994,140.04,13.9,21.0,17.61,13.9,21.0,56.2,91.8,74.18,56.2,91.8,0.0,0.0,0.0,2.928228186,1994-10-08,1994,OTOÑO
AL41,09/10/1994,117.0,15.3,19.3,17.37,15.3,19.3,80.6,95.4,92.26,80.6,95.4,28.3,0.0,0.0,2.928228186,1994-10-09,1994,OTOÑO
AL41,10/10/1994,119.88,18.0,22.6,20.06,18.0,22.6,70.0,94.6,84.95,70.0,94.6,0.1,0.0,0.0,2.928228186,1994-10-10,1994,OTOÑO
AL41,11/10/1994,76.68,17.3,26.1,20.68,17.3,26.1,45.9,94.1,79.97,45.9,94.1,0.0,0.0,0.0,2.928228186,1994-10-11,1994,OTOÑO
AL41,12/10/1994,69.48,16.9,25.8,20.2,16.9,25.8,51.7,93.8,81.13,51.7,93.8,0.0,0.0,0.0,2.928228186,1994-10-12,1994,OTOÑO
AL41,13/10/1994,56.88,14.7,26.1,19.55,14.7,26.1,49.5,94.9,80.18,49.5,94.9,0.0,0.0,0.0,2.928228186,1994-10-13,1994,OTOÑO
AL41,14/10/1994,68.04,16.6,24.4,19.68,16.6,24.4,57.1,94.1,81.63,57.1,94.1,0.0,0.0,0.0,2.928228186,1994-10-14,1994,OTOÑO
AL41,15/10/1994,59.4,15.7,25.1,18.73,15.7,25.1,54.1,94.6,84.83,54.1,94.6,6.6,0.0,0.0,2.928228186,1994-10-15,1994,OTOÑO
AL41,16/10/1994,66.6,13.7,23.5,17.72,13.7,23.5,54.8,94.6,84.23,54.8,94.6,4.1,0.0,0.0,2.928228186,1994-10-16,1994,OTOÑO
AL41,17/10/1994,50.4,11.5,23.2,16.27,11.5,23.2,45.4,95.4,73.14,45.4,95.4,0.1,0.0,0.0,2.928228186,1994-10-17,1994,OTOÑO
AL41,18/10/1994,,,,,,,,,,,,,,,,1994-10-18,1994,OTOÑO
AL41,19/10/1994,,,,,,,,,,,,,,,,1994-10-19,1994,OTOÑO
AL41,20/10/1994,,,,,,,,,,,,,,,,1994-10-20,1994,OTOÑO
AL41,21/10/1994,,,,,,,,,,,,,,,,1994-10-21,1994,OTOÑO
AL41,22/10/1994,77.76,17.8,26.2,21.68,17.8,26.2,41.0,73.7,56.77,41.0,73.7,0.0,0.0,0.0,2.928228186,1994-10-22,1994,OTOÑO
AL41,23/10/1994,138.6,13.0,25.5,19.66,13.0,25.5,34.5,81.5,58.85,34.5,81.5,0.0,0.0,0.0,2.928228186,1994-10-23,1994,OTOÑO
AL41,24/10/1994,63.0,8.2,24.0,15.43,8.2,24.0,36.0,93.9,71.55,36.0,93.9,0.0,0.0,0.0,2.928228186,1994-10-24,1994,OTOÑO
AL41,25/10/1994,62.64,7.8,23.1,14.97,7.8,23.1,39.2,95.4,75.56,39.2,95.4,0.0,0.0,0.0,2.928228186,1994-10-25,1994,OTOÑO
AL41,26/10/1994,34.92,8.3,24.4,15.35,8.3,24.4,37.3,96.1,75.8,37.3,96.1,0.0,0.0,0.0,2.928228186,1994-10-26,1994,OTOÑO
AL41,27/10/1994,70.2,11.5,22.1,16.34,11.5,22.1,54.5,96.1,82.79,54.5,96.1,0.5,0.0,0.0,2.928228186,1994-10-27,1994,OTOÑO
AL41,28/10/1994,37.8,12.5,21.4,16.27,12.5,21.4,55.3,94.8,78.5,55.3,94.8,0.0,0.0,0.0,2.928228186,1994-10-28,1994,OTOÑO
AL41,29/10/1994,88.2,13.5,22.6,17.35,13.5,22.6,49.8,90.9,74.85,49.8,90.9,0.0,0.0,0.0,2.928228186,1994-10-29,1994,OTOÑO
AL41,30/10/1994,57.24,9.2,23.2,15.63,9.2,23.2,44.1,96.1,77.27,44.1,96.1,0.0,0.0,0.0,2.928228186,1994-10-30,1994,OTOÑO
AL41,31/10/1994,43.56,9.8,19.7,14.21,9.8,19.7,57.3,95.4,82.53,57.3,95.4,0.0,0.0,0.0,2.928228186,1994-10-31,1994,OTOÑO
AL41,01/11/1994,43.56,12.5,22.4,16.9,12.5,22.4,53.2,94.0,80.03,53.2,94.0,0.0,0.0,0.0,2.928228186,1994-11-01,1994,OTOÑO
AL41,02/11/1994,59.76,11.9,23.4,16.9,11.9,23.4,51.1,95.4,81.2,51.1,95.4,0.0,0.0,0.0,2.928228186,1994-11-02,1994,OTOÑO
AL41,03/11/1994,88.2,11.0,21.7,16.15,11.0,21.7,57.2,95.4,84.13,57.2,95.4,0.0,0.0,0.0,2.928228186,1994-11-03,1994,OTOÑO
AL41,04/11/1994,112.32,12.9,17.5,15.56,12.9,17.5,55.9,95.4,81.0,55.9,95.4,8.2,0.0,0.0,2.928228186,1994-11-04,1994,OTOÑO
AL41,05/11/1994,187.92,7.2,17.8,12.37,7.2,17.8,39.0,82.9,59.12,39.0,82.9,0.0,0.0,0.0,2.928228186,1994-11-05,1994,OTOÑO
AL41,06/11/1994,92.52,2.3,19.0,10.78,2.3,19.0,36.5,95.3,73.5,36.5,95.3,0.0,0.0,9.0,2.928228186,1994-11-06,1994,OTOÑO
AL41,07/11/1994,84.24,9.4,21.3,14.02,9.4,21.3,49.2,93.0,75.1,49.2,93.0,0.0,0.0,0.0,2.928228186,1994-11-07,1994,OTOÑO
AL41,08/11/1994,73.8,8.7,22.7,14.74,8.7,22.7,41.0,94.7,74.95,41.0,94.7,0.0,0.0,0.0,2.928228186,1994-11-08,1994,OTOÑO
AL41,09/11/1994,84.96,10.9,22.3,15.65,10.9,22.3,53.7,94.6,79.39,53.7,94.6,0.3,0.0,0.0,2.928228186,1994-11-09,1994,OTOÑO
AL41,10/11/1994,63.0,8.8,25.4,16.07,8.8,25.4,36.2,91.1,68.19,36.2,91.1,0.0,0.0,0.0,2.928228186,1994-11-10,1994,OTOÑO
AL41,11/11/1994,82.8,10.6,26.8,17.2,10.6,26.8,30.1,93.0,64.81,30.1,93.0,0.0,0.0,0.0,2.928228186,1994-11-11,1994,OTOÑO
AL41,12/11/1994,31.76,8.6,23.2,15.18,8.6,23.2,45.4,94.8,69.33,45.4,94.8,0.0,0.0,0.0,2.928228186,1994-11-12,1994,OTOÑO
AL41,13/11/1994,208.08,10.8,20.5,16.08,10.8,20.5,45.2,83.1,53.1,45.2,83.1,0.0,0.0,0.0,2.928228186,1994-11-13,1994,OTOÑO
AL41,14/11/1994,45.0,5.3,22.3,12.72,5.3,22.3,38.0,96.3,76.35,38.0,96.3,0.0,0.0,4.0,2.928228186,1994-11-14,1994,OTOÑO
AL41,15/11/1994,50.04,4.4,22.7,12.3,4.4,22.7,42.9,97.5,80.48,42.9,97.5,0.0,0.0,7.0,2.928228186,1994-11-15,1994,OTOÑO
AL41,16/11/1994,48.96,3.8,25.1,12.65,3.8,25.1,28.5,96.8,76.88,28.5,96.8,0.0,0.0,8.0,2.928228186,1994-11-16,1994,OTOÑO
AL41,17/11/1994,123.48,6.0,22.6,14.7,6.0,22.6,32.8,96.1,59.23,32.8,96.1,0.1,0.0,5.0,2.928228186,1994-11-17,1994,OTOÑO
AL41,18/11/1994,91.8,8.3,24.8,16.02,8.3,24.8,36.0,86.9,59.0,36.0,86.9,0.0,0.0,0.0,2.928228186,1994-11-18,1994,OTOÑO
AL41,19/11/1994,73.08,8.5,26.5,15.4,8.5,26.5,30.3,91.2,64.98,30.3,91.2,0.0,0.0,0.0,2.928228186,1994-11-19,1994,OTOÑO
AL41,20/11/1994,53.28,6.3,22.2,12.79,6.3,22.2,52.5,96.1,81.92,52.5,96.1,0.0,0.0,4.0,2.928228186,1994-11-20,1994,OTOÑO
AL41,21/11/1994,43.92,7.3,22.0,13.19,7.3,22.0,46.6,96.4,82.25,46.6,96.4,0.3,0.0,0.0,2.928228186,1994-11-21,1994,OTOÑO
AL41,22/11/1994,48.24,11.3,20.9,15.01,11.3,20.9,50.7,94.6,78.8,50.7,94.6,0.0,0.0,0.0,2.928228186,1994-11-22,1994,OTOÑO
AL41,23/11/1994,74.88,9.4,19.5,14.88,9.4,19.5,51.8,89.9,74.35,51.8,89.9,0.0,0.0,0.0,2.928228186,1994-11-23,1994,OTOÑO
AL41,24/11/1994,64.8,10.4,20.0,14.55,10.4,20.0,56.3,93.6,76.39,56.3,93.6,0.0,0.0,0.0,2.928228186,1994-11-24,1994,OTOÑO
AL41,25/11/1994,119.52,10.3,21.3,15.5,10.3,21.3,47.3,95.4,80.23,47.3,95.4,0.0,0.0,0.0,2.928228186,1994-11-25,1994,OTOÑO
AL41,26/11/1994,47.88,5.0,21.2,11.77,5.0,21.2,44.1,96.8,82.82,44.1,96.8,0.0,0.0,6.0,2.928228186,1994-11-26,1994,OTOÑO
AL41,27/11/1994,52.92,3.7,20.0,11.13,3.7,20.0,48.2,96.3,80.98,48.2,96.3,0.2,0.0,7.0,2.928228186,1994-11-27,1994,OTOÑO
AL41,28/11/1994,109.8,7.4,15.6,12.54,7.4,15.6,71.1,94.6,85.84,71.1,94.6,0.0,0.0,0.0,2.928228186,1994-11-28,1994,OTOÑO
AL41,29/11/1994,125.64,10.0,16.9,13.81,10.0,16.9,69.3,95.4,84.2,69.3,95.4,0.0,0.0,0.0,2.928228186,1994-11-29,1994,OTOÑO
AL41,30/11/1994,83.52,9.7,18.9,14.28,9.7,18.9,54.1,95.7,80.74,54.1,95.7,0.0,0.0,0.0,2.928228186,1994-11-30,1994,OTOÑO
AL41,01/12/1994,93.6,5.9,17.8,11.68,5.9,17.8,60.0,96.8,86.6,60.0,96.8,0.0,0.0,5.0,2.928228186,1994-12-01,1994,OTOÑO
AL41,02/12/1994,144.0,11.6,18.7,14.37,11.6,18.7,61.2,95.4,83.48,61.2,95.4,0.1,0.0,0.0,2.928228186,1994-12-02,1994,OTOÑO
AL41,03/12/1994,39.24,7.4,22.0,12.82,7.4,22.0,36.8,95.5,80.51,36.8,95.5,0.0,0.0,0.0,2.928228186,1994-12-03,1994,OTOÑO
AL41,04/12/1994,43.92,4.4,21.1,11.43,4.4,21.1,42.6,96.1,81.54,42.6,96.1,0.0,0.0,7.0,2.928228186,1994-12-04,1994,OTOÑO
AL41,05/12/1994,50.04,3.5,23.8,11.35,3.5,23.8,29.1,96.1,76.82,29.1,96.1,0.0,0.0,8.0,2.928228186,1994-12-05,1994,OTOÑO
AL41,06/12/1994,90.0,5.8,20.8,11.87,5.8,20.8,44.1,93.3,75.95,44.1,93.3,0.0,0.0,6.0,2.928228186,1994-12-06,1994,OTOÑO
AL41,07/12/1994,54.72,3.9,17.7,10.58,3.9,17.7,66.2,96.1,86.31,66.2,96.1,0.0,0.0,4.0,2.928228186,1994-12-07,1994,OTOÑO
AL41,08/12/1994,58.68,6.1,20.3,11.85,6.1,20.3,42.8,95.5,79.28,42.8,95.5,0.0,0.0,3.0,2.928228186,1994-12-08,1994,OTOÑO
AL41,09/12/1994,70.2,3.2,20.3,11.25,3.2,20.3,35.8,94.6,66.98,35.8,94.6,0.0,0.0,9.0,2.928228186,1994-12-09,1994,OTOÑO
AL41,10/12/1994,206.64,6.8,21.2,15.39,6.8,21.2,40.9,89.5,56.11,40.9,89.5,0.0,0.0,1.0,2.928228186,1994-12-10,1994,OTOÑO
AL41,11/12/1994,71.28,4.3,19.2,9.98,4.3,19.2,39.8,95.5,75.03,39.8,95.5,0.0,0.0,11.0,2.928228186,1994-12-11,1994,OTOÑO
AL41,12/12/1994,57.24,1.8,19.3,8.98,1.8,19.3,36.0,96.7,77.45,36.0,96.7,0.0,0.0,13.0,2.928228186,1994-12-12,1994,OTOÑO
AL41,13/12/1994,51.12,1.1,19.2,8.9,1.1,19.2,39.4,96.8,77.65,39.4,96.8,0.0,0.0,12.0,2.928228186,1994-12-13,1994,OTOÑO
AL41,14/12/1994,48.24,2.9,23.1,10.35,2.9,23.1,31.2,95.3,73.1,31.2,95.3,0.0,0.0,11.0,2.928228186,1994-12-14,1994,OTOÑO
AL41,15/12/1994,57.24,3.5,21.8,10.77,3.5,21.8,35.0,94.6,74.13,35.0,94.6,0.0,0.0,9.0,2.928228186,1994-12-15,1994,OTOÑO
AL41,16/12/1994,110.16,8.3,13.5,11.55,8.3,13.5,60.9,84.6,70.31,60.9,84.6,0.0,0.0,0.0,2.928228186,1994-12-16,1994,OTOÑO
AL41,17/12/1994,97.2,9.4,16.8,12.46,9.4,16.8,61.2,93.7,83.97,61.2,93.7,3.1,0.0,0.0,2.928228186,1994-12-17,1994,OTOÑO
AL41,18/12/1994,63.36,4.5,15.5,9.48,4.5,15.5,51.1,98.3,83.37,51.1,98.3,0.1,0.0,8.0,2.928228186,1994-12-18,1994,OTOÑO
AL41,19/12/1994,148.68,5.4,16.3,10.25,5.4,16.3,46.5,93.0,69.18,46.5,93.0,0.3,0.0,6.0,2.928228186,1994-12-19,1994,OTOÑO
AL41,20/12/1994,190.8,6.1,16.0,11.01,6.1,16.0,30.7,55.2,42.14,30.7,55.2,0.0,0.0,2.0,2.928228186,1994-12-20,1994,OTOÑO
AL41,21/12/1994,105.48,2.3,17.6,10.08,2.3,17.6,32.9,71.4,49.46,32.9,71.4,0.0,0.0,7.0,2.928228186,1994-12-21,1994,OTOÑO
AL41,22/12/1994,167.76,2.8,19.1,10.81,2.8,19.1,37.7,77.4,55.99,37.7,77.4,0.0,0.0,7.0,2.928228186,1994-12-22,1994,INVIERNO
AL41,23/12/1994,246.96,-0.7,9.9,6.2,-0.7,9.9,35.2,68.0,43.51,35.2,68.0,0.0,2.0,14.0,2.928228186,1994-12-23,1994,INVIERNO
AL41,24/12/1994,119.88,-4.5,10.6,3.13,-4.5,10.6,35.6,83.3,59.2,35.6,83.3,0.0,9.0,17.0,2.928228186,1994-12-24,1994,INVIERNO
AL41,25/12/1994,95.4,-2.2,11.7,3.88,-2.2,11.7,38.1,85.8,62.96,38.1,85.8,0.0,5.0,17.0,2.928228186,1994-12-25,1994,INVIERNO
AL41,26/12/1994,99.72,-5.7,12.8,2.0,-5.7,12.8,29.3,93.0,65.55,29.3,93.0,0.0,13.0,17.0,2.928228186,1994-12-26,1994,INVIERNO
AL41,27/12/1994,38.52,-5.0,15.9,3.36,-5.0,15.9,28.4,89.9,67.49,28.4,89.9,0.0,11.0,16.0,2.928228186,1994-12-27,1994,INVIERNO
AL41,28/12/1994,88.2,-3.3,15.8,4.39,-3.3,15.8,29.9,91.2,62.98,29.9,91.2,0.0,11.0,15.0,2.928228186,1994-12-28,1994,INVIERNO
AL41,29/12/1994,66.6,-2.8,18.8,6.76,-2.8,18.8,32.2,82.9,62.65,32.2,82.9,0.0,8.0,10.0,2.928228186,1994-12-29,1994,INVIERNO
AL41,30/12/1994,200.16,6.2,23.1,15.13,6.2,23.1,43.5,87.5,64.49,43.5,87.5,0.0,0.0,3.0,2.928228186,1994-12-30,1994,INVIERNO
AL41,31/12/1994,156.24,13.3,20.0,17.34,13.3,20.0,49.4,69.7,58.5,49.4,69.7,0.0,0.0,0.0,2.928228186,1994-12-31,1994,INVIERNO
AL41,01/01/1995,257.76,10.4,23.1,16.21,10.4,23.1,47.5,67.9,56.59,47.5,67.9,0.0,0.0,0.0,2.928228186,1995-01-01,1995,INVIERNO
AL41,02/01/1995,299.16,5.5,14.0,9.5,5.5,14.0,34.4,49.9,44.01,34.4,49.9,0.0,0.0,3.0,2.928228186,1995-01-02,1995,INVIERNO
AL41,03/01/1995,146.16,2.7,14.2,8.37,2.7,14.2,38.5,75.0,52.3,38.5,75.0,0.0,0.0,9.0,2.928228186,1995-01-03,1995,INVIERNO
AL41,04/01/1995,118.44,1.3,15.8,8.3,1.3,15.8,30.1,73.6,54.09,30.1,73.6,0.0,0.0,10.0,2.928228186,1995-01-04,1995,INVIERNO
AL41,05/01/1995,105.48,1.0,18.7,10.78,1.0,18.7,43.9,87.2,59.74,43.9,87.2,0.0,0.0,8.0,2.928228186,1995-01-05,1995,INVIERNO
AL41,06/01/1995,276.48,8.5,18.5,13.71,8.5,18.5,36.7,73.7,52.33,36.7,73.7,0.0,0.0,0.0,2.928228186,1995-01-06,1995,INVIERNO
AL41,07/01/1995,248.04,2.1,13.8,9.22,2.1,13.8,36.6,60.8,46.01,36.6,60.8,0.0,0.0,5.0,2.928228186,1995-01-07,1995,INVIERNO
AL41,08/01/1995,140.04,-1.0,13.3,6.68,-1.0,13.3,35.7,69.4,50.29,35.7,69.4,0.0,1.0,14.0,2.928228186,1995-01-08,1995,INVIERNO
AL41,09/01/1995,179.64,-1.6,17.5,9.73,-1.6,17.5,43.0,71.7,53.83,43.0,71.7,0.0,2.0,9.0,2.928228186,1995-01-09,1995,INVIERNO
AL41,10/01/1995,135.0,2.9,19.4,10.5,2.9,19.4,31.7,89.7,55.07,31.7,89.7,0.0,0.0,6.0,2.928228186,1995-01-10,1995,INVIERNO
AL41,11/01/1995,241.2,0.4,22.5,13.86,0.4,22.5,29.3,65.8,41.15,29.3,65.8,0.0,0.0,5.0,2.928228186,1995-01-11,1995,INVIERNO
AL41,12/01/1995,309.6,9.7,19.7,16.45,9.7,19.7,27.6,46.8,40.66,27.6,46.8,0.0,0.0,0.0,2.928228186,1995-01-12,1995,INVIERNO
AL41,13/01/1995,247.32,-1.9,12.3,6.88,-1.9,12.3,27.1,56.1,36.58,27.1,56.1,0.0,1.0,11.0,2.928228186,1995-01-13,1995,INVIERNO
AL41,14/01/1995,62.28,-4.8,14.4,3.46,-4.8,14.4,38.2,84.5,61.75,38.2,84.5,0.0,9.0,16.0,2.928228186,1995-01-14,1995,INVIERNO
AL41,15/01/1995,78.12,-2.8,18.4,5.75,-2.8,18.4,25.4,86.7,63.22,25.4,86.7,0.0,10.0,14.0,2.928228186,1995-01-15,1995,INVIERNO
AL41,16/01/1995,50.04,-4.4,15.3,4.43,-4.4,15.3,53.8,95.3,78.56,53.8,95.3,0.0,9.0,16.0,2.928228186,1995-01-16,1995,INVIERNO
AL41,17/01/1995,73.44,0.0,14.7,7.25,0.0,14.7,52.7,98.2,83.18,52.7,98.2,0.0,0.0,13.0,2.928228186,1995-01-17,1995,INVIERNO
AL41,18/01/1995,120.96,4.9,19.9,10.11,4.9,19.9,42.2,95.3,73.46,42.2,95.3,0.0,0.0,10.0,2.928228186,1995-01-18,1995,INVIERNO
AL41,19/01/1995,80.28,-0.6,16.1,7.19,-0.6,16.1,36.6,92.8,67.47,36.6,92.8,0.0,1.0,13.0,2.928228186,1995-01-19,1995,INVIERNO
AL41,20/01/1995,81.72,-1.2,15.2,6.98,-1.2,15.2,44.3,98.2,75.87,44.3,98.2,0.0,5.0,12.0,2.928228186,1995-01-20,1995,INVIERNO
AL41,21/01/1995,131.04,2.4,17.7,10.25,2.4,17.7,27.1,89.5,59.15,27.1,89.5,0.0,0.0,6.0,2.928228186,1995-01-21,1995,INVIERNO
AL41,22/01/1995,42.48,-2.4,19.0,6.51,-2.4,19.0,27.1,96.0,75.93,27.1,96.0,0.0,7.0,14.0,2.928228186,1995-01-22,1995,INVIERNO
AL41,23/01/1995,142.2,0.0,20.9,10.59,0.0,20.9,26.2,90.8,52.47,26.2,90.8,0.0,0.0,9.0,2.928228186,1995-01-23,1995,INVIERNO
AL41,24/01/1995,68.04,3.4,22.5,11.54,3.4,22.5,40.0,82.6,64.18,40.0,82.6,0.0,0.0,9.0,2.928228186,1995-01-24,1995,INVIERNO
AL41,25/01/1995,81.72,4.4,22.5,12.27,4.4,22.5,40.1,96.9,76.73,40.1,96.9,0.0,0.0,6.0,2.928228186,1995-01-25,1995,INVIERNO
AL41,26/01/1995,115.2,4.5,21.6,12.24,4.5,21.6,29.3,96.8,67.65,29.3,96.8,0.1,0.0,7.0,2.928228186,1995-01-26,1995,INVIERNO
AL41,27/01/1995,82.8,2.9,20.7,11.33,2.9,20.7,33.6,92.5,66.54,33.6,92.5,0.0,0.0,7.0,2.928228186,1995-01-27,1995,INVIERNO
AL41,28/01/1995,101.16,2.9,18.9,9.42,2.9,18.9,36.5,92.4,68.83,36.5,92.4,0.0,0.0,13.0,2.928228186,1995-01-28,1995,INVIERNO
AL41,29/01/1995,74.16,2.7,20.2,10.41,2.7,20.2,35.8,86.5,68.18,35.8,86.5,0.0,0.0,9.0,2.928228186,1995-01-29,1995,INVIERNO
AL41,30/01/1995,105.84,6.9,19.1,12.98,6.9,19.1,44.6,82.1,63.74,44.6,82.1,0.0,0.0,1.0,2.928228186,1995-01-30,1995,INVIERNO
AL41,31/01/1995,103.32,4.0,22.2,12.55,4.0,22.2,29.2,92.5,64.2,29.2,92.5,0.0,0.0,3.0,2.928228186,1995-01-31,1995,INVIERNO
AL41,01/02/1995,54.72,-0.2,19.9,8.03,-0.2,19.9,36.2,97.3,76.83,36.2,97.3,0.0,1.0,13.0,2.928228186,1995-02-01,1995,INVIERNO
AL41,02/02/1995,169.2,1.9,21.3,11.96,1.9,21.3,30.7,98.2,60.2,30.7,98.2,0.0,0.0,7.0,2.928228186,1995-02-02,1995,INVIERNO
AL41,03/02/1995,62.28,2.5,18.8,9.52,2.5,18.8,34.6,92.3,71.97,34.6,92.3,0.0,0.0,11.0,2.928228186,1995-02-03,1995,INVIERNO
AL41,04/02/1995,61.92,1.0,19.5,8.28,1.0,19.5,32.6,97.1,75.7,32.6,97.1,0.0,0.0,13.0,2.928228186,1995-02-04,1995,INVIERNO
AL41,05/02/1995,65.52,-1.3,20.8,8.13,-1.3,20.8,27.1,94.6,71.67,27.1,94.6,0.0,4.0,13.0,2.928228186,1995-02-05,1995,INVIERNO
AL41,06/02/1995,68.4,0.6,22.5,9.41,0.6,22.5,30.6,94.6,71.69,30.6,94.6,0.0,0.0,12.0,2.928228186,1995-02-06,1995,INVIERNO
AL41,07/02/1995,111.96,3.0,23.7,12.95,3.0,23.7,22.5,93.5,48.23,22.5,93.5,0.0,0.0,9.0,2.928228186,1995-02-07,1995,INVIERNO
AL41,08/02/1995,83.52,4.7,23.9,13.23,4.7,23.9,33.9,79.2,56.33,33.9,79.2,0.0,0.0,6.0,2.928228186,1995-02-08,1995,INVIERNO
AL41,09/02/1995,146.16,6.5,22.1,14.86,6.5,22.1,39.2,86.4,57.28,39.2,86.4,0.0,0.0,1.0,2.928228186,1995-02-09,1995,INVIERNO
AL41,10/02/1995,106.92,5.5,18.9,12.4,5.5,18.9,48.4,93.2,68.55,48.4,93.2,0.0,0.0,5.0,2.928228186,1995-02-10,1995,INVIERNO
AL41,11/02/1995,89.28,4.0,19.2,11.3,4.0,19.2,44.6,97.5,79.08,44.6,97.5,0.0,0.0,8.0,2.928228186,1995-02-11,1995,INVIERNO
AL41,12/02/1995,64.44,4.5,21.5,11.47,4.5,21.5,31.4,97.2,72.94,31.4,97.2,0.0,0.0,7.0,2.928228186,1995-02-12,1995,INVIERNO
AL41,13/02/1995,131.04,4.8,21.0,13.29,4.8,21.0,38.7,92.5,62.55,38.7,92.5,0.0,0.0,6.0,2.928228186,1995-02-13,1995,INVIERNO
AL41,14/02/1995,181.08,11.3,24.8,16.86,11.3,24.8,34.8,68.9,50.39,34.8,68.9,0.0,0.0,0.0,2.928228186,1995-02-14,1995,INVIERNO
AL41,15/02/1995,95.76,9.1,25.7,16.1,9.1,25.7,36.3,81.7,62.43,36.3,81.7,0.0,0.0,0.0,2.928228186,1995-02-15,1995,INVIERNO
AL41,16/02/1995,154.8,9.2,24.8,15.68,9.2,24.8,37.0,82.8,61.99,37.0,82.8,0.0,0.0,0.0,2.928228186,1995-02-16,1995,INVIERNO
AL41,17/02/1995,87.84,3.9,23.7,12.4,3.9,23.7,38.3,95.8,77.17,38.3,95.8,0.0,0.0,6.0,2.928228186,1995-02-17,1995,INVIERNO
AL41,18/02/1995,255.96,6.5,20.0,15.35,6.5,20.0,32.3,79.4,53.77,32.3,79.4,0.0,0.0,1.0,2.928228186,1995-02-18,1995,INVIERNO
AL41,19/02/1995,85.68,1.3,20.1,10.35,1.3,20.1,31.9,92.1,68.29,31.9,92.1,0.0,0.0,10.0,2.928228186,1995-02-19,1995,INVIERNO
AL41,20/02/1995,75.96,0.1,19.7,9.53,0.1,19.7,44.3,96.8,76.67,44.3,96.8,0.0,0.0,10.0,2.928228186,1995-02-20,1995,INVIERNO
AL41,21/02/1995,81.0,1.9,19.0,10.42,1.9,19.0,52.2,97.5,81.46,52.2,97.5,0.0,0.0,9.0,2.928228186,1995-02-21,1995,INVIERNO
AL41,22/02/1995,158.4,9.6,19.3,13.76,9.6,19.3,39.8,94.1,76.21,39.8,94.1,3.2,0.0,0.0,2.928228186,1995-02-22,1995,INVIERNO
AL41,23/02/1995,102.96,8.8,17.8,12.69,8.8,17.8,53.4,96.0,80.84,53.4,96.0,0.1,0.0,0.0,2.928228186,1995-02-23,1995,INVIERNO
AL41,24/02/1995,80.64,2.7,24.2,12.59,2.7,24.2,26.0,97.8,66.02,26.0,97.8,0.0,0.0,8.0,2.928228186,1995-02-24,1995,INVIERNO
AL41,25/02/1995,186.48,9.4,27.5,18.36,9.4,27.5,22.7,79.5,49.03,22.7,79.5,0.0,0.0,0.0,2.928228186,1995-02-25,1995,INVIERNO
AL41,26/02/1995,311.76,10.5,17.5,14.38,10.5,17.5,32.3,52.6,40.97,32.3,52.6,0.0,0.0,0.0,2.928228186,1995-02-26,1995,INVIERNO
AL41,27/02/1995,296.64,6.3,14.5,9.86,6.3,14.5,33.3,69.4,46.41,33.3,69.4,0.0,0.0,3.0,2.928228186,1995-02-27,1995,INVIERNO
AL41,28/02/1995,310.32,6.9,10.6,8.4,6.9,10.6,57.9,92.3,73.09,57.9,92.3,18.2,0.0,1.0,2.928228186,1995-02-28,1995,INVIERNO
AL41,01/03/1995,367.2,7.7,14.9,11.43,7.7,14.9,36.6,88.1,58.55,36.6,88.1,6.1,0.0,0.0,2.928228186,1995-03-01,1995,INVIERNO
AL41,02/03/1995,133.56,2.7,21.4,11.92,2.7,21.4,30.2,94.3,60.95,30.2,94.3,0.0,0.0,7.0,2.928228186,1995-03-02,1995,INVIERNO
AL41,03/03/1995,150.48,3.6,16.0,10.56,3.6,16.0,43.8,96.8,67.93,43.8,96.8,0.0,0.0,9.0,2.928228186,1995-03-03,1995,INVIERNO
AL41,04/03/1995,148.32,6.5,17.6,11.86,6.5,17.6,25.3,85.5,47.18,25.3,85.5,0.0,0.0,1.0,2.928228186,1995-03-04,1995,INVIERNO
AL41,05/03/1995,227.16,7.6,22.2,16.3,7.6,22.2,40.9,78.6,53.56,40.9,78.6,0.0,0.0,0.0,2.928228186,1995-03-05,1995,INVIERNO
AL41,06/03/1995,188.28,10.0,20.9,15.49,10.0,20.9,46.9,96.8,68.88,46.9,96.8,12.4,0.0,0.0,2.928228186,1995-03-06,1995,INVIERNO
AL41,07/03/1995,148.32,8.4,15.7,11.05,8.4,15.7,44.5,96.8,69.95,44.5,96.8,0.0,0.0,0.0,2.928228186,1995-03-07,1995,INVIERNO
AL41,08/03/1995,118.08,3.2,17.8,10.92,3.2,17.8,45.5,96.7,72.66,45.5,96.7,0.0,0.0,8.0,2.928228186,1995-03-08,1995,INVIERNO
AL41,09/03/1995,127.44,3.5,19.0,11.66,3.5,19.0,39.5,91.7,64.76,39.5,91.7,0.0,0.0,5.0,2.928228186,1995-03-09,1995,INVIERNO
AL41,10/03/1995,267.12,10.2,19.2,13.86,10.2,19.2,52.9,91.3,71.1,52.9,91.3,0.0,0.0,0.0,2.928228186,1995-03-10,1995,INVIERNO
AL41,11/03/1995,459.72,13.6,17.2,14.9,13.6,17.2,64.1,81.4,73.24,64.1,81.4,0.0,0.0,0.0,2.928228186,1995-03-11,1995,INVIERNO
AL41,12/03/1995,343.44,11.5,14.3,13.08,11.5,14.3,62.4,86.2,70.61,62.4,86.2,3.6,0.0,0.0,2.928228186,1995-03-12,1995,INVIERNO
AL41,13/03/1995,311.4,9.0,19.0,13.82,9.0,19.0,35.9,90.4,58.88,35.9,90.4,0.0,0.0,0.0,2.928228186,1995-03-13,1995,INVIERNO
AL41,14/03/1995,92.52,4.3,20.3,11.41,4.3,20.3,33.8,97.5,74.37,33.8,97.5,0.0,0.0,7.0,2.928228186,1995-03-14,1995,INVIERNO
AL41,15/03/1995,93.6,3.8,19.6,11.91,3.8,19.6,43.1,97.5,76.16,43.1,97.5,0.0,0.0,5.0,2.928228186,1995-03-15,1995,INVIERNO
AL41,16/03/1995,136.8,6.3,18.7,12.1,6.3,18.7,42.1,95.3,67.93,42.1,95.3,0.0,0.0,2.0,2.928228186,1995-03-16,1995,INVIERNO
AL41,17/03/1995,100.08,2.0,18.4,10.66,2.0,18.4,51.7,96.8,79.48,51.7,96.8,0.0,0.0,9.0,2.928228186,1995-03-17,1995,INVIERNO
AL41,18/03/1995,104.76,4.3,22.6,13.1,4.3,22.6,29.4,97.5,69.98,29.4,97.5,0.0,0.0,7.0,2.928228186,1995-03-18,1995,INVIERNO
AL41,19/03/1995,86.4,4.8,25.4,14.16,4.8,25.4,26.6,95.3,66.87,26.6,95.3,0.0,0.0,5.0,2.928228186,1995-03-19,1995,INVIERNO
AL41,20/03/1995,245.88,6.3,24.4,16.07,6.3,24.4,25.0,94.0,55.47,25.0,94.0,0.0,0.0,1.0,2.928228186,1995-03-20,1995,INVIERNO
AL41,21/03/1995,152.64,8.1,17.4,12.85,8.1,17.4,47.8,93.2,69.98,47.8,93.2,0.0,0.0,0.0,2.928228186,1995-03-21,1995,PRIMAVERA
AL41,22/03/1995,164.52,7.5,16.6,11.73,7.5,16.6,43.2,94.4,71.3,43.2,94.4,0.0,0.0,0.0,2.928228186,1995-03-22,1995,PRIMAVERA
AL41,23/03/1995,182.16,6.0,16.9,12.16,6.0,16.9,40.6,84.7,60.49,40.6,84.7,0.0,0.0,1.0,2.928228186,1995-03-23,1995,PRIMAVERA
AL41,24/03/1995,97.2,1.4,21.0,10.53,1.4,21.0,34.8,96.7,69.43,34.8,96.7,0.0,0.0,9.0,2.928228186,1995-03-24,1995,PRIMAVERA
AL41,25/03/1995,73.08,1.8,23.8,12.16,1.8,23.8,27.7,96.8,64.67,27.7,96.8,0.0,0.0,8.0,2.928228186,1995-03-25,1995,PRIMAVERA
AL41,26/03/1995,145.44,7.1,23.1,13.84,7.1,23.1,26.6,92.4,63.37,26.6,92.4,0.0,0.0,0.0,2.928228186,1995-03-26,1995,PRIMAVERA
AL41,27/03/1995,101.52,2.2,21.0,12.54,2.2,21.0,42.9,96.8,72.35,42.9,96.8,0.0,0.0,8.0,2.928228186,1995-03-27,1995,PRIMAVERA
AL41,28/03/1995,183.96,8.9,24.5,15.77,8.9,24.5,20.6,89.6,55.12,20.6,89.6,0.0,0.0,0.0,2.928228186,1995-03-28,1995,PRIMAVERA
AL41,29/03/1995,111.6,5.5,28.7,16.84,5.5,28.7,22.1,95.3,55.71,22.1,95.3,0.0,0.0,6.0,2.928228186,1995-03-29,1995,PRIMAVERA
AL41,30/03/1995,183.6,10.5,17.9,12.98,10.5,17.9,44.1,85.8,66.93,44.1,85.8,0.0,0.0,0.0,2.928228186,1995-03-30,1995,PRIMAVERA
AL41,31/03/1995,168.84,5.4,16.2,11.12,5.4,16.2,36.9,86.7,63.05,36.9,86.7,0.0,0.0,1.0,2.928228186,1995-03-31,1995,PRIMAVERA
AL41,01/04/1995,147.6,0.2,19.6,10.26,0.2,19.6,25.7,94.7,60.77,25.7,94.7,0.0,0.0,9.0,2.928228186,1995-04-01,1995,PRIMAVERA
AL41,02/04/1995,94.68,1.3,19.9,11.38,1.3,19.9,38.4,91.4,65.17,38.4,91.4,0.0,0.0,8.0,2.928228186,1995-04-02,1995,PRIMAVERA
AL41,03/04/1995,115.56,1.1,23.1,12.21,1.1,23.1,36.4,97.5,66.05,36.4,97.5,0.0,0.0,8.0,2.928228186,1995-04-03,1995,PRIMAVERA
AL41,04/04/1995,141.48,2.7,23.8,13.23,2.7,23.8,35.9,86.4,61.08,35.9,86.4,0.0,0.0,7.0,2.928228186,1995-04-04,1995,PRIMAVERA
AL41,05/04/1995,153.0,3.1,24.6,14.19,3.1,24.6,25.1,96.8,60.2,25.1,96.8,0.0,0.0,7.0,2.928228186,1995-04-05,1995,PRIMAVERA
AL41,06/04/1995,110.16,4.1,25.2,14.83,4.1,25.2,28.3,82.4,56.16,28.3,82.4,0.0,0.0,6.0,2.928228186,1995-04-06,1995,PRIMAVERA
AL41,07/04/1995,121.32,4.1,22.2,13.53,4.1,22.2,47.3,90.5,69.05,47.3,90.5,0.0,0.0,6.0,2.928228186,1995-04-07,1995,PRIMAVERA
AL41,08/04/1995,103.68,7.8,23.1,14.68,7.8,23.1,41.6,96.8,72.13,41.6,96.8,0.0,0.0,0.0,2.928228186,1995-04-08,1995,PRIMAVERA
AL41,09/04/1995,106.2,5.1,28.1,16.67,5.1,28.1,25.2,94.8,58.84,25.2,94.8,0.0,0.0,5.0,2.928228186,1995-04-09,1995,PRIMAVERA
AL41,10/04/1995,176.4,10.1,26.2,16.96,10.1,26.2,19.5,94.9,53.41,19.5,94.9,0.0,0.0,0.0,2.928228186,1995-04-10,1995,PRIMAVERA
AL41,11/04/1995,213.84,9.5,23.4,16.24,9.5,23.4,33.7,75.9,54.78,33.7,75.9,0.0,0.0,0.0,2.928228186,1995-04-11,1995,PRIMAVERA
AL41,12/04/1995,124.2,4.0,24.9,14.82,4.0,24.9,28.2,94.5,61.77,28.2,94.5,0.0,0.0,4.0,2.928228186,1995-04-12,1995,PRIMAVERA
AL41,13/04/1995,129.24,4.3,24.0,14.53,4.3,24.0,32.1,91.5,60.36,32.1,91.5,0.0,0.0,5.0,2.928228186,1995-04-13,1995,PRIMAVERA
AL41,14/04/1995,170.64,8.0,18.7,15.4,8.0,18.7,45.6,88.2,63.09,45.6,88.2,0.0,0.0,0.0,2.928228186,1995-04-14,1995,PRIMAVERA
AL41,15/04/1995,174.96,6.9,20.6,13.56,6.9,20.6,37.3,82.7,61.68,37.3,82.7,0.0,0.0,1.0,2.928228186,1995-04-15,1995,PRIMAVERA
AL41,16/04/1995,164.16,7.4,23.1,15.19,7.4,23.1,33.5,85.1,62.13,33.5,85.1,0.0,0.0,0.0,2.928228186,1995-04-16,1995,PRIMAVERA
AL41,17/04/1995,143.28,7.9,21.0,15.04,7.9,21.0,43.1,94.1,67.51,43.1,94.1,0.0,0.0,0.0,2.928228186,1995-04-17,1995,PRIMAVERA
AL41,18/04/1995,109.44,4.4,23.3,14.7,4.4,23.3,34.6,92.9,66.5,34.6,92.9,0.0,0.0,3.0,2.928228186,1995-04-18,1995,PRIMAVERA
AL41,19/04/1995,108.36,8.5,27.7,17.63,8.5,27.7,28.9,96.4,64.08,28.9,96.4,0.0,0.0,0.0,2.928228186,1995-04-19,1995,PRIMAVERA
AL41,20/04/1995,221.4,12.8,21.7,17.65,12.8,21.7,30.7,88.9,61.3,30.7,88.9,0.0,0.0,0.0,2.928228186,1995-04-20,1995,PRIMAVERA
AL41,21/04/1995,190.8,8.6,20.7,15.29,8.6,20.7,14.9,95.0,46.97,14.9,95.0,0.0,0.0,0.0,2.928228186,1995-04-21,1995,PRIMAVERA
AL41,22/04/1995,173.16,4.0,18.0,12.62,4.0,18.0,29.3,65.4,43.91,29.3,65.4,0.0,0.0,3.0,2.928228186,1995-04-22,1995,PRIMAVERA
AL41,23/04/1995,206.28,7.2,18.0,12.74,7.2,18.0,33.8,88.2,54.53,33.8,88.2,0.7,0.0,0.0,2.928228186,1995-04-23,1995,PRIMAVERA
AL41,24/04/1995,147.6,0.8,17.2,10.47,0.8,17.2,26.6,99.0,57.89,26.6,99.0,0.1,0.0,9.0,2.928228186,1995-04-24,1995,PRIMAVERA
AL41,25/04/1995,200.16,6.6,22.1,14.84,6.6,22.1,18.7,60.1,35.18,18.7,60.1,0.0,0.0,1.0,2.928228186,1995-04-25,1995,PRIMAVERA
AL41,26/04/1995,140.4,8.0,16.9,12.68,8.0,16.9,32.6,78.4,45.85,32.6,78.4,0.1,0.0,0.0,2.928228186,1995-04-26,1995,PRIMAVERA
AL41,27/04/1995,144.36,4.9,20.8,13.59,4.9,20.8,29.1,85.0,56.89,29.1,85.0,0.0,0.0,5.0,2.928228186,1995-04-27,1995,PRIMAVERA
AL41,28/04/1995,91.44,7.1,22.2,15.23,7.1,22.2,38.6,94.5,66.76,38.6,94.5,0.4,0.0,0.0,2.928228186,1995-04-28,1995,PRIMAVERA
AL41,29/04/1995,141.12,7.2,26.2,17.17,7.2,26.2,36.3,90.1,62.61,36.3,90.1,0.0,0.0,0.0,2.928228186,1995-04-29,1995,PRIMAVERA
AL41,30/04/1995,130.32,8.6,25.5,17.6,8.6,25.5,41.9,90.6,64.01,41.9,90.6,0.0,0.0,0.0,2.928228186,1995-04-30,1995,PRIMAVERA
AL41,01/05/1995,121.68,6.8,27.3,17.73,6.8,27.3,33.3,92.3,61.64,33.3,92.3,0.0,0.0,1.0,2.928228186,1995-05-01,1995,PRIMAVERA
AL41,02/05/1995,125.28,8.1,25.2,17.34,8.1,25.2,31.5,92.2,61.97,31.5,92.2,0.0,0.0,0.0,2.928228186,1995-05-02,1995,PRIMAVERA
AL41,03/05/1995,174.24,7.5,25.5,17.06,7.5,25.5,35.5,96.7,64.45,35.5,96.7,0.0,0.0,0.0,2.928228186,1995-05-03,1995,PRIMAVERA
AL41,04/05/1995,173.52,11.7,26.0,18.74,11.7,26.0,27.5,77.9,51.1,27.5,77.9,0.0,0.0,0.0,2.928228186,1995-05-04,1995,PRIMAVERA
AL41,05/05/1995,240.48,12.4,25.4,18.63,12.4,25.4,23.6,65.7,45.11,23.6,65.7,0.0,0.0,0.0,2.928228186,1995-05-05,1995,PRIMAVERA
AL41,06/05/1995,205.56,15.2,26.5,19.88,15.2,26.5,25.9,57.7,40.97,25.9,57.7,0.0,0.0,0.0,2.928228186,1995-05-06,1995,PRIMAVERA
AL41,07/05/1995,113.76,14.1,22.1,18.08,14.1,22.1,48.5,90.4,69.93,48.5,90.4,2.6,0.0,0.0,2.928228186,1995-05-07,1995,PRIMAVERA
AL41,08/05/1995,103.32,12.4,28.8,20.76,12.4,28.8,34.9,94.9,61.93,34.9,94.9,0.0,0.0,0.0,2.928228186,1995-05-08,1995,PRIMAVERA
AL41,09/05/1995,117.36,12.6,29.3,20.66,12.6,29.3,35.2,87.8,59.3,35.2,87.8,0.0,0.0,0.0,2.928228186,1995-05-09,1995,PRIMAVERA
AL41,10/05/1995,132.48,10.1,28.8,19.56,10.1,28.8,35.2,90.5,61.15,35.2,90.5,0.0,0.0,0.0,2.928228186,1995-05-10,1995,PRIMAVERA
AL41,11/05/1995,221.76,11.9,27.9,20.69,11.9,27.9,30.1,86.5,54.64,30.1,86.5,0.0,0.0,0.0,2.928228186,1995-05-11,1995,PRIMAVERA
AL41,12/05/1995,281.16,15.4,26.1,21.37,15.4,26.1,28.5,48.9,36.89,28.5,48.9,0.0,0.0,0.0,2.928228186,1995-05-12,1995,PRIMAVERA
AL41,13/05/1995,279.36,12.3,23.9,18.15,12.3,23.9,29.2,80.0,42.06,29.2,80.0,0.0,0.0,0.0,2.928228186,1995-05-13,1995,PRIMAVERA
AL41,14/05/1995,132.48,6.7,24.3,16.07,6.7,24.3,42.5,93.6,66.81,42.5,93.6,0.0,0.0,1.0,2.928228186,1995-05-14,1995,PRIMAVERA
AL41,15/05/1995,112.68,7.2,26.9,17.67,7.2,26.9,27.9,93.6,61.6,27.9,93.6,0.0,0.0,0.0,2.928228186,1995-05-15,1995,PRIMAVERA
AL41,16/05/1995,109.8,11.1,31.1,21.3,11.1,31.1,32.5,84.1,58.22,32.5,84.1,0.0,0.0,0.0,2.928228186,1995-05-16,1995,PRIMAVERA
AL41,17/05/1995,224.28,19.8,30.6,24.59,19.8,30.6,38.6,63.5,48.83,38.6,63.5,0.0,0.0,0.0,2.928228186,1995-05-17,1995,PRIMAVERA
AL41,18/05/1995,126.0,11.8,32.2,23.46,11.8,32.2,33.4,87.1,54.53,33.4,87.1,0.0,0.0,0.0,2.928228186,1995-05-18,1995,PRIMAVERA
AL41,19/05/1995,214.56,20.1,30.6,25.7,20.1,30.6,42.1,69.9,50.62,42.1,69.9,0.0,0.0,0.0,2.928228186,1995-05-19,1995,PRIMAVERA
AL41,20/05/1995,235.8,16.9,24.7,20.15,16.9,24.7,50.6,92.3,69.61,50.6,92.3,0.0,0.0,0.0,2.928228186,1995-05-20,1995,PRIMAVERA
AL41,21/05/1995,136.8,10.3,23.7,17.5,10.3,23.7,38.2,97.5,67.07,38.2,97.5,0.0,0.0,0.0,2.928228186,1995-05-21,1995,PRIMAVERA
AL41,22/05/1995,219.96,12.8,23.1,17.47,12.8,23.1,41.0,85.4,63.82,41.0,85.4,0.0,0.0,0.0,2.928228186,1995-05-22,1995,PRIMAVERA
AL41,23/05/1995,187.92,12.9,25.8,18.63,12.9,25.8,33.0,83.3,57.5,33.0,83.3,0.0,0.0,0.0,2.928228186,1995-05-23,1995,PRIMAVERA
AL41,24/05/1995,128.88,9.9,24.7,18.16,9.9,24.7,46.1,86.9,66.51,46.1,86.9,0.0,0.0,0.0,2.928228186,1995-05-24,1995,PRIMAVERA
AL41,25/05/1995,141.84,11.8,27.2,19.8,11.8,27.2,43.7,96.0,72.07,43.7,96.0,1.5,0.0,0.0,2.928228186,1995-05-25,1995,PRIMAVERA
AL41,26/05/1995,275.4,11.0,27.2,19.43,11.0,27.2,39.2,96.8,69.44,39.2,96.8,0.0,0.0,0.0,2.928228186,1995-05-26,1995,PRIMAVERA
AL41,27/05/1995,138.6,12.7,27.6,20.0,12.7,27.6,37.3,95.4,64.98,37.3,95.4,0.0,0.0,0.0,2.928228186,1995-05-27,1995,PRIMAVERA
AL41,28/05/1995,130.32,10.1,29.5,20.24,10.1,29.5,28.0,96.9,60.77,28.0,96.9,0.0,0.0,0.0,2.928228186,1995-05-28,1995,PRIMAVERA
AL41,29/05/1995,132.84,10.0,31.1,21.3,10.0,31.1,27.3,84.7,54.26,27.3,84.7,0.0,0.0,0.0,2.928228186,1995-05-29,1995,PRIMAVERA
AL41,30/05/1995,191.16,14.7,27.7,20.65,14.7,27.7,39.7,90.9,66.8,39.7,90.9,0.0,0.0,0.0,2.928228186,1995-05-30,1995,PRIMAVERA
AL41,31/05/1995,157.32,13.8,27.9,20.57,13.8,27.9,27.6,92.5,65.84,27.6,92.5,0.0,0.0,0.0,2.928228186,1995-05-31,1995,PRIMAVERA
AL41,01/06/1995,156.24,12.8,25.8,19.7,12.8,25.8,33.9,92.8,58.1,33.9,92.8,0.0,0.0,0.0,2.928228186,1995-06-01,1995,PRIMAVERA
AL41,02/06/1995,141.48,9.1,26.4,19.27,9.1,26.4,34.6,89.5,58.25,34.6,89.5,0.0,0.0,0.0,2.928228186,1995-06-02,1995,PRIMAVERA
AL41,03/06/1995,177.84,13.3,27.5,20.77,13.3,27.5,28.0,91.6,59.13,28.0,91.6,0.0,0.0,0.0,2.928228186,1995-06-03,1995,PRIMAVERA
AL41,04/06/1995,162.72,12.9,27.9,20.82,12.9,27.9,34.3,91.3,58.28,34.3,91.3,0.0,0.0,0.0,2.928228186,1995-06-04,1995,PRIMAVERA
AL41,05/06/1995,246.96,13.9,27.7,21.39,13.9,27.7,32.5,78.0,50.25,32.5,78.0,0.0,0.0,0.0,2.928228186,1995-06-05,1995,PRIMAVERA
AL41,06/06/1995,308.16,17.6,25.2,20.93,17.6,25.2,42.0,84.1,59.07,42.0,84.1,1.7,0.0,0.0,2.928228186,1995-06-06,1995,PRIMAVERA
AL41,07/06/1995,240.12,15.2,27.7,21.52,15.2,27.7,30.7,69.6,50.68,30.7,69.6,0.0,0.0,0.0,2.928228186,1995-06-07,1995,PRIMAVERA
AL41,08/06/1995,128.52,12.2,29.5,21.45,12.2,29.5,33.5,83.8,56.64,33.5,83.8,0.0,0.0,0.0,2.928228186,1995-06-08,1995,PRIMAVERA
AL41,09/06/1995,95.76,13.9,29.1,19.51,13.9,29.1,39.0,95.7,77.54,39.0,95.7,10.1,0.0,0.0,2.928228186,1995-06-09,1995,PRIMAVERA
AL41,10/06/1995,127.8,13.3,26.1,19.65,13.3,26.1,44.0,96.1,72.84,44.0,96.1,0.0,0.0,0.0,2.928228186,1995-06-10,1995,PRIMAVERA
AL41,11/06/1995,105.84,13.6,27.4,20.52,13.6,27.4,43.9,94.5,68.79,43.9,94.5,0.0,0.0,0.0,2.928228186,1995-06-11,1995,PRIMAVERA
AL41,12/06/1995,140.04,15.8,28.2,21.9,15.8,28.2,40.0,94.6,65.72,40.0,94.6,0.0,0.0,0.0,2.928228186,1995-06-12,1995,PRIMAVERA
AL41,13/06/1995,180.36,17.8,28.7,22.79,17.8,28.7,40.8,89.5,62.44,40.8,89.5,0.0,0.0,0.0,2.928228186,1995-06-13,1995,PRIMAVERA
AL41,14/06/1995,172.8,13.3,28.6,21.52,13.3,28.6,40.9,90.0,64.84,40.9,90.0,0.0,0.0,0.0,2.928228186,1995-06-14,1995,PRIMAVERA
AL41,15/06/1995,138.24,18.2,28.2,22.35,18.2,28.2,43.5,89.2,68.17,43.5,89.2,0.0,0.0,0.0,2.928228186,1995-06-15,1995,PRIMAVERA
AL41,16/06/1995,106.92,17.5,28.1,21.76,17.5,28.1,44.2,88.4,68.86,44.2,88.4,0.0,0.0,0.0,2.928228186,1995-06-16,1995,PRIMAVERA
AL41,17/06/1995,94.68,17.8,27.6,22.35,17.8,27.6,42.4,87.0,67.43,42.4,87.0,0.0,0.0,0.0,2.928228186,1995-06-17,1995,PRIMAVERA
AL41,18/06/1995,121.32,14.0,32.3,23.4,14.0,32.3,31.7,95.2,62.88,31.7,95.2,0.0,0.0,0.0,2.928228186,1995-06-18,1995,PRIMAVERA
AL41,19/06/1995,156.96,12.2,32.9,23.84,12.2,32.9,27.0,87.9,52.93,27.0,87.9,0.0,0.0,0.0,2.928228186,1995-06-19,1995,PRIMAVERA
AL41,20/06/1995,114.12,18.0,25.6,21.05,18.0,25.6,45.7,90.5,73.5,45.7,90.5,2.6,0.0,0.0,2.928228186,1995-06-20,1995,PRIMAVERA
AL41,21/06/1995,164.52,14.6,31.3,22.96,14.6,31.3,35.8,95.4,64.8,35.8,95.4,0.0,0.0,0.0,2.928228186,1995-06-21,1995,VERANO
AL41,22/06/1995,141.12,16.4,30.6,24.29,16.4,30.6,39.1,86.3,57.3,39.1,86.3,0.0,0.0,0.0,2.928228186,1995-06-22,1995,VERANO
AL41,23/06/1995,134.64,14.3,32.1,23.72,14.3,32.1,31.7,83.6,57.74,31.7,83.6,0.0,0.0,0.0,2.928228186,1995-06-23,1995,VERANO
AL41,24/06/1995,209.52,18.5,27.7,22.88,18.5,27.7,45.2,92.9,69.4,45.2,92.9,0.0,0.0,0.0,2.928228186,1995-06-24,1995,VERANO
AL41,25/06/1995,309.96,19.7,25.1,22.38,19.7,25.1,33.0,83.2,56.1,33.0,83.2,0.0,0.0,0.0,2.928228186,1995-06-25,1995,VERANO
AL41,26/06/1995,253.8,19.3,27.9,21.81,19.3,27.9,40.5,74.4,58.1,40.5,74.4,0.0,0.0,0.0,2.928228186,1995-06-26,1995,VERANO
AL41,27/06/1995,143.64,16.6,29.7,22.5,16.6,29.7,39.5,93.7,69.12,39.5,93.7,3.5,0.0,0.0,2.928228186,1995-06-27,1995,VERANO
AL41,28/06/1995,123.84,16.8,30.1,24.24,16.8,30.1,39.2,89.0,61.49,39.2,89.0,0.5,0.0,0.0,2.928228186,1995-06-28,1995,VERANO
AL41,29/06/1995,138.24,17.7,31.7,24.93,17.7,31.7,36.5,90.3,62.28,36.5,90.3,0.0,0.0,0.0,2.928228186,1995-06-29,1995,VERANO
AL41,30/06/1995,149.76,15.6,31.5,24.47,15.6,31.5,31.5,94.5,59.35,31.5,94.5,0.0,0.0,0.0,2.928228186,1995-06-30,1995,VERANO
AL41,01/07/1995,165.24,21.5,30.2,25.55,21.5,30.2,43.9,59.3,52.65,43.9,59.3,0.0,0.0,0.0,2.928228186,1995-07-01,1995,VERANO
AL41,02/07/1995,154.08,17.6,32.9,25.44,17.6,32.9,29.1,88.6,54.76,29.1,88.6,0.0,0.0,0.0,2.928228186,1995-07-02,1995,VERANO
AL41,03/07/1995,194.4,19.3,31.3,25.6,19.3,31.3,30.4,73.6,46.91,30.4,73.6,0.0,0.0,0.0,2.928228186,1995-07-03,1995,VERANO
AL41,04/07/1995,141.84,15.7,31.5,23.98,15.7,31.5,32.3,82.9,54.06,32.3,82.9,0.0,0.0,0.0,2.928228186,1995-07-04,1995,VERANO
AL41,05/07/1995,149.76,16.0,29.5,23.48,16.0,29.5,36.6,94.2,63.6,36.6,94.2,0.0,0.0,0.0,2.928228186,1995-07-05,1995,VERANO
AL41,06/07/1995,140.04,16.5,30.1,23.37,16.5,30.1,34.1,92.7,59.57,34.1,92.7,0.0,0.0,0.0,2.928228186,1995-07-06,1995,VERANO
AL41,07/07/1995,167.04,15.0,29.2,22.69,15.0,29.2,35.8,83.2,55.06,35.8,83.2,0.0,0.0,0.0,2.928228186,1995-07-07,1995,VERANO
AL41,08/07/1995,303.48,20.0,31.4,25.4,20.0,31.4,26.7,76.5,51.22,26.7,76.5,0.1,0.0,0.0,2.928228186,1995-07-08,1995,VERANO
AL41,09/07/1995,204.48,20.5,32.9,25.36,20.5,32.9,40.2,68.5,55.4,40.2,68.5,0.0,0.0,0.0,2.928228186,1995-07-09,1995,VERANO
AL41,10/07/1995,127.8,16.5,32.9,25.05,16.5,32.9,41.5,82.1,61.78,41.5,82.1,0.0,0.0,0.0,2.928228186,1995-07-10,1995,VERANO
AL41,11/07/1995,166.32,20.2,34.2,27.49,20.2,34.2,35.2,74.9,51.89,35.2,74.9,0.0,0.0,0.0,2.928228186,1995-07-11,1995,VERANO
AL41,12/07/1995,145.44,17.0,33.6,26.31,17.0,33.6,30.5,87.8,54.88,30.5,87.8,0.0,0.0,0.0,2.928228186,1995-07-12,1995,VERANO
AL41,13/07/1995,117.36,16.0,33.8,25.0,16.0,33.8,33.8,87.9,62.33,33.8,87.9,0.0,0.0,0.0,2.928228186,1995-07-13,1995,VERANO
AL41,14/07/1995,176.76,19.0,35.5,27.42,19.0,35.5,29.0,88.2,49.23,29.0,88.2,0.0,0.0,0.0,2.928228186,1995-07-14,1995,VERANO
AL41,15/07/1995,170.64,16.9,36.9,27.73,16.9,36.9,26.3,71.5,44.75,26.3,71.5,0.0,0.0,0.0,2.928228186,1995-07-15,1995,VERANO
AL41,16/07/1995,142.92,15.8,36.5,26.86,15.8,36.5,28.7,81.6,52.78,28.7,81.6,0.0,0.0,0.0,2.928228186,1995-07-16,1995,VERANO
AL41,17/07/1995,198.72,20.2,35.5,27.69,20.2,35.5,31.6,79.8,50.04,31.6,79.8,0.0,0.0,0.0,2.928228186,1995-07-17,1995,VERANO
AL41,18/07/1995,114.84,17.1,35.2,27.1,17.1,35.2,34.4,73.4,50.61,34.4,73.4,0.0,0.0,0.0,2.928228186,1995-07-18,1995,VERANO
AL41,19/07/1995,108.72,16.3,36.4,26.97,16.3,36.4,30.2,79.3,51.07,30.2,79.3,0.0,0.0,0.0,2.928228186,1995-07-19,1995,VERANO
AL41,20/07/1995,124.92,17.2,36.5,27.29,17.2,36.5,32.9,80.2,52.37,32.9,80.2,0.0,0.0,0.0,2.928228186,1995-07-20,1995,VERANO
AL41,21/07/1995,118.08,17.1,36.3,27.62,17.1,36.3,31.2,82.7,55.13,31.2,82.7,0.0,0.0,0.0,2.928228186,1995-07-21,1995,VERANO
AL41,22/07/1995,101.52,17.2,37.7,27.78,17.2,37.7,30.8,85.1,58.2,30.8,85.1,0.0,0.0,0.0,2.928228186,1995-07-22,1995,VERANO
AL41,23/07/1995,177.48,22.1,35.6,27.57,22.1,35.6,34.9,93.1,63.06,34.9,93.1,0.0,0.0,0.0,2.928228186,1995-07-23,1995,VERANO
AL41,24/07/1995,119.16,18.0,36.0,27.4,18.0,36.0,30.1,93.6,59.46,30.1,93.6,0.0,0.0,0.0,2.928228186,1995-07-24,1995,VERANO
AL41,25/07/1995,144.36,18.8,35.0,27.01,18.8,35.0,26.7,89.3,57.78,26.7,89.3,0.0,0.0,0.0,2.928228186,1995-07-25,1995,VERANO
AL41,26/07/1995,128.52,17.2,36.4,27.07,17.2,36.4,29.4,88.7,55.13,29.4,88.7,0.0,0.0,0.0,2.928228186,1995-07-26,1995,VERANO
AL41,27/07/1995,153.72,16.7,35.4,26.68,16.7,35.4,27.9,79.0,56.49,27.9,79.0,0.0,0.0,0.0,2.928228186,1995-07-27,1995,VERANO
AL41,28/07/1995,139.68,22.4,34.2,27.46,22.4,34.2,42.7,93.1,69.21,42.7,93.1,0.0,0.0,0.0,2.928228186,1995-07-28,1995,VERANO
AL41,29/07/1995,126.36,18.8,32.2,25.97,18.8,32.2,48.9,94.6,73.57,48.9,94.6,0.0,0.0,0.0,2.928228186,1995-07-29,1995,VERANO
AL41,30/07/1995,155.52,20.0,33.2,26.23,20.0,33.2,42.8,94.4,69.45,42.8,94.4,0.0,0.0,0.0,2.928228186,1995-07-30,1995,VERANO
AL41,31/07/1995,136.08,19.5,33.7,26.73,19.5,33.7,37.8,91.5,66.18,37.8,91.5,0.0,0.0,0.0,2.928228186,1995-07-31,1995,VERANO
AL41,01/08/1995,122.04,19.6,33.7,26.29,19.6,33.7,39.9,92.3,68.58,39.9,92.3,0.0,0.0,0.0,2.928228186,1995-08-01,1995,VERANO
AL41,02/08/1995,151.2,22.8,34.7,27.9,22.8,34.7,39.5,91.4,66.11,39.5,91.4,0.0,0.0,0.0,2.928228186,1995-08-02,1995,VERANO
AL41,03/08/1995,117.36,21.9,33.8,27.54,21.9,33.8,43.9,89.2,67.42,43.9,89.2,0.0,0.0,0.0,2.928228186,1995-08-03,1995,VERANO
AL41,04/08/1995,134.64,18.0,35.8,26.23,18.0,35.8,23.5,94.1,64.11,23.5,94.1,0.0,0.0,0.0,2.928228186,1995-08-04,1995,VERANO
AL41,05/08/1995,155.52,18.3,37.3,27.88,18.3,37.3,21.4,83.3,42.33,21.4,83.3,0.0,0.0,0.0,2.928228186,1995-08-05,1995,VERANO
AL41,06/08/1995,133.56,16.9,37.3,26.89,16.9,37.3,23.7,83.9,52.4,23.7,83.9,0.0,0.0,0.0,2.928228186,1995-08-06,1995,VERANO
AL41,07/08/1995,150.48,19.1,33.4,26.21,19.1,33.4,43.5,89.7,64.88,43.5,89.7,0.0,0.0,0.0,2.928228186,1995-08-07,1995,VERANO
AL41,08/08/1995,138.6,19.8,31.4,26.0,19.8,31.4,47.7,92.3,68.33,47.7,92.3,0.0,0.0,0.0,2.928228186,1995-08-08,1995,VERANO
AL41,09/08/1995,261.72,22.8,30.6,26.23,22.8,30.6,48.6,93.6,72.36,48.6,93.6,1.2,0.0,0.0,2.928228186,1995-08-09,1995,VERANO
AL41,10/08/1995,178.56,24.4,36.2,28.55,24.4,36.2,37.5,78.3,59.37,37.5,78.3,0.0,0.0,0.0,2.928228186,1995-08-10,1995,VERANO
AL41,11/08/1995,108.36,20.9,37.1,28.34,20.9,37.1,37.1,90.8,65.2,37.1,90.8,0.0,0.0,0.0,2.928228186,1995-08-11,1995,VERANO
AL41,12/08/1995,124.56,21.0,35.1,27.68,21.0,35.1,35.8,91.4,63.23,35.8,91.4,0.0,0.0,0.0,2.928228186,1995-08-12,1995,VERANO
AL41,13/08/1995,124.92,18.1,35.8,27.45,18.1,35.8,30.2,92.1,56.65,30.2,92.1,0.0,0.0,0.0,2.928228186,1995-08-13,1995,VERANO
AL41,14/08/1995,182.88,22.2,33.1,26.7,22.2,33.1,36.2,92.4,66.05,36.2,92.4,0.0,0.0,0.0,2.928228186,1995-08-14,1995,VERANO
AL41,15/08/1995,165.96,23.5,33.1,27.04,23.5,33.1,39.6,83.5,63.43,39.6,83.5,0.0,0.0,0.0,2.928228186,1995-08-15,1995,VERANO
AL41,16/08/1995,115.92,18.1,33.4,25.76,18.1,33.4,41.5,89.9,66.11,41.5,89.9,0.0,0.0,0.0,2.928228186,1995-08-16,1995,VERANO
AL41,17/08/1995,97.92,17.0,37.5,26.78,17.0,37.5,32.6,93.8,66.39,32.6,93.8,0.0,0.0,0.0,2.928228186,1995-08-17,1995,VERANO
AL41,18/08/1995,160.2,23.2,32.5,27.64,23.2,32.5,30.9,82.7,57.87,30.9,82.7,0.0,0.0,0.0,2.928228186,1995-08-18,1995,VERANO
AL41,19/08/1995,127.8,20.9,32.2,26.26,20.9,32.2,43.4,94.6,70.76,43.4,94.6,0.0,0.0,0.0,2.928228186,1995-08-19,1995,VERANO
AL41,20/08/1995,110.52,18.6,32.8,25.25,18.6,32.8,37.7,92.0,70.42,37.7,92.0,0.0,0.0,0.0,2.928228186,1995-08-20,1995,VERANO
AL41,21/08/1995,139.32,20.4,30.8,25.02,20.4,30.8,42.3,93.2,68.6,42.3,93.2,0.8,0.0,0.0,2.928228186,1995-08-21,1995,VERANO
AL41,22/08/1995,172.08,16.3,30.2,23.79,16.3,30.2,42.4,89.3,64.57,42.4,89.3,0.0,0.0,0.0,2.928228186,1995-08-22,1995,VERANO
AL41,23/08/1995,166.32,20.5,30.0,23.8,20.5,30.0,44.7,90.9,75.82,44.7,90.9,4.4,0.0,0.0,2.928228186,1995-08-23,1995,VERANO
AL41,24/08/1995,131.76,16.3,32.0,23.6,16.3,32.0,34.2,95.6,69.05,34.2,95.6,0.0,0.0,0.0,2.928228186,1995-08-24,1995,VERANO
AL41,25/08/1995,103.68,16.3,30.7,23.65,16.3,30.7,46.3,95.4,74.2,46.3,95.4,0.0,0.0,0.0,2.928228186,1995-08-25,1995,VERANO
AL41,26/08/1995,104.04,16.3,31.9,24.3,16.3,31.9,40.0,94.9,68.97,40.0,94.9,0.0,0.0,0.0,2.928228186,1995-08-26,1995,VERANO
AL41,27/08/1995,103.32,14.8,33.7,24.29,14.8,33.7,27.3,90.9,59.92,27.3,90.9,0.0,0.0,0.0,2.928228186,1995-08-27,1995,VERANO
AL41,28/08/1995,102.6,14.7,33.4,24.55,14.7,33.4,35.9,90.6,64.07,35.9,90.6,0.0,0.0,0.0,2.928228186,1995-08-28,1995,VERANO
AL41,29/08/1995,102.96,18.2,28.9,23.43,18.2,28.9,52.4,94.4,76.1,52.4,94.4,0.2,0.0,0.0,2.928228186,1995-08-29,1995,VERANO
AL41,30/08/1995,128.16,17.1,29.9,23.9,17.1,29.9,48.1,87.4,69.14,48.1,87.4,0.0,0.0,0.0,2.928228186,1995-08-30,1995,VERANO
AL41,31/08/1995,118.8,22.2,30.1,24.96,22.2,30.1,52.6,83.7,71.86,52.6,83.7,0.0,0.0,0.0,2.928228186,1995-08-31,1995,VERANO
AL41,01/09/1995,108.72,22.0,30.2,25.38,22.0,30.2,54.4,83.2,69.61,54.4,83.2,0.0,0.0,0.0,2.928228186,1995-09-01,1995,VERANO
AL41,02/09/1995,106.92,18.5,32.9,24.95,18.5,32.9,41.1,90.1,71.19,41.1,90.1,0.0,0.0,0.0,2.928228186,1995-09-02,1995,VERANO
AL41,03/09/1995,92.52,18.3,34.4,25.88,18.3,34.4,26.5,95.4,59.62,26.5,95.4,0.0,0.0,0.0,2.928228186,1995-09-03,1995,VERANO
AL41,04/09/1995,113.4,20.7,27.7,24.56,20.7,27.7,34.4,81.6,55.38,34.4,81.6,0.8,0.0,0.0,2.928228186,1995-09-04,1995,VERANO
AL41,05/09/1995,194.04,15.2,29.1,23.37,15.2,29.1,31.0,70.6,46.39,31.0,70.6,0.0,0.0,0.0,2.928228186,1995-09-05,1995,VERANO
AL41,06/09/1995,193.68,18.2,30.3,24.75,18.2,30.3,38.1,67.5,51.96,38.1,67.5,0.0,0.0,0.0,2.928228186,1995-09-06,1995,VERANO
AL41,07/09/1995,276.48,21.5,33.0,26.96,21.5,33.0,33.5,62.6,46.07,33.5,62.6,0.0,0.0,0.0,2.928228186,1995-09-07,1995,VERANO
AL41,08/09/1995,148.68,16.6,30.1,23.34,16.6,30.1,30.8,80.0,48.47,30.8,80.0,0.0,0.0,0.0,2.928228186,1995-09-08,1995,VERANO
AL41,09/09/1995,101.88,11.5,30.2,21.04,11.5,30.2,30.0,88.8,60.03,30.0,88.8,0.0,0.0,0.0,2.928228186,1995-09-09,1995,VERANO
AL41,10/09/1995,94.32,11.0,29.2,20.17,11.0,29.2,31.5,88.1,68.69,31.5,88.1,0.0,0.0,0.0,2.928228186,1995-09-10,1995,VERANO
AL41,11/09/1995,113.4,12.8,32.1,22.05,12.8,32.1,33.8,93.0,64.95,33.8,93.0,0.0,0.0,0.0,2.928228186,1995-09-11,1995,VERANO
AL41,12/09/1995,70.92,14.4,29.8,21.78,14.4,29.8,40.9,92.1,68.32,40.9,92.1,0.0,0.0,0.0,2.928228186,1995-09-12,1995,VERANO
AL41,13/09/1995,182.52,16.0,28.8,22.9,16.0,28.8,26.2,51.8,38.81,26.2,51.8,0.0,0.0,0.0,2.928228186,1995-09-13,1995,VERANO
AL41,14/09/1995,121.32,9.4,29.5,20.01,9.4,29.5,29.2,74.2,49.53,29.2,74.2,0.0,0.0,0.0,2.928228186,1995-09-14,1995,VERANO
AL41,15/09/1995,93.24,10.2,31.0,21.08,10.2,31.0,29.2,85.6,58.35,29.2,85.6,0.0,0.0,0.0,2.928228186,1995-09-15,1995,VERANO
AL41,16/09/1995,132.48,17.5,29.5,22.08,17.5,29.5,38.9,93.9,71.72,38.9,93.9,0.0,0.0,0.0,2.928228186,1995-09-16,1995,VERANO
AL41,17/09/1995,114.48,13.0,28.2,19.95,13.0,28.2,42.2,93.8,74.09,42.2,93.8,0.0,0.0,0.0,2.928228186,1995-09-17,1995,VERANO
AL41,18/09/1995,129.96,13.4,27.3,20.55,13.4,27.3,42.6,94.9,66.2,42.6,94.9,0.0,0.0,0.0,2.928228186,1995-09-18,1995,VERANO
AL41,19/09/1995,124.92,10.2,27.8,19.03,10.2,27.8,28.3,78.3,53.41,28.3,78.3,0.0,0.0,0.0,2.928228186,1995-09-19,1995,VERANO
AL41,20/09/1995,88.56,8.8,27.1,18.45,8.8,27.1,32.4,77.0,55.9,32.4,77.0,0.0,0.0,0.0,2.928228186,1995-09-20,1995,VERANO
AL41,21/09/1995,114.84,11.1,27.4,18.79,11.1,27.4,36.2,81.0,60.82,36.2,81.0,0.0,0.0,0.0,2.928228186,1995-09-21,1995,VERANO
AL41,22/09/1995,79.92,10.1,27.4,18.73,10.1,27.4,40.5,92.3,72.89,40.5,92.3,0.1,0.0,0.0,2.928228186,1995-09-22,1995,VERANO
AL41,23/09/1995,77.4,12.1,23.8,16.65,12.1,23.8,50.9,96.0,82.95,50.9,96.0,7.8,0.0,0.0,2.928228186,1995-09-23,1995,OTOÑO
AL41,24/09/1995,141.48,10.2,24.3,16.66,10.2,24.3,46.1,97.6,79.78,46.1,97.6,25.6,0.0,0.0,2.928228186,1995-09-24,1995,OTOÑO
AL41,25/09/1995,10.8,,,,,,,,,,,,,,2.928228186,1995-09-25,1995,OTOÑO
AL41,26/09/1995,,,,,,,,,,,,,,,,1995-09-26,1995,OTOÑO
AL41,27/09/1995,48.6,,,,,,,,,,,,,,2.928228186,1995-09-27,1995,OTOÑO
AL41,28/09/1995,83.88,9.0,29.6,18.57,9.0,29.6,24.8,95.2,65.46,24.8,95.2,0.0,0.0,0.0,2.928228186,1995-09-28,1995,OTOÑO
AL41,29/09/1995,70.92,8.8,31.2,19.13,8.8,31.2,25.6,93.4,60.13,25.6,93.4,0.0,0.0,0.0,2.928228186,1995-09-29,1995,OTOÑO
AL41,30/09/1995,88.2,12.4,28.7,19.41,12.4,28.7,35.7,96.1,74.11,35.7,96.1,0.0,0.0,0.0,2.928228186,1995-09-30,1995,OTOÑO
AL41,01/10/1995,79.2,11.5,29.3,19.74,11.5,29.3,29.7,94.4,71.5,29.7,94.4,0.0,0.0,0.0,2.928228186,1995-10-01,1995,OTOÑO
AL41,02/10/1995,72.0,13.0,30.0,20.25,13.0,30.0,32.3,95.4,70.6,32.3,95.4,0.0,0.0,0.0,2.928228186,1995-10-02,1995,OTOÑO
AL41,03/10/1995,88.92,17.1,28.9,21.73,17.1,28.9,43.4,90.6,69.65,43.4,90.6,0.0,0.0,0.0,2.928228186,1995-10-03,1995,OTOÑO
AL41,04/10/1995,90.72,12.0,29.7,20.55,12.0,29.7,35.7,93.8,70.11,35.7,93.8,5.5,0.0,0.0,2.928228186,1995-10-04,1995,OTOÑO
AL41,05/10/1995,98.28,16.9,25.8,20.33,16.9,25.8,47.4,94.9,79.7,47.4,94.9,0.1,0.0,0.0,2.928228186,1995-10-05,1995,OTOÑO
AL41,06/10/1995,123.48,17.0,25.4,20.44,17.0,25.4,50.9,93.3,75.48,50.9,93.3,0.4,0.0,0.0,2.928228186,1995-10-06,1995,OTOÑO
AL41,07/10/1995,163.08,17.2,25.2,20.39,17.2,25.2,48.0,94.1,76.49,48.0,94.1,0.0,0.0,0.0,2.928228186,1995-10-07,1995,OTOÑO
AL41,08/10/1995,106.2,16.8,23.7,19.99,16.8,23.7,56.6,92.3,78.5,56.6,92.3,0.0,0.0,0.0,2.928228186,1995-10-08,1995,OTOÑO
AL41,09/10/1995,120.6,16.5,25.5,20.27,16.5,25.5,50.2,94.5,76.14,50.2,94.5,0.0,0.0,0.0,2.928228186,1995-10-09,1995,OTOÑO
AL41,10/10/1995,93.24,11.2,25.7,18.45,11.2,25.7,44.0,95.4,75.02,44.0,95.4,0.0,0.0,0.0,2.928228186,1995-10-10,1995,OTOÑO
AL41,11/10/1995,118.08,16.7,22.5,18.81,16.7,22.5,58.3,91.6,81.95,58.3,91.6,0.8,0.0,0.0,2.928228186,1995-10-11,1995,OTOÑO
AL41,12/10/1995,141.12,15.4,23.5,18.92,15.4,23.5,43.8,91.5,70.69,43.8,91.5,0.0,0.0,0.0,2.928228186,1995-10-12,1995,OTOÑO
AL41,13/10/1995,144.0,16.3,23.0,18.93,16.3,23.0,53.3,91.8,74.7,53.3,91.8,0.0,0.0,0.0,2.928228186,1995-10-13,1995,OTOÑO
AL41,14/10/1995,73.08,11.9,26.1,18.78,11.9,26.1,43.5,96.1,78.08,43.5,96.1,0.0,0.0,0.0,2.928228186,1995-10-14,1995,OTOÑO
AL41,15/10/1995,95.04,11.7,28.9,19.39,11.7,28.9,28.0,95.6,68.43,28.0,95.6,0.0,0.0,0.0,2.928228186,1995-10-15,1995,OTOÑO
AL41,16/10/1995,63.36,12.6,25.2,18.45,12.6,25.2,39.8,94.5,75.33,39.8,94.5,0.0,0.0,0.0,2.928228186,1995-10-16,1995,OTOÑO
AL41,17/10/1995,103.32,9.7,25.5,17.48,9.7,25.5,36.2,95.5,72.99,36.2,95.5,0.0,0.0,0.0,2.928228186,1995-10-17,1995,OTOÑO
AL41,18/10/1995,63.36,11.7,27.3,17.97,11.7,27.3,28.8,94.1,73.33,28.8,94.1,0.0,0.0,0.0,2.928228186,1995-10-18,1995,OTOÑO
AL41,19/10/1995,88.56,8.7,26.1,17.33,8.7,26.1,31.7,96.1,68.66,31.7,96.1,0.0,0.0,0.0,2.928228186,1995-10-19,1995,OTOÑO
AL41,20/10/1995,89.28,8.9,24.5,16.16,8.9,24.5,37.2,91.8,68.65,37.2,91.8,0.0,0.0,0.0,2.928228186,1995-10-20,1995,OTOÑO
AL41,21/10/1995,113.4,7.8,22.5,15.28,7.8,22.5,41.3,93.9,71.33,41.3,93.9,0.0,0.0,0.0,2.928228186,1995-10-21,1995,OTOÑO
AL41,22/10/1995,104.76,9.7,23.9,15.83,9.7,23.9,40.5,94.6,74.53,40.5,94.6,0.0,0.0,0.0,2.928228186,1995-10-22,1995,OTOÑO
AL41,23/10/1995,89.28,9.2,23.7,16.4,9.2,23.7,46.5,95.4,76.3,46.5,95.4,0.0,0.0,0.0,2.928228186,1995-10-23,1995,OTOÑO
AL41,24/10/1995,66.6,11.3,22.7,16.62,11.3,22.7,50.4,93.0,78.91,50.4,93.0,0.0,0.0,0.0,2.928228186,1995-10-24,1995,OTOÑO
AL41,25/10/1995,63.72,13.0,27.4,18.7,13.0,27.4,33.1,93.5,72.03,33.1,93.5,0.0,0.0,0.0,2.928228186,1995-10-25,1995,OTOÑO
AL41,26/10/1995,53.64,9.3,26.7,16.76,9.3,26.7,40.5,94.6,75.78,40.5,94.6,0.0,0.0,0.0,2.928228186,1995-10-26,1995,OTOÑO
AL41,27/10/1995,53.28,11.3,29.5,18.8,11.3,29.5,30.5,94.5,69.63,30.5,94.5,0.0,0.0,0.0,2.928228186,1995-10-27,1995,OTOÑO
AL41,28/10/1995,44.64,10.8,27.0,18.15,10.8,27.0,36.6,86.7,65.12,36.6,86.7,0.0,0.0,0.0,2.928228186,1995-10-28,1995,OTOÑO
AL41,29/10/1995,95.4,10.3,29.1,19.74,10.3,29.1,32.6,88.9,63.54,32.6,88.9,0.0,0.0,0.0,2.928228186,1995-10-29,1995,OTOÑO
AL41,30/10/1995,81.72,9.7,27.5,17.59,9.7,27.5,33.7,87.8,62.3,33.7,87.8,0.0,0.0,0.0,2.928228186,1995-10-30,1995,OTOÑO
AL41,31/10/1995,154.08,12.7,22.7,17.92,12.7,22.7,43.3,95.5,77.07,43.3,95.5,0.0,0.0,0.0,2.928228186,1995-10-31,1995,OTOÑO
AL41,01/11/1995,88.92,14.1,27.4,19.42,14.1,27.4,38.8,93.8,76.91,38.8,93.8,0.0,0.0,0.0,2.928228186,1995-11-01,1995,OTOÑO
AL41,02/11/1995,146.16,11.4,27.3,19.86,11.4,27.3,33.6,94.9,58.07,33.6,94.9,0.0,0.0,0.0,2.928228186,1995-11-02,1995,OTOÑO
AL41,03/11/1995,239.4,13.7,27.4,21.64,13.7,27.4,26.9,81.7,44.04,26.9,81.7,0.0,0.0,0.0,2.928228186,1995-11-03,1995,OTOÑO
AL41,04/11/1995,302.4,15.1,26.8,21.53,15.1,26.8,30.6,71.3,43.49,30.6,71.3,0.0,0.0,0.0,2.928228186,1995-11-04,1995,OTOÑO
AL41,05/11/1995,103.68,10.4,24.0,16.21,10.4,24.0,36.8,93.0,76.01,36.8,93.0,0.0,0.0,0.0,2.928228186,1995-11-05,1995,OTOÑO
AL41,06/11/1995,117.0,12.8,19.9,15.83,12.8,19.9,57.1,93.9,78.33,57.1,93.9,0.0,0.0,0.0,2.928228186,1995-11-06,1995,OTOÑO
AL41,07/11/1995,39.24,7.5,20.4,13.61,7.5,20.4,44.0,93.8,72.17,44.0,93.8,0.0,0.0,0.0,2.928228186,1995-11-07,1995,OTOÑO
AL41,08/11/1995,47.16,4.5,24.0,12.69,4.5,24.0,22.5,90.2,62.97,22.5,90.2,0.0,0.0,7.0,2.928228186,1995-11-08,1995,OTOÑO
AL41,09/11/1995,43.2,3.6,21.6,12.26,3.6,21.6,51.2,92.3,77.17,51.2,92.3,0.0,0.0,9.0,2.928228186,1995-11-09,1995,OTOÑO
AL41,10/11/1995,58.68,10.7,22.2,15.43,10.7,22.2,54.0,93.9,80.77,54.0,93.9,0.0,0.0,0.0,2.928228186,1995-11-10,1995,OTOÑO
AL41,11/11/1995,105.12,9.1,22.6,15.12,9.1,22.6,53.8,96.8,78.62,53.8,96.8,0.0,0.0,0.0,2.928228186,1995-11-11,1995,OTOÑO
AL41,12/11/1995,199.8,13.1,20.0,16.04,13.1,20.0,34.4,78.6,53.66,34.4,78.6,0.0,0.0,0.0,2.928228186,1995-11-12,1995,OTOÑO
AL41,13/11/1995,142.56,5.4,20.6,14.08,5.4,20.6,33.7,82.9,51.8,33.7,82.9,0.0,0.0,2.0,2.928228186,1995-11-13,1995,OTOÑO
AL41,14/11/1995,52.92,2.9,21.5,11.61,2.9,21.5,31.7,85.2,60.95,31.7,85.2,0.0,0.0,6.0,2.928228186,1995-11-14,1995,OTOÑO
AL41,15/11/1995,83.16,7.3,22.2,13.98,7.3,22.2,44.3,87.9,72.92,44.3,87.9,0.0,0.0,0.0,2.928228186,1995-11-15,1995,OTOÑO
AL41,16/11/1995,85.68,10.0,24.0,15.99,10.0,24.0,40.4,86.2,69.82,40.4,86.2,0.0,0.0,0.0,2.928228186,1995-11-16,1995,OTOÑO
AL41,17/11/1995,246.6,18.3,27.6,22.78,18.3,27.6,38.6,64.7,49.32,38.6,64.7,0.0,0.0,0.0,2.928228186,1995-11-17,1995,OTOÑO
AL41,18/11/1995,148.32,19.9,25.0,22.02,19.9,25.0,44.6,64.4,56.27,44.6,64.4,0.0,0.0,0.0,2.928228186,1995-11-18,1995,OTOÑO
AL41,19/11/1995,45.0,12.2,25.9,17.58,12.2,25.9,45.2,88.8,70.2,45.2,88.8,0.0,0.0,0.0,2.928228186,1995-11-19,1995,OTOÑO
AL41,20/11/1995,46.08,8.1,26.9,16.53,8.1,26.9,34.5,94.0,69.68,34.5,94.0,0.0,0.0,0.0,2.928228186,1995-11-20,1995,OTOÑO
AL41,21/11/1995,100.8,11.6,28.0,18.66,11.6,28.0,36.5,95.4,68.07,36.5,95.4,0.0,0.0,0.0,2.928228186,1995-11-21,1995,OTOÑO
AL41,22/11/1995,158.76,11.8,20.7,16.63,11.8,20.7,32.8,94.8,54.53,32.8,94.8,0.0,0.0,0.0,2.928228186,1995-11-22,1995,OTOÑO
AL41,23/11/1995,233.64,6.9,19.1,14.75,6.9,19.1,41.0,76.8,50.17,41.0,76.8,0.0,0.0,1.0,2.928228186,1995-11-23,1995,OTOÑO
AL41,24/11/1995,62.28,2.1,20.6,10.45,2.1,20.6,35.7,92.0,72.84,35.7,92.0,0.0,0.0,10.0,2.928228186,1995-11-24,1995,OTOÑO
AL41,25/11/1995,54.0,4.5,15.8,10.76,4.5,15.8,68.3,95.3,85.32,68.3,95.3,1.3,0.0,7.0,2.928228186,1995-11-25,1995,OTOÑO
AL41,26/11/1995,85.32,2.7,16.6,9.73,2.7,16.6,38.2,96.1,68.62,38.2,96.1,0.1,0.0,9.0,2.928228186,1995-11-26,1995,OTOÑO
AL41,27/11/1995,49.68,-2.2,17.2,6.48,-2.2,17.2,30.2,94.5,67.48,30.2,94.5,0.0,7.0,14.0,2.928228186,1995-11-27,1995,OTOÑO
AL41,28/11/1995,53.64,-0.5,18.6,8.3,-0.5,18.6,41.3,96.5,74.45,41.3,96.5,0.0,4.0,11.0,2.928228186,1995-11-28,1995,OTOÑO
AL41,29/11/1995,168.84,6.3,17.7,11.52,6.3,17.7,53.2,92.2,76.27,53.2,92.2,0.0,0.0,1.0,2.928228186,1995-11-29,1995,OTOÑO
AL41,30/11/1995,69.84,3.8,19.1,11.85,3.8,19.1,48.9,97.5,78.76,48.9,97.5,1.8,0.0,8.0,2.928228186,1995-11-30,1995,OTOÑO
AL41,01/12/1995,128.16,8.8,16.9,13.55,8.8,16.9,52.3,95.3,71.74,52.3,95.3,0.0,0.0,0.0,2.928228186,1995-12-01,1995,OTOÑO
AL41,02/12/1995,129.96,5.8,18.1,12.43,5.8,18.1,44.2,89.7,67.68,44.2,89.7,0.0,0.0,2.0,2.928228186,1995-12-02,1995,OTOÑO
AL41,03/12/1995,143.64,4.1,19.9,11.99,4.1,19.9,36.7,91.5,63.3,36.7,91.5,0.0,0.0,9.0,2.928228186,1995-12-03,1995,OTOÑO
AL41,04/12/1995,155.52,4.6,21.0,12.2,4.6,21.0,32.9,86.9,57.84,32.9,86.9,0.0,0.0,5.0,2.928228186,1995-12-04,1995,OTOÑO
AL41,05/12/1995,187.2,7.8,15.8,11.6,7.8,15.8,45.5,64.5,55.5,45.5,64.5,0.0,0.0,0.0,2.928228186,1995-12-05,1995,OTOÑO
AL41,06/12/1995,64.44,3.9,16.7,9.24,3.9,16.7,50.5,87.3,71.67,50.5,87.3,0.0,0.0,11.0,2.928228186,1995-12-06,1995,OTOÑO
AL41,07/12/1995,61.2,5.2,13.3,9.78,5.2,13.3,79.8,96.8,89.63,79.8,96.8,4.6,0.0,5.0,2.928228186,1995-12-07,1995,OTOÑO
AL41,08/12/1995,45.36,4.9,15.4,9.89,4.9,15.4,55.5,96.8,85.4,55.5,96.8,0.1,0.0,4.0,2.928228186,1995-12-08,1995,OTOÑO
AL41,09/12/1995,88.2,5.8,13.3,10.23,5.8,13.3,80.6,96.0,89.29,80.6,96.0,0.0,0.0,2.0,2.928228186,1995-12-09,1995,OTOÑO
AL41,10/12/1995,160.2,9.9,16.8,12.95,9.9,16.8,60.3,94.6,79.96,60.3,94.6,0.6,0.0,0.0,2.928228186,1995-12-10,1995,OTOÑO
AL41,11/12/1995,152.28,10.5,17.4,13.04,10.5,17.4,51.8,93.8,78.89,51.8,93.8,0.1,0.0,0.0,2.928228186,1995-12-11,1995,OTOÑO
AL41,12/12/1995,119.88,5.6,17.0,11.08,5.6,17.0,48.2,93.8,75.96,48.2,93.8,0.0,0.0,3.0,2.928228186,1995-12-12,1995,OTOÑO
AL41,13/12/1995,51.84,1.3,20.4,9.35,1.3,20.4,29.0,97.4,74.77,29.0,97.4,0.0,0.0,10.0,2.928228186,1995-12-13,1995,OTOÑO
AL41,14/12/1995,211.68,3.6,10.2,7.81,3.6,10.2,53.5,95.6,72.68,53.5,95.6,1.3,0.0,7.0,2.928228186,1995-12-14,1995,OTOÑO
AL41,15/12/1995,254.52,7.3,11.2,9.16,7.3,11.2,87.2,95.3,90.71,87.2,95.3,4.4,0.0,0.0,2.928228186,1995-12-15,1995,OTOÑO
AL41,16/12/1995,57.6,7.5,18.1,10.96,7.5,18.1,45.4,96.8,83.1,45.4,96.8,0.0,0.0,0.0,2.928228186,1995-12-16,1995,OTOÑO
AL41,17/12/1995,64.44,4.4,18.3,9.93,4.4,18.3,42.2,96.1,77.33,42.2,96.1,0.0,0.0,12.0,2.928228186,1995-12-17,1995,OTOÑO
AL41,18/12/1995,50.04,1.1,17.4,8.29,1.1,17.4,46.2,96.1,81.62,46.2,96.1,0.0,0.0,10.0,2.928228186,1995-12-18,1995,OTOÑO
AL41,19/12/1995,51.12,3.6,14.8,8.32,3.6,14.8,60.9,96.8,86.23,60.9,96.8,0.0,0.0,11.0,2.928228186,1995-12-19,1995,OTOÑO
AL41,20/12/1995,44.64,4.2,21.1,11.5,4.2,21.1,44.8,96.3,77.68,44.8,96.3,0.0,0.0,9.0,2.928228186,1995-12-20,1995,OTOÑO
AL41,21/12/1995,45.0,5.4,21.4,12.02,5.4,21.4,42.8,96.1,80.64,42.8,96.1,0.0,0.0,4.0,2.928228186,1995-12-21,1995,OTOÑO
AL41,22/12/1995,87.84,7.2,20.1,12.9,7.2,20.1,49.1,96.1,80.99,49.1,96.1,0.1,0.0,0.0,2.928228186,1995-12-22,1995,INVIERNO
AL41,23/12/1995,156.96,16.5,19.1,17.39,16.5,19.1,47.7,81.6,62.65,47.7,81.6,0.0,0.0,0.0,2.928228186,1995-12-23,1995,INVIERNO
AL41,24/12/1995,209.88,16.0,24.1,18.98,16.0,24.1,40.2,72.0,58.19,40.2,72.0,0.0,0.0,0.0,2.928228186,1995-12-24,1995,INVIERNO
AL41,25/12/1995,194.4,14.7,24.0,19.0,14.7,24.0,40.9,73.2,56.97,40.9,73.2,0.0,0.0,0.0,2.928228186,1995-12-25,1995,INVIERNO
AL41,26/12/1995,289.8,16.8,22.4,19.0,16.8,22.4,35.9,67.4,49.39,35.9,67.4,0.0,0.0,0.0,2.928228186,1995-12-26,1995,INVIERNO
AL41,27/12/1995,133.56,9.3,17.4,13.22,9.3,17.4,43.2,93.0,67.29,43.2,93.0,0.0,0.0,0.0,2.928228186,1995-12-27,1995,INVIERNO
AL41,28/12/1995,158.76,8.0,20.9,13.5,8.0,20.9,32.5,95.3,60.29,32.5,95.3,0.0,0.0,0.0,2.928228186,1995-12-28,1995,INVIERNO
AL41,29/12/1995,82.8,7.6,15.3,11.3,7.6,15.3,60.4,89.9,76.27,60.4,89.9,0.0,0.0,0.0,2.928228186,1995-12-29,1995,INVIERNO
AL41,30/12/1995,123.48,11.3,18.2,14.52,11.3,18.2,73.7,94.6,86.54,73.7,94.6,0.3,0.0,0.0,2.928228186,1995-12-30,1995,INVIERNO
AL41,31/12/1995,196.92,13.2,21.7,17.12,13.2,21.7,37.4,73.6,52.87,37.4,73.6,0.0,0.0,0.0,2.928228186,1995-12-31,1995,INVIERNO
AL41,01/01/1996,241.2,9.3,23.5,16.95,9.3,23.5,29.1,85.6,50.65,29.1,85.6,0.0,0.0,0.0,2.658551475,1996-01-01,1996,INVIERNO
AL41,02/01/1996,90.0,5.9,21.4,13.54,5.9,21.4,34.4,80.5,57.54,34.4,80.5,0.0,0.0,2.0,1.3042162,1996-01-02,1996,INVIERNO
AL41,03/01/1996,65.52,7.8,21.6,12.95,7.8,21.6,39.1,83.2,66.8,39.1,83.2,0.0,0.0,0.0,1.100860797,1996-01-03,1996,INVIERNO
AL41,04/01/1996,57.6,5.5,18.1,11.28,5.5,18.1,52.8,93.8,76.79,52.8,93.8,0.0,0.0,4.0,0.884302605,1996-01-04,1996,INVIERNO
AL41,05/01/1996,168.84,8.4,20.3,13.85,8.4,20.3,38.2,94.7,66.82,38.2,94.7,0.0,0.0,0.0,1.577720305,1996-01-05,1996,INVIERNO
AL41,06/01/1996,99.36,8.3,24.7,14.99,8.3,24.7,41.0,80.5,65.51,41.0,80.5,0.0,0.0,0.0,1.425123413,1996-01-06,1996,INVIERNO
AL41,07/01/1996,181.08,8.4,20.9,15.3,8.4,20.9,30.8,91.5,54.75,30.8,91.5,0.0,0.0,0.0,2.024322237,1996-01-07,1996,INVIERNO
AL41,08/01/1996,77.04,2.3,19.5,9.72,2.3,19.5,39.4,92.8,73.54,39.4,92.8,0.0,0.0,10.0,1.045551407,1996-01-08,1996,INVIERNO
AL41,09/01/1996,74.16,5.1,12.4,9.48,5.1,12.4,68.2,97.5,92.86,68.2,97.5,5.5,0.0,3.0,0.596411086,1996-01-09,1996,INVIERNO
AL41,10/01/1996,87.84,4.5,16.9,9.83,4.5,16.9,39.3,92.4,68.4,39.3,92.4,0.0,0.0,8.0,1.091432139,1996-01-10,1996,INVIERNO
AL41,11/01/1996,86.4,6.8,17.2,11.02,6.8,17.2,50.1,95.6,80.18,50.1,95.6,0.3,0.0,2.0,0.981009192,1996-01-11,1996,INVIERNO
AL41,12/01/1996,217.8,10.0,15.0,12.64,10.0,15.0,42.0,95.6,55.48,42.0,95.6,0.0,0.0,0.0,2.013263781,1996-01-12,1996,INVIERNO
AL41,13/01/1996,222.12,4.2,16.8,12.0,4.2,16.8,32.5,69.6,42.86,32.5,69.6,0.0,0.0,2.0,2.337661437,1996-01-13,1996,INVIERNO
AL41,14/01/1996,47.52,0.0,15.9,7.27,0.0,15.9,47.9,91.8,75.89,47.9,91.8,0.0,0.0,11.0,0.865473609,1996-01-14,1996,INVIERNO
AL41,15/01/1996,211.32,9.8,16.8,12.82,9.8,16.8,60.2,93.6,83.19,60.2,93.6,0.0,0.0,0.0,1.268863358,1996-01-15,1996,INVIERNO
AL41,16/01/1996,198.72,9.0,15.0,12.25,9.0,15.0,69.0,95.4,85.1,69.0,95.4,0.0,0.0,0.0,1.101215811,1996-01-16,1996,INVIERNO
AL41,17/01/1996,250.56,,,,,,,,,,,,,,,1996-01-17,1996,INVIERNO
AL41,18/01/1996,250.56,,,,,,,,,,,,,,,1996-01-18,1996,INVIERNO
AL41,19/01/1996,250.56,,,,,,,,,,,,,,,1996-01-19,1996,INVIERNO
AL41,20/01/1996,178.56,5.9,15.6,11.65,5.9,15.6,51.9,93.3,69.83,51.9,93.3,0.0,0.0,2.0,1.215657402,1996-01-20,1996,INVIERNO
AL41,21/01/1996,66.96,4.6,14.6,9.57,4.6,14.6,75.5,96.1,89.68,75.5,96.1,0.0,0.0,10.0,0.909945642,1996-01-21,1996,INVIERNO
AL41,22/01/1996,95.76,10.4,16.3,12.4,10.4,16.3,64.2,93.5,83.12,64.2,93.5,1.2,0.0,0.0,1.193042141,1996-01-22,1996,INVIERNO
AL41,23/01/1996,165.96,10.7,16.6,12.59,10.7,16.6,43.9,94.5,71.86,43.9,94.5,0.1,0.0,0.0,1.578605844,1996-01-23,1996,INVIERNO
AL41,24/01/1996,197.28,7.9,15.5,11.05,7.9,15.5,38.9,84.2,60.03,38.9,84.2,0.0,0.0,0.0,1.89690638,1996-01-24,1996,INVIERNO
AL41,25/01/1996,101.88,1.8,16.4,8.65,1.8,16.4,39.2,92.4,67.47,39.2,92.4,0.0,0.0,12.0,1.331644416,1996-01-25,1996,INVIERNO
AL41,26/01/1996,66.96,0.1,15.0,7.3,0.1,15.0,45.4,94.5,77.53,45.4,94.5,0.0,0.0,10.0,1.077531222,1996-01-26,1996,INVIERNO
AL41,27/01/1996,97.2,4.1,14.6,9.63,4.1,14.6,65.4,96.3,85.19,65.4,96.3,0.0,0.0,9.0,1.094352418,1996-01-27,1996,INVIERNO
AL41,28/01/1996,89.64,4.4,18.0,11.39,4.4,18.0,46.4,96.7,82.36,46.4,96.7,0.0,0.0,5.0,1.254873839,1996-01-28,1996,INVIERNO
AL41,29/01/1996,61.56,5.3,18.0,11.28,5.3,18.0,37.6,95.3,73.28,37.6,95.3,0.0,0.0,3.0,1.298422269,1996-01-29,1996,INVIERNO
AL41,30/01/1996,82.8,3.0,17.8,9.92,3.0,17.8,36.0,91.0,67.48,36.0,91.0,0.0,0.0,8.0,1.411347748,1996-01-30,1996,INVIERNO
AL41,31/01/1996,95.4,2.3,13.6,8.86,2.3,13.6,63.4,95.8,81.7,63.4,95.8,0.0,0.0,10.0,1.108829015,1996-01-31,1996,INVIERNO
AL41,01/02/1996,92.52,9.8,16.4,12.13,9.8,16.4,46.4,96.1,79.45,46.4,96.1,1.8,0.0,0.0,1.316366326,1996-02-01,1996,INVIERNO
AL41,02/02/1996,198.36,6.3,18.7,12.65,6.3,18.7,31.6,80.4,53.85,31.6,80.4,0.0,0.0,2.0,2.385091167,1996-02-02,1996,INVIERNO
AL41,03/02/1996,128.52,0.0,16.6,8.52,0.0,16.6,35.0,94.5,67.17,35.0,94.5,0.0,0.0,9.0,1.565573475,1996-02-03,1996,INVIERNO
AL41,04/02/1996,206.64,9.6,17.1,12.45,9.6,17.1,32.1,66.9,47.49,32.1,66.9,0.0,0.0,0.0,2.623690615,1996-02-04,1996,INVIERNO
AL41,05/02/1996,146.16,5.3,18.0,12.28,5.3,18.0,27.3,67.5,47.13,27.3,67.5,0.0,0.0,2.0,2.231689969,1996-02-05,1996,INVIERNO
AL41,06/02/1996,527.4,14.0,22.4,18.17,14.0,22.4,30.8,58.7,43.47,30.8,58.7,0.0,0.0,0.0,5.220738546,1996-02-06,1996,INVIERNO
AL41,07/02/1996,168.12,6.7,23.3,15.91,6.7,23.3,30.7,62.3,43.8,30.7,62.3,0.0,0.0,1.0,2.858190903,1996-02-07,1996,INVIERNO
AL41,08/02/1996,279.36,12.1,19.3,16.05,12.1,19.3,24.3,37.9,29.92,24.3,37.9,0.0,0.0,0.0,4.065736341,1996-02-08,1996,INVIERNO
AL41,09/02/1996,66.96,2.2,15.9,9.56,2.2,15.9,38.1,86.7,58.59,38.1,86.7,0.0,0.0,9.0,1.524838411,1996-02-09,1996,INVIERNO
AL41,10/02/1996,109.8,4.5,18.7,10.76,4.5,18.7,34.5,90.2,70.54,34.5,90.2,0.0,0.0,9.0,1.744291164,1996-02-10,1996,INVIERNO
AL41,11/02/1996,183.6,6.3,17.4,12.0,6.3,17.4,27.2,92.8,51.18,27.2,92.8,0.0,0.0,1.0,2.476925324,1996-02-11,1996,INVIERNO
AL41,12/02/1996,98.64,-0.1,18.9,9.25,-0.1,18.9,26.4,81.7,56.07,26.4,81.7,0.0,1.0,9.0,1.926286905,1996-02-12,1996,INVIERNO
AL41,13/02/1996,107.28,6.6,21.6,13.71,6.6,21.6,35.7,80.2,56.65,35.7,80.2,0.0,0.0,2.0,2.175797665,1996-02-13,1996,INVIERNO
AL41,14/02/1996,136.44,5.8,18.1,10.18,5.8,18.1,49.9,96.8,80.0,49.9,96.8,12.9,0.0,4.0,1.660734622,1996-02-14,1996,INVIERNO
AL41,15/02/1996,225.36,5.5,9.7,7.45,5.5,9.7,58.9,96.0,80.37,58.9,96.0,5.3,0.0,11.0,1.298401669,1996-02-15,1996,INVIERNO
AL41,16/02/1996,145.08,3.8,14.1,8.6,3.8,14.1,39.1,91.5,60.94,39.1,91.5,0.0,0.0,10.0,1.958616008,1996-02-16,1996,INVIERNO
AL41,17/02/1996,63.72,0.1,18.0,7.92,0.1,18.0,31.1,96.3,73.0,31.1,96.3,0.0,0.0,11.0,1.771112106,1996-02-17,1996,INVIERNO
AL41,18/02/1996,74.88,1.5,18.5,9.2,1.5,18.5,41.6,96.7,77.09,41.6,96.7,0.0,0.0,11.0,1.829731455,1996-02-18,1996,INVIERNO
AL41,19/02/1996,218.88,4.4,19.1,11.98,4.4,19.1,26.9,94.0,52.7,26.9,94.0,0.0,0.0,2.0,2.873195352,1996-02-19,1996,INVIERNO
AL41,20/02/1996,242.28,6.2,12.8,8.98,6.2,12.8,28.3,62.9,45.63,28.3,62.9,0.0,0.0,3.0,2.812173523,1996-02-20,1996,INVIERNO
AL41,21/02/1996,262.08,3.4,11.7,7.42,3.4,11.7,28.4,46.4,37.08,28.4,46.4,0.0,0.0,14.0,2.955819402,1996-02-21,1996,INVIERNO
AL41,22/02/1996,288.36,4.3,12.7,7.63,4.3,12.7,25.7,43.2,35.88,25.7,43.2,0.0,0.0,12.0,3.25145728,1996-02-22,1996,INVIERNO
AL41,23/02/1996,107.64,0.9,15.2,7.48,0.9,15.2,21.9,78.8,42.8,21.9,78.8,0.0,0.0,14.0,2.245961225,1996-02-23,1996,INVIERNO
AL41,24/02/1996,86.4,-2.1,16.3,6.13,-2.1,16.3,26.9,89.6,61.76,26.9,89.6,0.0,8.0,13.0,1.980506685,1996-02-24,1996,INVIERNO
AL41,25/02/1996,80.64,-1.6,16.9,7.13,-1.6,16.9,37.2,96.0,73.46,37.2,96.0,0.0,4.0,10.0,1.915574008,1996-02-25,1996,INVIERNO
AL41,26/02/1996,104.4,1.1,15.3,8.49,1.1,15.3,38.5,96.8,65.32,38.5,96.8,0.0,0.0,10.0,1.841505511,1996-02-26,1996,INVIERNO
AL41,27/02/1996,288.72,5.1,9.7,7.74,5.1,9.7,52.8,72.2,62.36,52.8,72.2,0.7,0.0,8.0,2.141704257,1996-02-27,1996,INVIERNO
AL41,28/02/1996,199.44,5.0,17.9,11.96,5.0,17.9,28.4,80.6,49.4,28.4,80.6,0.0,0.0,3.0,2.942429029,1996-02-28,1996,INVIERNO
AL41,29/02/1996,65.52,0.5,17.4,8.55,0.5,17.4,39.8,94.3,71.99,39.8,94.3,0.0,0.0,11.0,2.046484629,1996-02-29,1996,INVIERNO
AL41,01/03/1996,81.72,1.3,18.6,9.07,1.3,18.6,35.4,97.8,76.1,35.4,97.8,0.0,0.0,9.0,2.147599064,1996-03-01,1996,INVIERNO
AL41,02/03/1996,143.64,1.1,17.3,9.8,1.1,17.3,32.0,97.2,63.22,32.0,97.2,0.0,0.0,9.0,2.331989811,1996-03-02,1996,INVIERNO
AL41,03/03/1996,140.4,5.1,16.1,10.59,5.1,16.1,45.6,91.6,72.59,45.6,91.6,0.0,0.0,4.0,2.262575388,1996-03-03,1996,INVIERNO
AL41,04/03/1996,127.08,6.3,13.9,10.28,6.3,13.9,51.1,93.3,76.46,51.1,93.3,0.0,0.0,1.0,2.037073442,1996-03-04,1996,INVIERNO
AL41,05/03/1996,134.28,4.5,13.4,8.83,4.5,13.4,51.6,96.8,79.65,51.6,96.8,0.2,0.0,6.0,1.789159886,1996-03-05,1996,INVIERNO
AL41,06/03/1996,235.44,7.7,14.1,10.51,7.7,14.1,38.8,80.6,65.62,38.8,80.6,0.0,0.0,0.0,2.571842001,1996-03-06,1996,INVIERNO
AL41,07/03/1996,131.4,8.9,12.3,10.65,8.9,12.3,61.9,94.8,70.72,61.9,94.8,2.4,0.0,0.0,1.979683192,1996-03-07,1996,INVIERNO
AL41,08/03/1996,128.52,8.5,12.6,9.9,8.5,12.6,69.6,96.4,87.97,69.6,96.4,4.7,0.0,0.0,1.760351766,1996-03-08,1996,INVIERNO
AL41,09/03/1996,147.96,8.6,11.4,10.27,8.6,11.4,68.9,91.6,79.77,68.9,91.6,0.9,0.0,0.0,1.653639746,1996-03-09,1996,INVIERNO
AL41,10/03/1996,194.04,9.9,13.7,11.3,9.9,13.7,61.8,93.4,73.13,61.8,93.4,0.0,0.0,0.0,2.264423829,1996-03-10,1996,INVIERNO
AL41,11/03/1996,93.96,5.4,15.4,10.47,5.4,15.4,55.3,96.4,81.45,55.3,96.4,0.2,0.0,4.0,2.229314414,1996-03-11,1996,INVIERNO
AL41,12/03/1996,159.48,6.2,15.7,10.03,6.2,15.7,43.2,95.6,75.4,43.2,95.6,0.1,0.0,3.0,2.434387227,1996-03-12,1996,INVIERNO
AL41,13/03/1996,92.88,2.8,13.2,8.57,2.8,13.2,62.7,96.1,85.24,62.7,96.1,0.1,0.0,10.0,1.957345065,1996-03-13,1996,INVIERNO
AL41,14/03/1996,132.84,2.8,16.4,9.32,2.8,16.4,32.1,96.1,68.65,32.1,96.1,0.0,0.0,8.0,2.517637406,1996-03-14,1996,INVIERNO
AL41,15/03/1996,162.0,4.2,17.2,10.78,4.2,17.2,26.0,84.1,52.42,26.0,84.1,0.0,0.0,8.0,3.109416093,1996-03-15,1996,INVIERNO
AL41,16/03/1996,227.88,7.2,16.2,11.87,7.2,16.2,25.8,64.8,41.6,25.8,64.8,0.0,0.0,0.0,3.721660983,1996-03-16,1996,INVIERNO
AL41,17/03/1996,151.2,4.8,19.3,11.95,4.8,19.3,23.4,73.0,40.2,23.4,73.0,0.0,0.0,2.0,3.524295039,1996-03-17,1996,INVIERNO
AL41,18/03/1996,114.84,-0.6,18.9,9.35,-0.6,18.9,25.9,90.7,65.1,25.9,90.7,0.0,2.0,9.0,2.719882642,1996-03-18,1996,INVIERNO
AL41,19/03/1996,87.48,1.8,19.2,11.18,1.8,19.2,29.5,95.3,67.86,29.5,95.3,0.0,0.0,7.0,2.697576579,1996-03-19,1996,INVIERNO
AL41,20/03/1996,102.96,6.0,22.3,13.55,6.0,22.3,37.3,94.5,69.89,37.3,94.5,0.0,0.0,3.0,3.038997339,1996-03-20,1996,INVIERNO
AL41,21/03/1996,99.36,4.6,23.1,13.53,4.6,23.1,33.4,93.6,66.01,33.4,93.6,0.0,0.0,5.0,3.131528824,1996-03-21,1996,PRIMAVERA
AL41,22/03/1996,103.68,4.3,22.4,13.8,4.3,22.4,33.0,93.0,61.07,33.0,93.0,0.0,0.0,7.0,3.288163089,1996-03-22,1996,PRIMAVERA
AL41,23/03/1996,231.12,10.6,23.8,16.22,10.6,23.8,37.1,88.4,57.4,37.1,88.4,0.0,0.0,0.0,4.21998285,1996-03-23,1996,PRIMAVERA
AL41,24/03/1996,122.76,8.3,22.1,15.87,8.3,22.1,43.1,94.7,70.2,43.1,94.7,2.9,0.0,0.0,3.207091349,1996-03-24,1996,PRIMAVERA
AL41,25/03/1996,76.32,12.6,18.7,14.97,12.6,18.7,72.9,95.6,90.79,72.9,95.6,0.2,0.0,0.0,2.441341271,1996-03-25,1996,PRIMAVERA
AL41,26/03/1996,136.44,13.9,23.5,17.78,13.9,23.5,30.2,95.4,61.63,30.2,95.4,1.7,0.0,0.0,3.755928618,1996-03-26,1996,PRIMAVERA
AL41,27/03/1996,101.52,9.6,23.5,16.4,9.6,23.5,33.5,78.2,53.62,33.5,78.2,0.0,0.0,0.0,3.587785222,1996-03-27,1996,PRIMAVERA
AL41,28/03/1996,123.84,11.2,24.9,17.57,11.2,24.9,33.4,72.0,52.31,33.4,72.0,0.0,0.0,0.0,4.041557893,1996-03-28,1996,PRIMAVERA
AL41,29/03/1996,102.24,7.6,25.4,17.01,7.6,25.4,29.2,89.8,56.34,29.2,89.8,0.0,0.0,0.0,3.818139469,1996-03-29,1996,PRIMAVERA
AL41,30/03/1996,249.84,10.7,24.9,18.23,10.7,24.9,27.4,89.9,51.07,27.4,89.9,0.0,0.0,0.0,4.79143691,1996-03-30,1996,PRIMAVERA
AL41,31/03/1996,104.4,11.5,24.5,17.93,11.5,24.5,34.7,86.3,55.04,34.7,86.3,0.0,0.0,0.0,3.801501934,1996-03-31,1996,PRIMAVERA
AL41,01/04/1996,316.44,11.8,23.7,17.96,11.8,23.7,31.7,84.7,48.5,31.7,84.7,0.0,0.0,0.0,5.177912354,1996-04-01,1996,PRIMAVERA
AL41,02/04/1996,212.76,9.7,21.9,16.58,9.7,21.9,31.4,66.2,46.64,31.4,66.2,0.0,0.0,0.0,4.571129513,1996-04-02,1996,PRIMAVERA
AL41,03/04/1996,243.0,11.0,21.9,15.44,11.0,21.9,17.2,81.8,48.39,17.2,81.8,0.1,0.0,0.0,4.755393128,1996-04-03,1996,PRIMAVERA
AL41,04/04/1996,120.96,3.8,19.0,12.25,3.8,19.0,44.7,87.7,65.92,44.7,87.7,0.0,0.0,6.0,3.376884766,1996-04-04,1996,PRIMAVERA
AL41,05/04/1996,81.36,7.1,13.2,10.32,7.1,13.2,65.3,95.2,83.48,65.3,95.2,1.3,0.0,0.0,2.513141773,1996-04-05,1996,PRIMAVERA
AL41,06/04/1996,98.64,5.4,19.0,12.29,5.4,19.0,50.2,97.2,78.88,50.2,97.2,1.2,0.0,7.0,3.004521701,1996-04-06,1996,PRIMAVERA
AL41,07/04/1996,130.68,10.1,21.9,15.42,10.1,21.9,35.7,95.4,69.99,35.7,95.4,0.3,0.0,0.0,3.556973542,1996-04-07,1996,PRIMAVERA
