CODEST,FECHA,VVMED,VVMAX,RVIENTO,DVMED,TMIN,TMAX,TMED,TMINABS,TMAXABS,HRMIN,HRMAX,HRMED,HRMINABS,HRMAXABS,RADMED,RADMAX,HSOL,PREC,HORAS0,HORAS7,DEWPT,DPV,ETO_PM_FAO,FECHA_2,AÑO,ESTACION
AL41,23/04/2010,1.51,8.23,130.06,145.15,9.74,21.44,16.07,9.25,22.37,53.26,95.6,80.23,45.31,95.7,185.77,1304.0,11.0,0.1,0.0,0.0,12.41,0.51,3.010548433,2010-04-23,2010,PRIMAVERA
AL41,24/04/2010,1.64,8.13,141.92,176.62,10.79,25.06,17.78,10.33,26.12,39.99,90.7,70.95,37.17,92.1,284.05,1229.0,12.0,0.0,0.0,0.0,11.81,0.74,4.496808253,2010-04-24,2010,PRIMAVERA
AL41,25/04/2010,1.54,8.43,132.96,94.79,11.79,24.97,17.31,11.33,26.01,47.81,93.4,73.84,41.66,93.9,237.67,992.0,10.0,0.0,0.0,0.0,12.08,0.64,3.886668604,2010-04-25,2010,PRIMAVERA
AL41,26/04/2010,1.75,9.11,151.19,130.98,8.98,25.68,17.27,8.42,26.01,31.02,92.8,62.91,28.37,93.5,325.04,982.0,12.0,0.0,0.0,0.0,8.83,0.96,5.082195797,2010-04-26,2010,PRIMAVERA
AL41,27/04/2010,1.92,10.19,165.98,174.0,8.59,28.48,18.05,7.913,28.76,28.73,90.7,59.11,26.41,92.0,320.28,1059.0,12.0,0.0,0.0,0.0,8.47,1.14,5.563509251,2010-04-27,2010,PRIMAVERA
AL41,28/04/2010,2.15,8.13,185.76,110.5,13.21,25.09,18.55,12.55,25.64,36.07,91.5,64.39,33.56,92.0,323.58,972.0,12.0,0.0,0.0,0.0,10.86,0.9,5.226897827,2010-04-28,2010,PRIMAVERA
AL41,29/04/2010,1.76,7.84,151.99,175.51,8.36,25.51,17.32,7.846,25.98,26.62,90.9,59.02,22.4,91.6,287.09,936.0,12.0,0.0,0.0,0.0,7.55,1.05,4.861233762,2010-04-29,2010,PRIMAVERA
AL41,30/04/2010,1.7,7.448,147.03,165.71,9.65,25.56,17.89,9.36,26.22,23.23,91.1,64.7,20.75,92.5,256.64,1069.0,11.0,0.0,0.0,0.0,9.64,0.93,4.660973744,2010-04-30,2010,PRIMAVERA
AL41,01/05/2010,1.84,8.13,159.3,145.62,13.49,24.96,18.82,13.19,25.54,48.36,92.1,75.52,42.13,93.0,266.35,1244.0,12.0,2.5,0.0,0.0,14.0,0.62,4.362789247,2010-05-01,2010,PRIMAVERA
AL41,02/05/2010,2.11,9.7,182.71,156.45,12.23,23.56,17.71,11.54,24.29,54.98,94.4,80.07,50.9,94.5,268.33,1167.0,11.0,0.0,0.0,0.0,13.94,0.48,4.136622245,2010-05-02,2010,PRIMAVERA
AL41,03/05/2010,2.74,15.48,236.42,13.0,14.14,21.87,17.36,13.49,22.74,24.78,93.3,61.29,22.91,93.6,246.5,1260.0,11.0,0.0,0.0,0.0,9.63,0.81,4.723147643,2010-05-03,2010,PRIMAVERA
AL41,04/05/2010,3.43,14.5,296.47,343.73,11.26,17.26,14.12,10.77,17.95,25.27,47.26,33.44,23.62,48.74,263.12,1353.0,12.0,0.0,0.0,0.0,0.77,1.09,5.173345302,2010-05-04,2010,PRIMAVERA
AL41,05/05/2010,2.82,12.05,243.6,345.12,7.133,19.49,14.28,6.021,20.33,26.2,78.51,39.84,24.4,82.4,284.14,1466.0,12.0,0.0,0.0,0.0,4.0,1.04,4.736779397,2010-05-05,2010,PRIMAVERA
AL41,06/05/2010,2.51,9.21,216.51,162.44,4.02,21.14,13.6,2.833,21.87,24.53,89.7,57.66,22.3,91.2,286.12,1095.0,12.0,0.0,0.0,5.0,4.53,0.82,4.728868628,2010-05-06,2010,PRIMAVERA
AL41,07/05/2010,2.64,10.58,228.02,139.93,11.16,21.04,16.38,10.6,21.68,44.78,82.2,63.55,39.21,86.4,305.18,1183.0,12.0,0.0,0.0,0.0,9.14,0.74,4.677075681,2010-05-07,2010,PRIMAVERA
AL41,08/05/2010,2.48,10.39,213.99,160.4,7.543,23.09,15.91,6.967,23.72,30.89,92.3,66.24,27.36,92.9,323.49,1208.0,12.0,0.0,0.0,0.0,8.49,0.79,5.152623389,2010-05-08,2010,PRIMAVERA
AL41,09/05/2010,2.13,10.19,183.91,182.32,8.14,25.61,18.23,7.643,26.32,33.62,92.2,61.58,31.57,93.0,282.11,1219.0,12.0,0.0,0.0,0.0,9.54,1.02,4.957501107,2010-05-09,2010,PRIMAVERA
AL41,10/05/2010,2.36,10.19,203.62,160.55,12.7,24.34,19.26,12.35,25.44,32.61,85.4,53.36,27.8,87.0,253.79,1301.0,11.0,0.0,0.0,0.0,8.64,1.17,4.840086432,2010-05-10,2010,PRIMAVERA
AL41,11/05/2010,1.75,9.51,150.95,145.18,14.54,23.75,18.96,13.82,24.56,35.6,84.8,54.79,32.79,88.0,224.32,1270.0,11.0,0.0,0.0,0.0,9.12,1.07,4.200672506,2010-05-11,2010,PRIMAVERA
AL41,12/05/2010,1.75,10.09,150.84,276.79,9.58,24.3,17.81,8.38,24.97,22.13,84.9,46.11,18.28,88.0,301.47,1306.0,12.0,0.0,0.0,0.0,4.44,1.26,5.064851103,2010-05-12,2010,PRIMAVERA
AL41,13/05/2010,1.83,9.11,157.74,164.69,7.606,20.14,15.34,6.427,21.31,31.88,75.09,50.21,28.21,78.83,236.7,1250.0,12.0,0.0,0.0,0.0,4.42,0.95,4.017320221,2010-05-13,2010,PRIMAVERA
AL41,14/05/2010,2.21,12.35,190.93,345.62,9.62,19.09,14.33,9.29,20.18,20.76,75.56,46.17,19.34,78.34,210.94,1358.0,11.0,0.1,0.0,0.0,3.57,0.95,4.149084585,2010-05-14,2010,PRIMAVERA
AL41,15/05/2010,2.29,10.39,197.51,334.58,8.58,23.01,17.19,6.765,24.16,22.54,67.01,38.41,20.41,76.16,288.69,1383.0,12.0,0.0,0.0,0.0,2.14,1.33,5.252042828,2010-05-15,2010,PRIMAVERA
AL41,16/05/2010,2.64,10.68,228.44,147.69,5.114,23.15,15.74,4.408,23.86,22.47,77.1,44.88,20.54,80.5,361.05,1034.0,12.0,0.0,0.0,2.0,3.15,1.15,5.837385474,2010-05-16,2010,PRIMAVERA
AL41,17/05/2010,1.85,10.39,160.1,163.76,5.482,25.61,15.45,4.779,26.39,23.05,83.1,60.71,21.29,85.7,356.51,1033.0,12.0,0.0,0.0,4.0,6.74,0.89,5.655583496,2010-05-17,2010,PRIMAVERA
AL41,18/05/2010,1.8,7.938,155.75,157.78,7.717,25.54,16.71,7.17,25.98,27.35,86.6,56.29,26.31,89.4,358.68,1023.0,12.0,0.0,0.0,0.0,6.48,1.06,5.602913927,2010-05-18,2010,PRIMAVERA
AL41,19/05/2010,2.38,10.0,205.21,166.43,7.315,27.5,17.93,6.427,28.16,21.0,83.7,50.9,18.72,86.0,353.86,1023.0,12.0,0.0,0.0,0.0,5.66,1.3,6.371549574,2010-05-19,2010,PRIMAVERA
AL41,20/05/2010,1.86,9.51,160.6,138.34,11.62,23.86,17.74,10.9,24.53,28.37,92.4,57.79,26.35,93.3,334.26,1224.0,12.0,0.0,0.0,0.0,8.02,1.02,5.283734732,2010-05-20,2010,PRIMAVERA
AL41,21/05/2010,2.27,9.31,196.55,79.51,7.818,26.74,17.75,6.798,27.33,18.15,81.3,47.32,16.97,85.8,359.62,1023.0,12.0,0.0,0.0,0.0,4.45,1.34,6.322541858,2010-05-21,2010,PRIMAVERA
AL41,22/05/2010,2.54,10.68,219.29,102.32,11.88,26.43,19.32,11.07,27.09,27.87,66.11,43.86,26.88,68.96,350.9,1028.0,12.0,0.0,0.0,0.0,6.02,1.4,6.38924925,2010-05-22,2010,PRIMAVERA
AL41,23/05/2010,2.13,9.51,184.4,164.46,10.28,25.72,18.42,9.72,26.49,25.97,75.33,50.4,24.09,78.1,321.82,1103.0,12.0,0.0,0.0,0.0,6.8,1.22,5.713656722,2010-05-23,2010,PRIMAVERA
AL41,24/05/2010,2.38,8.92,205.95,181.55,13.82,25.59,19.66,13.35,26.05,24.15,82.6,50.86,22.36,83.9,332.65,998.0,11.0,0.0,0.0,0.0,7.43,1.31,6.010608023,2010-05-24,2010,PRIMAVERA
AL41,25/05/2010,2.16,10.0,186.75,155.58,8.96,28.09,19.0,8.42,29.06,17.37,80.4,54.99,15.71,83.1,321.77,1028.0,12.0,0.0,0.0,0.0,8.13,1.24,6.201047504,2010-05-25,2010,PRIMAVERA
AL41,26/05/2010,2.07,11.86,179.18,167.21,11.44,30.45,21.12,11.21,31.24,21.11,84.2,50.9,19.49,85.5,342.09,1008.0,12.0,0.0,0.0,0.0,8.82,1.54,6.59224414,2010-05-26,2010,PRIMAVERA
AL41,27/05/2010,2.75,10.09,237.63,90.38,13.11,27.67,20.58,12.52,28.33,28.97,88.0,58.67,26.68,89.7,288.67,1105.0,10.0,0.0,0.0,0.0,11.27,1.17,5.932974018,2010-05-27,2010,PRIMAVERA
AL41,28/05/2010,1.35,8.62,116.85,324.75,12.86,25.27,17.67,11.91,26.52,38.66,92.7,70.31,35.45,93.1,162.94,1260.0,8.0,7.1,0.0,0.0,11.68,0.7,3.402921972,2010-05-28,2010,PRIMAVERA
AL41,29/05/2010,2.29,9.9,198.01,164.78,11.38,24.85,18.75,10.57,25.47,44.51,94.1,70.34,40.04,94.6,358.32,1208.0,12.0,0.0,0.0,0.0,12.6,0.78,5.499654361,2010-05-29,2010,PRIMAVERA
AL41,30/05/2010,2.28,10.49,197.32,154.31,12.51,31.69,22.52,11.88,32.46,21.7,92.4,54.19,19.52,93.3,358.68,1028.0,12.0,0.0,0.0,0.0,10.78,1.62,7.063818937,2010-05-30,2010,PRIMAVERA
AL41,31/05/2010,2.35,9.9,202.68,99.23,15.39,35.99,26.42,14.23,36.56,16.45,76.26,41.47,14.83,82.4,362.35,1039.0,12.0,0.0,0.0,0.0,10.1,2.47,8.150553781,2010-05-31,2010,PRIMAVERA
AL41,01/06/2010,2.35,9.21,202.82,138.43,16.73,33.96,26.48,16.08,34.61,24.91,75.68,44.78,22.49,77.58,348.74,1054.0,12.0,0.0,0.0,0.0,12.17,2.22,7.493117921,2010-06-01,2010,PRIMAVERA
AL41,02/06/2010,2.16,9.31,186.66,108.81,17.08,30.02,23.97,16.55,30.55,30.58,78.13,53.29,29.64,80.6,244.5,1188.0,11.0,0.0,0.0,0.0,13.1,1.55,5.594703309,2010-06-02,2010,PRIMAVERA
AL41,03/06/2010,2.53,11.66,218.8,136.86,17.01,28.58,22.86,16.72,29.17,34.62,88.9,59.44,32.62,90.8,326.08,1008.0,12.0,4.7,0.0,0.0,13.89,1.26,6.24161274,2010-06-03,2010,PRIMAVERA
AL41,04/06/2010,2.25,8.43,194.12,121.58,16.88,30.06,23.75,16.52,30.61,43.62,91.7,68.22,40.16,93.0,338.59,992.0,12.0,0.1,0.0,0.0,16.96,1.1,6.197471699,2010-06-04,2010,PRIMAVERA
AL41,05/06/2010,2.03,9.02,175.0,123.31,16.94,30.82,23.45,16.48,31.45,29.26,92.9,60.93,28.39,93.4,346.25,1059.0,12.0,0.0,0.0,0.0,14.03,1.39,6.568328476,2010-06-05,2010,PRIMAVERA
AL41,06/06/2010,2.45,9.7,211.4,135.74,14.74,30.86,23.32,13.87,31.52,20.94,85.8,55.72,19.59,87.7,362.03,1080.0,12.0,0.0,0.0,0.0,12.19,1.57,7.216525244,2010-06-06,2010,PRIMAVERA
AL41,07/06/2010,2.23,8.62,192.64,158.37,17.02,27.86,22.7,15.84,28.9,42.42,86.9,64.25,38.31,88.7,350.63,1059.0,12.0,0.0,0.0,0.0,15.15,1.09,6.128540315,2010-06-07,2010,PRIMAVERA
AL41,08/06/2010,2.8,11.47,242.09,163.42,15.23,28.79,22.46,15.07,29.48,41.52,90.1,69.12,35.04,91.3,355.87,1044.0,12.0,0.0,0.0,0.0,15.98,0.99,6.439762344,2010-06-08,2010,PRIMAVERA
AL41,09/06/2010,2.38,9.02,205.45,120.58,18.74,27.3,23.46,18.23,27.79,40.12,82.4,56.2,37.31,84.8,208.84,1265.0,12.0,0.0,0.0,0.0,13.66,1.35,4.80037532,2010-06-09,2010,PRIMAVERA
AL41,10/06/2010,3.71,11.86,320.4,196.86,15.11,27.13,22.89,14.63,27.89,20.82,65.55,38.82,18.35,68.54,362.92,1105.0,12.0,0.0,0.0,0.0,7.44,1.8,7.614896932,2010-06-10,2010,PRIMAVERA
AL41,11/06/2010,2.11,7.938,182.22,10.0,13.8,27.31,21.71,13.16,28.09,20.02,65.18,37.29,19.02,68.82,326.33,1419.0,12.0,0.0,0.0,0.0,5.2,1.79,6.291713777,2010-06-11,2010,PRIMAVERA
AL41,12/06/2010,2.83,11.56,244.53,149.4,12.21,25.97,19.78,11.28,26.52,27.25,68.84,47.47,26.04,73.67,329.73,1039.0,10.0,0.0,0.0,0.0,7.44,1.34,6.360887796,2010-06-12,2010,PRIMAVERA
AL41,13/06/2010,2.08,8.82,179.78,123.44,14.97,24.91,20.25,14.23,25.88,37.19,80.2,56.82,35.45,82.2,245.65,1177.0,12.0,0.0,0.0,0.0,10.94,1.11,4.790892315,2010-06-13,2010,PRIMAVERA
AL41,14/06/2010,1.49,7.742,128.47,105.77,14.42,23.63,18.1,14.1,24.06,50.79,93.0,77.84,44.7,93.5,192.8,1409.0,9.0,10.8,0.0,0.0,13.91,0.51,3.481939379,2010-06-14,2010,PRIMAVERA
AL41,15/06/2010,1.46,13.13,125.81,75.42,13.39,22.76,17.12,12.72,23.96,56.32,94.9,85.38,51.14,95.0,211.4,1357.0,10.0,20.3,0.0,0.0,14.46,0.33,3.466149143,2010-06-15,2010,PRIMAVERA
AL41,16/06/2010,1.6,7.546,138.23,166.42,14.05,23.61,17.36,13.76,24.06,42.64,94.3,76.18,38.22,94.5,255.07,1121.0,8.0,2.1,0.0,0.0,12.58,0.56,4.24231566,2010-06-16,2010,PRIMAVERA
AL41,17/06/2010,2.38,9.02,205.47,152.32,11.42,26.19,19.52,10.67,26.62,32.89,93.7,63.51,30.49,94.3,369.35,1090.0,12.0,0.0,0.0,0.0,11.13,1.03,6.110176383,2010-06-17,2010,PRIMAVERA
AL41,18/06/2010,2.79,12.05,241.15,167.69,14.74,25.8,20.2,14.4,26.32,45.31,93.0,69.93,43.11,93.6,345.74,1028.0,12.0,0.0,0.0,0.0,13.97,0.83,5.74778193,2010-06-18,2010,PRIMAVERA
AL41,19/06/2010,2.19,9.8,189.2,163.3,15.48,28.84,22.51,14.97,29.58,27.55,89.4,53.67,25.91,91.0,288.66,1254.0,12.0,0.0,0.0,0.0,10.97,1.5,5.860855652,2010-06-19,2010,PRIMAVERA
AL41,20/06/2010,2.94,8.92,253.75,92.43,18.05,28.46,23.69,16.38,29.47,31.1,74.93,46.85,29.71,78.41,256.25,1285.0,12.0,0.0,0.0,0.0,10.9,1.67,6.091472575,2010-06-20,2010,PRIMAVERA
AL41,21/06/2010,2.5,10.0,216.23,154.52,13.92,25.8,20.39,13.39,26.45,41.17,90.9,65.88,38.76,92.0,357.62,1255.0,12.0,0.0,0.0,0.0,13.12,0.95,5.903054697,2010-06-21,2010,VERANO
AL41,22/06/2010,2.24,9.02,193.8,162.11,12.75,27.74,20.94,12.45,28.77,42.95,92.0,66.68,40.3,92.7,362.81,1018.0,12.0,0.0,0.0,0.0,13.83,1.0,6.040072825,2010-06-22,2010,VERANO
AL41,23/06/2010,2.09,8.43,180.27,130.34,14.25,28.75,21.75,13.7,29.13,35.31,90.1,61.12,34.0,91.2,357.98,1018.0,12.0,0.0,0.0,0.0,12.86,1.23,6.284344698,2010-06-23,2010,VERANO
AL41,24/06/2010,2.8,9.41,242.09,61.19,16.25,30.26,23.11,15.34,30.81,22.76,90.0,54.98,20.74,91.2,353.33,1003.0,12.0,0.0,0.0,0.0,11.86,1.53,7.2328606,2010-06-24,2010,VERANO
AL41,25/06/2010,2.7,8.92,232.97,77.85,16.76,29.84,23.4,15.71,30.42,19.54,74.46,41.85,18.75,75.83,314.81,1167.0,12.0,0.0,0.0,0.0,8.09,1.89,7.019300138,2010-06-25,2010,VERANO
AL41,26/06/2010,2.19,15.39,189.46,79.87,14.09,30.55,23.13,13.22,31.35,23.89,63.08,39.12,22.93,67.07,356.68,1008.0,12.0,0.0,0.0,0.0,7.56,1.93,7.029039438,2010-06-26,2010,VERANO
AL41,27/06/2010,2.3,14.01,199.05,36.35,14.4,30.31,23.07,13.97,31.02,22.09,68.69,40.16,19.83,70.18,349.45,992.0,12.0,0.0,0.0,0.0,7.41,1.93,7.018997583,2010-06-27,2010,VERANO
AL41,28/06/2010,2.23,10.88,193.01,101.88,18.55,30.88,24.26,17.96,31.75,20.27,56.38,39.9,16.93,59.06,312.34,1188.0,11.0,0.0,0.0,0.0,8.91,1.98,6.996410158,2010-06-28,2010,VERANO
AL41,29/06/2010,2.08,9.51,179.86,150.57,15.24,31.33,24.16,14.77,31.95,22.12,72.21,41.79,20.63,74.93,344.6,1033.0,12.0,0.0,0.0,0.0,8.85,2.03,6.921955628,2010-06-29,2010,VERANO
AL41,30/06/2010,2.02,9.02,174.29,148.04,13.99,31.69,24.27,13.33,32.69,18.52,73.54,43.59,14.09,76.8,353.48,997.0,12.0,0.0,0.0,0.0,9.63,2.01,7.021401931,2010-06-30,2010,VERANO
AL41,01/07/2010,2.29,11.07,197.43,168.74,14.86,33.32,25.06,14.47,33.97,24.4,73.12,44.7,23.23,79.19,352.53,997.0,12.0,0.0,0.0,0.0,10.9,2.05,7.401874001,2010-07-01,2010,VERANO
AL41,02/07/2010,2.09,10.09,180.24,119.37,15.62,31.92,24.35,15.11,32.56,27.49,77.09,53.36,26.47,80.1,306.72,992.0,12.0,0.0,0.0,0.0,13.26,1.66,6.486219924,2010-07-02,2010,VERANO
AL41,03/07/2010,1.94,8.43,167.7,65.38,17.17,29.15,24.17,16.45,29.88,33.57,84.4,57.07,31.37,86.5,165.65,1131.0,11.0,0.0,0.0,0.0,14.34,1.46,4.359524537,2010-07-03,2010,VERANO
AL41,04/07/2010,3.39,10.29,293.04,31.75,17.42,33.03,26.27,16.99,33.63,20.1,85.6,45.52,18.14,87.4,339.54,1008.0,12.0,0.0,0.0,0.0,11.95,2.11,8.106791286,2010-07-04,2010,VERANO
AL41,05/07/2010,3.52,10.98,304.35,62.16,20.45,33.49,27.16,20.04,34.28,22.74,65.95,41.51,21.78,68.01,348.09,987.0,12.0,0.0,0.0,0.0,12.12,2.28,8.693931345,2010-07-05,2010,VERANO
AL41,06/07/2010,2.47,9.31,213.5,113.23,17.02,32.29,25.63,15.74,32.89,28.04,80.5,52.49,26.97,83.3,358.78,1013.0,12.0,0.0,0.0,0.0,14.04,1.82,7.336289249,2010-07-06,2010,VERANO
AL41,07/07/2010,2.21,8.43,191.14,124.25,14.77,32.58,25.05,14.47,33.16,26.78,80.3,51.35,25.93,82.4,345.11,987.0,12.0,0.0,0.0,0.0,13.06,1.86,7.015723786,2010-07-07,2010,VERANO
AL41,08/07/2010,2.08,8.33,179.54,53.48,19.43,35.3,27.31,18.5,36.2,15.21,68.09,42.41,13.52,71.35,312.51,1193.0,12.0,0.0,0.0,0.0,11.41,2.44,7.418199627,2010-07-08,2010,VERANO
AL41,09/07/2010,2.87,9.8,248.28,64.09,18.82,35.8,27.83,17.99,36.53,13.76,73.05,41.52,12.24,77.24,333.64,972.0,12.0,0.0,0.0,0.0,10.93,2.56,8.528212227,2010-07-09,2010,VERANO
AL41,10/07/2010,2.2,8.92,189.85,139.13,16.54,33.0,25.43,15.38,33.43,28.05,79.16,51.35,26.53,82.1,350.89,1008.0,12.0,0.0,0.0,0.0,13.64,1.84,7.154391111,2010-07-10,2010,VERANO
AL41,11/07/2010,2.06,8.82,177.85,142.3,19.0,33.14,26.46,18.67,33.63,32.35,83.7,55.88,28.46,84.6,333.85,987.0,12.0,0.0,0.0,0.0,16.16,1.74,6.821402466,2010-07-11,2010,VERANO
AL41,12/07/2010,2.45,9.41,211.62,162.54,17.76,31.38,25.56,17.26,31.82,36.61,77.25,58.23,27.35,79.02,339.01,1005.0,12.0,0.0,0.0,0.0,16.22,1.53,6.812089501,2010-07-12,2010,VERANO
AL41,13/07/2010,2.19,10.58,189.4,161.19,18.34,35.31,26.73,17.93,36.19,23.68,86.6,60.96,18.68,88.7,341.24,987.0,12.0,0.0,0.0,0.0,17.46,1.66,7.470134951,2010-07-13,2010,VERANO
AL41,14/07/2010,2.18,9.51,188.54,160.95,19.71,33.13,26.75,19.34,34.11,34.78,89.5,61.83,27.21,91.0,344.49,1008.0,13.0,0.0,0.0,0.0,17.79,1.59,6.929256221,2010-07-14,2010,VERANO
AL41,15/07/2010,3.25,10.58,280.39,117.03,20.93,34.21,28.35,20.45,34.92,18.5,82.5,48.61,16.76,83.7,348.47,992.0,12.0,0.0,0.0,0.0,15.19,2.16,8.436695685,2010-07-15,2010,VERANO
AL41,16/07/2010,2.31,9.6,199.88,162.36,20.1,32.7,26.54,19.75,33.3,42.94,89.3,68.56,40.26,90.6,319.11,962.0,12.0,0.0,0.0,0.0,19.72,1.26,6.464122117,2010-07-16,2010,VERANO
AL41,17/07/2010,2.51,10.29,216.66,113.41,20.62,33.22,26.72,19.91,33.67,35.64,88.9,64.5,33.95,90.3,290.07,1095.0,12.0,0.0,0.0,0.0,18.76,1.44,6.521847337,2010-07-17,2010,VERANO
AL41,18/07/2010,2.53,9.11,218.42,113.07,20.39,32.76,26.47,19.92,33.36,40.45,85.5,64.31,38.84,86.6,301.32,1110.0,12.0,0.0,0.0,0.0,18.64,1.39,6.498024731,2010-07-18,2010,VERANO
AL41,19/07/2010,2.23,8.72,192.47,166.38,19.4,31.99,26.01,18.84,32.45,37.68,88.9,66.3,31.7,90.4,336.41,982.0,12.0,0.0,0.0,0.0,18.57,1.32,6.624278146,2010-07-19,2010,VERANO
AL41,20/07/2010,2.18,9.51,188.52,159.46,18.9,31.35,25.49,18.5,32.05,42.52,87.5,69.17,38.84,90.4,324.29,992.0,12.0,0.0,0.0,0.0,18.96,1.15,6.264732041,2010-07-20,2010,VERANO
AL41,21/07/2010,2.41,9.6,208.07,158.17,21.47,31.14,26.17,20.82,32.02,45.33,84.4,66.79,41.24,85.7,333.66,1069.0,12.0,0.0,0.0,0.0,19.12,1.24,6.516720771,2010-07-21,2010,VERANO
AL41,22/07/2010,2.43,9.21,209.53,130.85,19.51,33.71,26.47,18.67,34.11,35.36,89.6,66.78,33.24,91.2,325.23,964.0,11.0,0.0,0.0,0.0,18.8,1.41,6.896970017,2010-07-22,2010,VERANO
AL41,23/07/2010,3.23,11.27,279.21,88.75,22.38,32.95,27.38,21.8,33.5,41.34,85.9,65.13,39.31,87.0,310.61,1059.0,12.0,0.0,0.0,0.0,19.74,1.41,7.003835209,2010-07-23,2010,VERANO
AL41,24/07/2010,2.32,7.154,200.68,125.65,22.65,30.87,26.45,22.2,31.58,41.31,82.3,67.21,38.64,85.0,163.03,1008.0,9.0,0.0,0.0,0.0,19.51,1.2,4.616882321,2010-07-24,2010,VERANO
AL41,25/07/2010,2.3,10.0,198.98,168.41,18.95,31.56,25.28,18.26,32.08,41.74,86.7,66.71,39.92,88.8,329.17,987.0,12.0,0.0,0.0,0.0,18.11,1.23,6.409624008,2010-07-25,2010,VERANO
AL41,26/07/2010,2.27,8.82,196.53,136.03,17.8,31.06,25.04,17.22,31.85,38.0,86.2,59.72,33.92,87.6,296.87,1193.0,12.0,0.0,0.0,0.0,16.01,1.45,6.028142743,2010-07-26,2010,VERANO
AL41,27/07/2010,2.38,14.21,205.92,116.39,17.71,30.76,24.83,16.99,31.28,36.3,81.7,58.14,33.96,84.6,337.14,1039.0,12.0,0.0,0.0,0.0,15.3,1.5,6.561483861,2010-07-27,2010,VERANO
AL41,28/07/2010,2.0,10.58,172.8,158.43,15.89,33.29,24.83,15.47,34.04,25.89,81.5,52.77,24.44,83.6,340.42,997.0,12.0,0.0,0.0,0.0,13.33,1.76,6.854275244,2010-07-28,2010,VERANO
AL41,29/07/2010,2.38,8.92,205.42,166.4,17.51,31.89,25.32,16.89,32.42,30.89,76.28,56.26,27.72,77.88,309.79,1249.0,12.0,0.0,0.0,0.0,15.27,1.6,6.599720535,2010-07-29,2010,VERANO
AL41,30/07/2010,2.37,9.11,204.54,120.91,21.23,31.14,25.89,20.68,31.75,44.77,86.8,66.84,40.56,87.5,286.32,1105.0,11.0,0.0,0.0,0.0,18.85,1.22,5.881438817,2010-07-30,2010,VERANO
AL41,31/07/2010,2.04,8.43,176.08,154.83,18.89,31.64,25.67,18.03,32.32,33.71,85.9,61.38,32.74,87.1,323.5,956.0,12.0,0.0,0.0,0.0,16.83,1.47,6.354512096,2010-07-31,2010,VERANO
AL41,01/08/2010,2.17,10.88,187.79,127.71,17.48,33.54,25.86,16.89,34.21,29.06,83.0,55.89,25.39,84.9,331.31,977.0,12.0,0.0,0.0,0.0,15.08,1.78,6.862208743,2010-08-01,2010,VERANO
AL41,02/08/2010,2.41,9.11,208.21,159.84,18.17,32.13,25.65,17.83,32.72,39.76,84.0,63.73,36.72,85.3,325.33,967.0,12.0,0.0,0.0,0.0,17.64,1.39,6.508764519,2010-08-02,2010,VERANO
AL41,03/08/2010,2.41,9.7,207.84,114.23,20.87,31.83,26.15,20.45,32.29,41.59,85.6,65.06,39.95,87.1,271.09,1146.0,12.0,0.0,0.0,0.0,18.56,1.32,5.879588863,2010-08-03,2010,VERANO
AL41,04/08/2010,2.75,10.39,237.95,161.91,18.7,31.16,25.04,18.33,31.82,40.89,83.7,64.04,38.37,85.5,317.65,972.0,12.0,0.0,0.0,0.0,17.23,1.29,6.450154803,2010-08-04,2010,VERANO
AL41,05/08/2010,2.17,9.02,187.77,162.74,19.3,31.86,25.63,19.04,32.83,32.9,86.1,62.33,31.39,87.3,311.2,1075.0,12.0,0.0,0.0,0.0,17.17,1.42,6.328722048,2010-08-05,2010,VERANO
AL41,06/08/2010,2.27,10.0,195.95,93.97,18.29,31.05,24.93,17.86,31.65,35.2,77.51,60.41,30.76,78.6,261.58,1275.0,11.0,0.0,0.0,0.0,16.22,1.39,5.775893412,2010-08-06,2010,VERANO
AL41,07/08/2010,2.58,9.6,223.28,88.52,20.65,31.42,25.65,19.91,31.98,31.61,83.2,57.66,29.71,84.2,302.33,1239.0,12.0,0.0,0.0,0.0,15.77,1.56,6.540408462,2010-08-07,2010,VERANO
AL41,08/08/2010,1.72,8.82,149.0,147.32,16.26,33.72,25.49,15.99,34.61,20.94,76.85,48.08,19.52,79.45,273.77,1213.0,12.0,0.0,0.0,0.0,12.13,2.01,6.004118569,2010-08-08,2010,VERANO
AL41,09/08/2010,1.89,8.33,163.08,101.44,20.93,36.12,27.93,20.55,37.09,14.04,68.34,40.27,12.81,73.85,285.34,1214.0,11.0,0.0,0.0,0.0,10.97,2.59,6.898768157,2010-08-09,2010,VERANO
AL41,10/08/2010,1.95,9.51,168.24,166.73,21.57,34.4,26.8,21.19,35.12,22.43,67.91,46.88,20.26,71.98,148.15,1033.0,8.0,0.0,0.0,0.0,13.74,2.02,5.234472222,2010-08-10,2010,VERANO
AL41,11/08/2010,2.82,10.78,243.9,175.79,21.07,35.54,28.34,20.41,36.36,28.94,73.53,50.85,27.82,78.35,290.9,920.0,12.0,0.0,0.0,0.0,16.49,2.1,7.387448563,2010-08-11,2010,VERANO
AL41,12/08/2010,3.13,9.41,270.68,89.35,22.76,33.25,27.44,22.37,33.84,39.01,86.9,65.92,35.33,87.6,293.68,905.0,12.0,0.0,0.0,0.0,19.97,1.39,6.783470668,2010-08-12,2010,VERANO
AL41,13/08/2010,3.0,15.78,259.19,87.18,18.04,29.3,24.25,17.65,30.29,40.21,91.9,71.33,36.96,92.3,135.07,1147.0,9.0,6.2,0.0,0.0,18.15,0.98,4.302036639,2010-08-13,2010,VERANO
AL41,14/08/2010,1.93,8.23,166.77,116.15,18.66,26.84,22.37,18.44,27.83,60.14,93.0,80.53,55.93,93.2,179.5,1141.0,11.0,0.3,0.0,0.0,18.7,0.57,3.517955335,2010-08-14,2010,VERANO
AL41,15/08/2010,2.23,9.6,192.39,133.0,20.97,29.86,24.86,20.75,30.35,38.77,88.6,67.77,34.27,89.9,282.08,1157.0,12.0,0.1,0.0,0.0,17.85,1.14,5.625810989,2010-08-15,2010,VERANO
AL41,16/08/2010,1.66,7.546,143.83,97.59,19.47,28.29,23.42,19.04,28.9,49.61,90.5,75.51,43.11,91.2,123.19,1131.0,10.0,0.0,0.0,0.0,18.59,0.77,3.152474777,2010-08-16,2010,VERANO
AL41,17/08/2010,1.48,5.488,128.1,38.9,19.58,26.53,22.65,19.33,26.82,65.26,94.0,83.57,62.24,94.1,159.23,1388.0,8.0,59.7,0.0,0.0,19.63,0.49,3.044280132,2010-08-17,2010,VERANO
AL41,18/08/2010,1.75,9.41,151.27,163.94,20.37,29.2,24.28,20.04,29.61,55.12,92.6,77.42,50.42,92.9,260.84,1352.0,12.0,0.0,0.0,0.0,19.84,0.76,4.700941357,2010-08-18,2010,VERANO
AL41,19/08/2010,1.48,7.742,127.65,160.71,20.14,28.85,23.54,19.87,29.38,55.59,94.6,81.0,50.76,94.7,210.84,1203.0,11.0,25.9,0.0,0.0,19.84,0.62,3.945581368,2010-08-19,2010,VERANO
AL41,20/08/2010,1.62,7.056,139.56,142.49,19.27,30.83,24.95,18.9,31.12,52.47,93.7,73.26,49.01,93.8,304.75,1013.0,12.0,0.0,0.0,0.0,19.39,0.99,5.31248578,2010-08-20,2010,VERANO
AL41,21/08/2010,1.54,11.37,133.35,151.76,18.9,31.7,25.38,18.51,32.19,41.68,92.0,68.95,38.94,92.4,309.81,946.0,12.0,0.0,0.0,0.0,18.54,1.21,5.563129672,2010-08-21,2010,VERANO
AL41,22/08/2010,2.07,8.82,179.11,167.26,18.46,31.37,24.84,18.14,31.99,37.31,93.1,71.73,32.4,93.8,305.75,941.0,12.0,0.0,0.0,0.0,18.63,1.08,5.818998774,2010-08-22,2010,VERANO
AL41,23/08/2010,1.97,9.02,170.36,161.26,19.21,33.12,25.52,18.8,33.6,42.58,92.3,73.87,36.68,93.0,302.53,941.0,12.0,0.0,0.0,0.0,20.02,1.03,5.856522681,2010-08-23,2010,VERANO
AL41,24/08/2010,1.81,8.04,156.68,150.4,18.59,35.44,26.96,18.1,35.88,21.64,92.9,55.6,19.76,93.5,304.42,949.0,12.0,0.0,0.0,0.0,15.19,1.99,6.400941885,2010-08-24,2010,VERANO
AL41,25/08/2010,1.46,7.742,125.79,152.97,18.7,33.4,26.2,18.1,33.97,36.63,85.0,62.51,33.75,87.9,299.41,936.0,12.0,0.0,0.0,0.0,17.73,1.5,5.621098393,2010-08-25,2010,VERANO
AL41,26/08/2010,2.04,9.6,176.25,162.33,17.61,34.51,26.06,17.16,35.02,22.89,92.0,62.1,21.41,92.7,300.02,946.0,12.0,0.0,0.0,0.0,16.24,1.68,6.397946503,2010-08-26,2010,VERANO
AL41,27/08/2010,1.31,6.664,112.77,159.97,17.82,36.55,26.93,17.43,37.37,24.78,87.1,60.71,23.13,87.8,289.79,915.0,11.0,0.0,0.0,0.0,17.24,1.81,5.780926716,2010-08-27,2010,VERANO
AL41,28/08/2010,2.79,10.39,240.83,113.97,21.7,33.74,27.81,20.44,34.88,26.16,76.72,53.13,23.53,83.7,289.2,920.0,10.0,0.0,0.0,0.0,16.71,1.86,6.9463793,2010-08-28,2010,VERANO
AL41,29/08/2010,1.77,7.448,153.15,136.1,21.5,30.22,25.57,21.36,31.02,45.92,87.5,68.06,43.4,89.4,230.73,1080.0,10.0,0.0,0.0,0.0,18.91,1.13,4.628470565,2010-08-29,2010,VERANO
AL41,30/08/2010,1.81,8.72,156.33,158.3,18.15,31.08,24.6,17.7,31.58,37.34,90.3,69.09,33.99,91.0,283.6,910.0,11.0,0.0,0.0,0.0,17.89,1.12,5.327007251,2010-08-30,2010,VERANO
AL41,31/08/2010,2.14,9.41,185.28,106.52,20.6,28.71,24.35,20.18,29.61,47.7,88.5,69.14,44.86,89.8,234.41,1136.0,10.0,0.0,0.0,0.0,17.94,1.03,4.61562637,2010-08-31,2010,VERANO
AL41,01/09/2010,2.0,8.62,172.77,84.4,19.48,29.39,23.83,19.21,30.44,38.07,87.6,63.34,35.24,88.4,263.64,1080.0,11.0,0.0,0.0,0.0,15.84,1.2,5.081936476,2010-09-01,2010,VERANO
AL41,02/09/2010,1.47,6.468,126.82,131.79,16.77,27.85,22.52,16.38,28.47,45.69,84.9,68.87,43.98,86.6,210.86,1085.0,10.0,0.0,0.0,0.0,16.13,0.95,3.929747009,2010-09-02,2010,VERANO
AL41,03/09/2010,1.41,9.31,121.99,152.11,18.43,28.9,23.68,18.06,29.73,45.54,90.8,69.83,40.26,91.7,246.27,1131.0,10.0,0.0,0.0,0.0,17.42,0.99,4.33755161,2010-09-03,2010,VERANO
AL41,04/09/2010,1.5,8.53,129.49,173.95,15.17,30.27,22.66,14.94,30.81,29.85,88.4,65.53,27.71,89.3,283.26,910.0,11.0,0.0,0.0,0.0,14.96,1.17,5.002619606,2010-09-04,2010,VERANO
AL41,05/09/2010,1.48,7.056,128.11,167.71,15.2,32.21,23.33,14.78,32.93,20.37,84.6,56.73,17.91,86.3,281.99,910.0,11.0,0.0,0.0,0.0,12.61,1.55,5.303203573,2010-09-05,2010,VERANO
AL41,06/09/2010,2.35,10.09,203.0,158.07,14.8,30.24,22.94,14.47,31.06,31.56,87.4,64.06,25.6,89.1,279.93,900.0,10.0,0.0,0.0,0.0,14.87,1.22,5.523587171,2010-09-06,2010,VERANO
AL41,07/09/2010,2.0,9.8,172.76,246.93,14.81,33.9,25.28,14.47,34.24,19.49,89.5,49.39,18.17,90.7,285.34,920.0,11.0,0.0,0.0,0.0,11.1,2.05,5.989453622,2010-09-07,2010,VERANO
AL41,08/09/2010,2.38,10.29,205.96,168.86,17.09,28.68,23.43,15.71,29.41,31.87,80.5,50.1,29.38,83.5,269.01,1049.0,11.0,0.0,0.0,0.0,11.78,1.56,5.324449747,2010-09-08,2010,VERANO
AL41,09/09/2010,2.17,15.97,187.38,65.42,14.85,30.37,22.2,13.73,31.02,17.27,81.2,50.31,14.81,83.8,285.34,946.0,11.0,0.0,0.0,0.0,9.33,1.59,5.799385655,2010-09-09,2010,VERANO
AL41,10/09/2010,1.53,8.23,132.21,168.03,13.87,28.57,21.35,13.23,29.21,29.15,89.1,62.38,27.15,89.8,277.42,895.0,10.0,0.0,0.0,0.0,12.75,1.17,4.685558254,2010-09-10,2010,VERANO
AL41,11/09/2010,2.06,11.76,178.24,81.59,15.39,28.46,21.38,15.01,28.9,38.5,89.1,66.61,36.83,90.3,251.32,1080.0,10.0,0.0,0.0,0.0,14.31,1.0,4.662442689,2010-09-11,2010,VERANO
AL41,12/09/2010,2.0,8.92,172.84,80.88,15.47,29.32,22.2,14.53,29.94,40.0,87.2,64.79,37.94,89.6,267.26,915.0,10.0,0.0,0.0,0.0,14.6,1.11,4.83368362,2010-09-12,2010,VERANO
AL41,13/09/2010,1.71,7.252,147.98,135.63,15.81,29.57,22.8,15.55,30.14,38.29,89.6,65.38,36.29,90.4,249.7,915.0,10.0,0.0,0.0,0.0,15.3,1.12,4.529942414,2010-09-13,2010,VERANO
AL41,14/09/2010,1.59,8.72,137.52,166.35,14.97,28.93,22.04,14.71,29.27,50.15,87.8,71.87,47.99,89.1,253.4,895.0,10.0,0.0,0.0,0.0,16.4,0.87,4.225396269,2010-09-14,2010,VERANO
AL41,15/09/2010,2.55,10.29,220.2,164.89,16.09,27.69,21.84,15.68,28.16,48.09,89.8,70.64,46.21,92.1,241.38,915.0,10.0,0.0,0.0,0.0,15.85,0.88,4.45002167,2010-09-15,2010,VERANO
AL41,16/09/2010,0.94,5.684,81.19,178.69,14.89,26.79,20.76,14.27,27.13,50.24,82.1,69.78,48.04,84.3,86.01,586.2,7.0,0.0,0.0,0.0,14.79,0.82,2.164948743,2010-09-16,2010,VERANO
AL41,17/09/2010,1.63,6.37,140.63,176.82,17.86,26.32,21.66,17.39,26.72,54.78,91.9,76.99,50.5,92.7,151.45,1070.0,9.0,5.1,0.0,0.0,17.28,0.64,2.991071654,2010-09-17,2010,VERANO
AL41,18/09/2010,1.4,7.938,120.65,178.59,15.04,28.67,21.18,14.6,29.2,33.17,91.3,67.38,29.38,92.4,256.69,889.0,10.0,0.0,0.0,0.0,13.84,1.02,4.262473862,2010-09-18,2010,VERANO
AL41,19/09/2010,1.68,8.62,144.8,125.6,14.87,28.02,21.52,14.16,28.36,41.37,92.3,69.78,37.91,93.2,250.3,864.0,10.0,0.0,0.0,0.0,15.15,0.93,4.1880106,2010-09-19,2010,VERANO
AL41,20/09/2010,1.27,9.41,109.43,142.2,18.22,25.77,20.95,17.96,26.39,63.02,92.4,80.31,55.93,92.7,100.96,1152.0,7.0,2.0,0.0,0.0,17.33,0.52,2.172646649,2010-09-20,2010,VERANO
AL41,21/09/2010,1.67,8.43,144.48,162.67,16.49,27.92,21.61,15.87,28.36,42.97,94.4,76.14,37.3,94.6,253.8,1008.0,10.0,0.0,0.0,0.0,16.68,0.75,4.168277682,2010-09-21,2010,VERANO
AL41,22/09/2010,1.58,8.13,136.09,157.5,14.39,27.55,21.19,13.86,28.1,50.43,92.9,76.43,47.62,93.8,216.44,982.0,10.0,0.0,0.0,0.0,16.46,0.72,3.604543144,2010-09-22,2010,VERANO
AL41,23/09/2010,1.3,7.644,112.06,150.12,18.93,25.89,21.75,18.67,26.59,59.53,91.1,79.76,57.21,91.5,95.51,884.0,7.0,0.0,0.0,0.0,17.96,0.56,2.195822462,2010-09-23,2010,OTOÑO
AL41,24/09/2010,2.04,8.62,175.94,108.76,15.76,29.45,22.76,14.83,29.95,29.22,85.5,57.75,26.58,89.9,230.71,967.0,10.0,0.0,0.0,0.0,12.86,1.36,4.619120338,2010-09-24,2010,OTOÑO
AL41,25/09/2010,1.77,8.92,153.1,139.85,13.79,27.98,21.02,12.58,28.63,30.96,85.4,64.06,29.27,88.9,213.56,1013.0,9.0,0.0,0.0,0.0,13.14,1.06,4.063365785,2010-09-25,2010,OTOÑO
AL41,26/09/2010,2.34,8.13,201.85,71.25,14.68,26.07,20.33,13.42,27.29,36.22,79.94,58.18,32.72,89.1,197.53,977.0,9.0,0.0,0.0,0.0,11.42,1.06,4.083233856,2010-09-26,2010,OTOÑO
AL41,27/09/2010,1.92,9.21,165.72,133.76,15.7,25.69,19.91,15.21,26.32,45.14,84.9,69.63,41.96,86.4,209.52,941.0,8.0,0.0,0.0,0.0,13.89,0.78,3.670003771,2010-09-27,2010,OTOÑO
AL41,28/09/2010,1.54,9.8,133.19,155.61,15.09,26.75,20.42,14.74,27.5,37.05,92.2,73.39,32.59,92.6,191.51,1013.0,10.0,0.2,0.0,0.0,14.91,0.74,3.455941582,2010-09-28,2010,OTOÑO
AL41,29/09/2010,1.96,9.51,169.7,169.91,11.29,27.77,19.13,10.43,28.26,32.21,91.9,66.86,29.61,93.3,237.22,812.0,10.0,0.0,0.0,0.0,11.71,0.97,4.192375777,2010-09-29,2010,OTOÑO
AL41,30/09/2010,1.87,10.58,161.42,165.11,11.0,29.51,19.72,10.33,30.01,26.89,86.1,59.21,24.69,89.2,230.56,848.0,10.0,0.0,0.0,0.0,9.98,1.23,4.413744505,2010-09-30,2010,OTOÑO
AL41,01/10/2010,1.53,9.02,132.56,152.88,9.48,29.27,18.57,8.96,30.28,26.92,85.2,61.29,22.29,86.7,234.41,807.0,10.0,0.0,0.0,0.0,9.82,1.09,4.080106026,2010-10-01,2010,OTOÑO
AL41,02/10/2010,1.41,7.546,122.16,166.56,9.86,27.48,18.49,9.06,27.99,37.55,88.9,70.79,33.26,90.2,224.6,796.9,10.0,0.0,0.0,0.0,12.53,0.79,3.543688343,2010-10-02,2010,OTOÑO
AL41,03/10/2010,2.57,10.19,222.26,180.1,14.33,29.1,22.07,13.96,30.32,28.89,88.7,59.47,27.73,90.0,189.31,799.4,9.0,0.0,0.0,0.0,12.31,1.32,4.501843354,2010-10-03,2010,OTOÑO
AL41,04/10/2010,,,,,,,,,,,,,,,,,,,,,,,,2010-10-04,2010,OTOÑO
AL41,05/10/2010,1.6,8.23,137.94,182.23,11.85,26.18,18.99,10.77,26.92,27.59,83.1,54.68,25.9,85.1,228.4,791.7,10.0,0.0,0.0,0.0,8.79,1.13,3.720087264,2010-10-05,2010,OTOÑO
AL41,06/10/2010,1.58,8.23,136.14,67.74,11.62,27.75,19.67,11.0,28.23,28.81,85.6,63.23,27.59,87.6,218.06,760.9,10.0,0.0,0.0,0.0,11.53,1.03,3.738292545,2010-10-06,2010,OTOÑO
AL41,07/10/2010,1.79,7.84,154.3,165.05,16.85,26.83,21.57,15.87,27.46,48.36,90.9,72.5,45.5,92.4,143.55,969.0,9.0,0.0,0.0,0.0,16.08,0.8,2.955591438,2010-10-07,2010,OTOÑO
AL41,08/10/2010,1.79,7.35,155.08,165.96,16.25,27.04,21.37,15.54,27.66,48.76,89.2,75.21,46.61,90.3,186.3,848.0,10.0,0.0,0.0,0.0,16.49,0.72,3.281340721,2010-10-08,2010,OTOÑO
AL41,09/10/2010,1.66,9.31,143.32,166.11,17.45,24.67,20.47,17.25,25.04,57.24,91.2,76.96,51.8,91.8,126.39,833.0,8.0,5.9,0.0,0.0,16.04,0.61,2.443630587,2010-10-09,2010,OTOÑO
AL41,10/10/2010,1.55,10.0,133.95,356.12,13.93,22.9,17.55,13.6,23.73,38.26,90.1,73.9,34.11,91.6,140.3,1131.0,8.0,0.0,0.0,0.0,12.46,0.57,2.652795012,2010-10-10,2010,OTOÑO
AL41,11/10/2010,1.89,8.53,163.66,24.75,10.72,22.52,16.39,9.52,22.84,37.76,89.3,67.68,31.54,91.4,192.98,812.0,9.0,0.0,0.0,0.0,9.87,0.68,3.063974664,2010-10-11,2010,OTOÑO
AL41,12/10/2010,1.56,10.09,135.02,214.58,11.55,23.11,17.31,10.84,24.09,35.58,88.2,65.55,33.5,89.8,134.53,946.0,7.0,0.9,0.0,0.0,10.26,0.76,2.647906385,2010-10-12,2010,OTOÑO
AL41,13/10/2010,2.23,8.53,192.35,6.14,15.36,23.7,19.67,14.7,24.67,41.53,84.8,58.38,37.54,85.3,128.96,1100.0,8.0,1.3,0.0,0.0,10.8,1.03,2.973627935,2010-10-13,2010,OTOÑO
AL41,14/10/2010,1.9,8.92,163.92,176.85,10.95,24.65,17.8,9.96,25.24,42.29,92.0,71.6,39.84,92.8,203.39,740.4,9.0,0.0,0.0,0.0,12.01,0.71,3.158098711,2010-10-14,2010,OTOÑO
AL41,15/10/2010,1.37,8.82,118.24,144.71,15.0,24.49,18.08,14.36,25.17,40.68,92.4,74.71,36.84,92.7,139.64,920.0,6.0,2.7,0.0,0.0,13.13,0.58,2.546417726,2010-10-15,2010,OTOÑO
AL41,16/10/2010,1.29,7.448,111.37,183.68,12.14,23.44,17.07,11.78,23.99,46.04,92.9,79.06,33.33,93.7,191.94,962.0,8.0,0.8,0.0,0.0,12.96,0.49,2.60805,2010-10-16,2010,OTOÑO
AL41,17/10/2010,2.18,9.02,188.1,23.5,11.35,22.5,16.66,9.65,23.02,27.39,93.8,56.28,25.54,94.2,159.78,869.0,10.0,0.1,0.0,0.0,6.72,0.92,3.136446931,2010-10-17,2010,OTOÑO
AL41,18/10/2010,2.77,10.29,239.11,29.49,6.446,22.24,14.67,5.346,22.76,13.47,76.37,39.53,12.28,79.78,215.41,773.9,10.0,0.0,0.0,1.0,2.61,1.15,4.12704318,2010-10-18,2010,OTOÑO
AL41,19/10/2010,1.43,7.252,123.49,182.32,2.9,21.32,12.06,1.684,21.74,19.1,85.1,61.58,17.95,89.1,204.25,740.4,10.0,0.0,0.0,8.0,4.39,0.71,2.797377463,2010-10-19,2010,OTOÑO
AL41,20/10/2010,1.23,7.35,105.95,175.48,4.78,22.57,12.83,3.874,23.21,29.5,91.4,69.38,27.8,92.7,201.2,735.3,10.0,0.0,0.0,7.0,6.36,0.63,2.58017774,2010-10-20,2010,OTOÑO
AL41,21/10/2010,1.23,6.174,106.68,175.33,6.904,21.61,13.63,5.988,26.45,38.15,92.2,71.64,29.46,93.0,178.97,874.0,9.0,0.1,0.0,1.0,7.83,0.58,2.324061481,2010-10-21,2010,OTOÑO
AL41,22/10/2010,1.14,5.978,98.58,178.97,5.481,21.49,13.68,4.48,21.87,45.35,92.7,72.72,42.58,93.7,180.61,879.0,9.0,0.0,0.0,6.0,8.34,0.55,2.164293111,2010-10-22,2010,OTOÑO
AL41,23/10/2010,1.17,5.978,101.47,191.21,10.44,20.44,15.35,9.86,20.98,58.76,91.9,76.99,56.01,93.1,129.65,818.0,9.0,0.0,0.0,0.0,11.11,0.46,1.788053066,2010-10-23,2010,OTOÑO
AL41,24/10/2010,1.41,8.43,121.53,176.38,8.12,24.4,15.11,7.373,25.0,31.18,93.5,73.69,28.17,94.1,178.42,681.3,9.0,0.0,0.0,0.0,9.62,0.61,2.691810979,2010-10-24,2010,OTOÑO
AL41,25/10/2010,3.47,15.19,299.54,357.16,9.72,22.91,16.77,8.88,23.22,19.14,90.5,48.32,17.85,92.4,163.58,807.0,9.0,0.0,0.0,0.0,6.73,1.16,4.06930386,2010-10-25,2010,OTOÑO
AL41,26/10/2010,2.42,9.21,209.35,46.4,6.782,20.8,13.5,4.912,21.44,10.03,71.15,32.94,9.25,73.36,195.71,719.9,9.0,0.0,0.0,1.0,2.94,1.12,3.623057309,2010-10-26,2010,OTOÑO
AL41,27/10/2010,1.07,6.664,92.26,164.67,1.764,21.91,10.97,0.954,22.57,16.84,86.8,62.19,13.02,89.7,186.14,694.2,9.0,0.0,0.0,10.0,4.85,0.67,2.327541482,2010-10-27,2010,OTOÑO
AL41,28/10/2010,1.09,6.762,94.45,175.56,3.741,23.02,12.15,3.07,23.49,25.72,86.8,66.2,23.65,89.8,159.87,791.9,8.0,0.0,0.0,8.0,5.0,0.66,2.271999581,2010-10-28,2010,OTOÑO
AL41,29/10/2010,1.49,8.13,128.47,164.3,2.608,20.78,11.85,2.224,21.18,49.42,90.3,74.26,38.79,92.0,154.9,709.6,9.0,0.0,0.0,7.0,7.07,0.45,2.0247643,2010-10-29,2010,OTOÑO
AL41,30/10/2010,1.52,6.468,131.32,203.99,10.52,18.61,15.62,9.96,18.97,37.91,87.0,59.13,36.83,90.5,33.96,185.1,2.0,0.0,0.0,0.0,7.19,0.77,1.72170215,2010-10-30,2010,OTOÑO
AL41,31/10/2010,2.82,13.52,243.51,242.68,11.08,21.76,16.47,10.66,22.65,28.11,84.9,55.25,26.14,87.2,142.12,854.0,8.0,0.0,0.0,0.0,6.44,0.93,3.23751458,2010-10-31,2010,OTOÑO
AL41,01/11/2010,3.21,13.03,277.11,310.85,13.18,22.31,17.63,12.28,22.78,29.01,59.75,43.19,27.49,61.09,162.88,761.0,9.0,0.0,0.0,0.0,4.47,1.21,3.91661722,2010-11-01,2010,OTOÑO
AL41,02/11/2010,3.26,11.96,281.61,349.76,8.62,21.4,16.95,7.769,22.05,27.62,68.16,41.26,26.35,71.15,171.99,653.0,9.0,0.0,0.0,0.0,3.23,1.19,3.578031232,2010-11-02,2010,OTOÑO
AL41,03/11/2010,1.47,7.056,126.75,161.63,5.925,23.27,13.97,5.244,23.62,27.26,81.7,58.55,26.14,87.8,167.5,647.9,9.0,0.0,0.0,2.0,4.98,0.83,2.524138661,2010-11-03,2010,OTOÑO
AL41,04/11/2010,1.46,8.62,125.79,38.03,6.306,22.86,13.65,5.488,23.38,33.78,88.5,67.61,32.08,90.9,161.0,627.3,9.0,0.0,0.0,3.0,6.94,0.67,2.337241106,2010-11-04,2010,OTOÑO
AL41,05/11/2010,1.27,6.86,109.52,6.42,5.905,18.94,13.29,4.914,19.53,50.89,87.8,72.75,49.58,90.3,62.16,689.1,6.0,0.0,0.0,2.0,8.21,0.49,1.464179719,2010-11-05,2010,OTOÑO
AL41,06/11/2010,1.73,7.644,149.37,169.68,8.84,22.63,14.22,7.907,22.88,31.86,91.6,70.87,30.33,93.1,156.05,606.8,8.0,0.0,0.0,0.0,8.21,0.6,2.49427577,2010-11-06,2010,OTOÑO
AL41,07/11/2010,1.46,9.21,125.72,151.03,5.569,23.29,13.98,4.88,24.44,30.11,90.2,66.2,24.36,92.8,135.86,823.0,8.0,0.0,0.0,4.0,6.81,0.71,2.307361545,2010-11-07,2010,OTOÑO
AL41,08/11/2010,2.54,13.13,219.24,226.3,8.16,20.47,15.38,7.136,21.11,27.25,76.4,48.56,25.45,79.95,117.74,714.8,8.0,0.0,0.0,0.0,3.78,0.98,2.863165436,2010-11-08,2010,OTOÑO
AL41,09/11/2010,3.49,13.33,301.13,256.11,13.27,22.79,18.44,11.87,23.53,31.16,50.23,40.37,30.04,52.3,114.21,704.5,8.0,0.0,0.0,0.0,4.59,1.29,4.020082071,2010-11-09,2010,OTOÑO
AL41,10/11/2010,2.73,12.64,235.92,250.73,12.36,19.09,15.07,11.6,20.0,31.26,49.71,40.27,29.06,51.54,141.06,802.0,8.0,0.0,0.0,0.0,1.68,1.05,3.226329487,2010-11-10,2010,OTOÑO
AL41,11/11/2010,1.93,15.68,167.14,211.93,4.201,20.42,11.83,3.002,21.14,24.77,81.7,57.34,22.0,84.8,150.46,786.7,8.0,0.0,0.0,3.0,2.94,0.69,2.529899592,2010-11-11,2010,OTOÑO
AL41,12/11/2010,1.15,6.468,99.18,203.17,5.098,22.03,11.74,3.837,22.64,27.38,82.7,59.9,25.27,85.3,146.48,596.5,8.0,0.0,0.0,9.0,3.18,0.71,1.987341649,2010-11-12,2010,OTOÑO
AL41,13/11/2010,1.36,7.448,117.73,187.86,5.376,22.05,12.32,4.777,22.61,35.84,85.2,66.02,32.45,88.2,144.33,581.1,8.0,0.0,0.0,6.0,5.49,0.62,2.024336624,2010-11-13,2010,OTOÑO
AL41,14/11/2010,1.07,6.272,92.78,167.91,3.957,21.11,11.69,3.164,21.8,36.67,89.9,71.09,34.75,91.7,140.87,581.1,8.0,0.0,0.0,9.0,6.0,0.52,1.68923551,2010-11-14,2010,OTOÑO
AL41,15/11/2010,2.08,9.11,179.85,352.59,9.2,18.65,14.18,7.908,19.06,16.85,78.35,43.29,14.58,80.4,148.77,601.7,8.0,0.0,0.0,0.0,5.6,0.96,2.527935414,2010-11-15,2010,OTOÑO
AL41,16/11/2010,1.56,7.742,134.6,192.35,3.876,18.64,11.11,3.203,19.02,21.37,80.2,49.88,20.08,83.5,142.06,622.2,8.0,0.0,0.0,4.0,3.38,0.75,2.077116485,2010-11-16,2010,OTOÑO
AL41,17/11/2010,0.7,4.9,60.82,220.4,2.62,11.88,7.21,2.258,12.62,61.96,92.5,77.57,56.79,93.0,30.29,205.7,2.0,1.0,0.0,14.0,3.83,0.24,0.762337596,2010-11-17,2010,OTOÑO
AL41,18/11/2010,1.39,7.35,119.88,355.46,3.475,17.78,10.05,2.427,18.42,30.02,91.1,59.87,28.52,92.7,145.76,611.9,8.0,0.0,0.0,8.0,1.75,0.61,1.724880931,2010-11-18,2010,OTOÑO
AL41,19/11/2010,0.93,5.488,80.27,189.34,1.899,15.2,7.05,0.433,15.54,50.94,87.5,71.82,47.59,89.9,65.66,720.0,5.0,0.0,0.0,14.0,2.51,0.33,1.077512082,2010-11-19,2010,OTOÑO
AL41,20/11/2010,1.93,9.11,167.08,139.98,1.052,18.22,10.33,0.128,18.79,48.91,92.3,73.51,45.06,93.6,121.77,614.5,6.0,0.0,0.0,9.0,5.67,0.42,1.693873788,2010-11-20,2010,OTOÑO
AL41,21/11/2010,2.66,10.0,229.97,246.88,6.803,17.93,12.62,5.143,18.45,29.55,79.81,50.53,28.38,85.8,156.39,719.9,8.0,0.0,0.0,1.0,2.28,0.78,2.487100483,2010-11-21,2010,OTOÑO
AL41,22/11/2010,1.88,10.49,162.63,318.19,2.583,16.58,10.12,0.906,17.31,29.1,81.5,52.24,27.1,89.2,135.73,642.8,8.0,0.0,0.0,7.0,1.31,0.68,1.931457747,2010-11-22,2010,OTOÑO
AL41,23/11/2010,0.89,6.272,76.73,178.25,2.476,16.67,8.64,1.447,17.54,31.04,73.53,59.85,29.09,78.8,108.76,792.0,7.0,0.0,0.0,11.0,2.26,0.53,1.30914403,2010-11-23,2010,OTOÑO
AL41,24/11/2010,0.91,5.684,78.33,126.21,7.796,16.66,11.81,7.204,17.34,54.3,94.0,77.47,52.04,94.2,120.32,766.2,7.0,8.9,0.0,0.0,7.78,0.34,1.106513334,2010-11-24,2010,OTOÑO
AL41,25/11/2010,1.04,4.41,89.8,55.77,9.98,14.43,12.11,9.62,14.66,79.74,94.9,90.93,77.01,95.1,42.24,442.3,3.0,1.1,0.0,0.0,10.65,0.13,0.755546748,2010-11-25,2010,OTOÑO
AL41,26/11/2010,2.36,6.958,203.97,23.48,8.01,12.76,10.75,7.745,12.99,40.07,87.9,56.68,38.4,94.8,41.49,231.4,4.0,0.1,0.0,0.0,2.77,0.57,1.639044579,2010-11-26,2010,OTOÑO
AL41,27/11/2010,1.84,5.782,159.21,18.25,7.003,9.05,7.84,6.9,9.22,84.5,94.1,90.65,79.54,94.4,20.62,133.7,0.0,15.3,0.0,0.0,6.41,0.1,0.637556431,2010-11-27,2010,OTOÑO
AL41,28/11/2010,1.24,9.21,106.8,8.29,3.876,16.07,9.42,3.329,16.9,45.06,93.4,74.01,33.75,94.0,131.59,663.4,7.0,1.7,0.0,7.0,4.64,0.36,1.253941796,2010-11-28,2010,OTOÑO
AL41,29/11/2010,1.43,5.39,123.8,24.65,4.806,6.952,5.98,3.879,7.272,76.84,94.0,89.9,69.66,94.2,15.3,128.6,0.0,10.2,0.0,24.0,4.44,0.09,0.638322919,2010-11-29,2010,OTOÑO
AL41,30/11/2010,1.41,10.0,121.8,7.28,6.408,9.35,7.98,6.292,11.83,82.4,94.7,92.1,59.8,95.3,27.96,185.2,0.0,3.2,0.0,5.0,6.76,0.09,0.632491501,2010-11-30,2010,OTOÑO
AL41,01/12/2010,2.35,13.43,202.86,231.98,5.727,14.93,10.53,4.636,15.37,39.22,73.64,57.25,35.31,81.6,112.93,781.7,8.0,0.0,0.0,2.0,2.12,0.58,1.891050825,2010-12-01,2010,OTOÑO
AL41,02/12/2010,1.49,9.31,128.37,271.76,2.604,14.84,8.11,2.191,15.88,27.94,92.3,63.82,24.21,92.5,109.88,725.1,8.0,0.0,0.0,11.0,2.64,0.46,1.497278024,2010-12-02,2010,OTOÑO
AL41,03/12/2010,2.52,11.96,217.31,327.97,0.991,10.97,6.58,0.036,11.19,31.26,69.28,48.92,27.99,81.5,124.96,596.6,7.0,0.0,0.0,16.0,0.43,0.52,1.801746405,2010-12-03,2010,OTOÑO
AL41,04/12/2010,0.92,4.214,79.84,222.23,-0.508,11.08,4.03,-1.712,11.83,28.2,86.5,60.87,24.55,87.8,128.35,555.4,8.0,0.0,2.0,17.0,0.42,0.37,0.98270921,2010-12-04,2010,OTOÑO
AL41,05/12/2010,0.76,3.626,65.64,268.99,3.148,13.47,7.06,2.257,14.16,64.62,90.9,79.25,60.14,91.9,70.84,761.1,7.0,0.0,0.0,15.0,3.61,0.23,0.762756157,2010-12-05,2010,OTOÑO
AL41,06/12/2010,1.59,10.29,137.75,165.68,5.308,20.33,12.01,4.946,20.88,65.08,93.9,86.03,61.19,94.6,85.11,694.2,5.0,0.0,0.0,3.0,9.62,0.24,1.248905198,2010-12-06,2010,OTOÑO
AL41,07/12/2010,1.69,7.84,146.0,130.55,8.45,21.67,14.18,7.508,21.94,52.47,93.5,76.38,50.2,94.4,119.56,534.8,8.0,0.0,0.0,0.0,9.77,0.46,1.602278248,2010-12-07,2010,OTOÑO
AL41,08/12/2010,1.34,8.82,116.0,166.47,9.51,22.24,14.55,8.82,22.78,50.23,92.6,79.59,47.27,93.2,103.53,632.5,8.0,0.3,0.0,0.0,10.77,0.41,1.49102729,2010-12-08,2010,OTOÑO
AL41,09/12/2010,1.0,4.214,85.99,31.97,6.854,22.99,13.75,6.19,23.25,46.96,94.8,79.39,44.36,95.2,118.29,498.8,8.0,0.0,0.0,1.0,9.78,0.44,1.342256823,2010-12-09,2010,OTOÑO
AL41,10/12/2010,1.54,5.292,133.41,31.22,8.05,13.78,11.55,7.406,13.99,88.4,94.0,92.4,87.3,94.5,21.19,195.4,1.0,0.1,0.0,0.0,10.36,0.1,0.633001678,2010-12-10,2010,OTOÑO
AL41,11/12/2010,0.79,4.116,68.19,356.93,3.723,15.35,8.82,2.758,15.72,55.77,95.0,84.02,54.24,95.2,104.61,534.9,7.0,0.0,0.0,12.0,5.99,0.23,0.848562026,2010-12-11,2010,OTOÑO
AL41,12/12/2010,0.56,3.43,48.46,223.55,2.63,18.07,8.5,1.582,18.32,48.77,94.3,81.87,44.05,94.6,81.82,411.4,8.0,0.0,0.0,12.0,5.17,0.28,0.852138707,2010-12-12,2010,OTOÑO
AL41,13/12/2010,1.6,7.056,138.42,29.2,6.742,14.93,11.06,5.987,15.13,67.66,92.5,82.18,65.73,93.6,68.0,334.3,6.0,0.0,0.0,1.0,8.05,0.25,0.984022347,2010-12-13,2010,OTOÑO
AL41,14/12/2010,0.9,6.37,77.81,102.94,5.414,17.44,10.75,4.67,17.68,58.8,94.5,84.65,56.56,94.7,69.65,504.0,6.0,0.1,0.0,5.0,8.07,0.24,0.935803521,2010-12-14,2010,OTOÑO
AL41,15/12/2010,2.66,12.84,229.72,2.59,-0.618,10.24,6.7,-1.51,10.52,24.32,93.3,50.33,22.63,94.3,123.54,504.0,8.0,0.0,1.0,9.0,-4.05,0.52,1.642303493,2010-12-15,2010,OTOÑO
AL41,16/12/2010,2.22,11.07,191.56,6.3,-3.925,8.65,2.53,-4.85,8.91,29.92,82.6,51.51,27.93,86.8,122.07,493.7,8.0,0.0,7.0,20.0,-6.9,0.4,1.417421799,2010-12-16,2010,OTOÑO
AL41,17/12/2010,1.32,7.154,113.92,185.1,-5.8,12.34,3.04,-6.63,12.81,38.47,88.9,69.24,31.13,90.6,112.59,550.3,7.0,0.0,10.0,17.0,-2.55,0.3,1.127599183,2010-12-17,2010,OTOÑO
AL41,18/12/2010,0.86,7.252,74.52,18.48,4.52,8.76,7.5,4.264,9.4,49.02,94.3,75.55,43.72,94.5,19.37,149.2,1.0,3.1,0.0,7.0,3.27,0.25,0.788681965,2010-12-18,2010,OTOÑO
AL41,19/12/2010,0.79,4.41,68.45,5.42,8.35,13.33,9.89,8.17,13.62,87.3,95.2,93.58,86.1,95.3,42.01,437.2,5.0,6.8,0.0,0.0,8.91,0.08,0.582578826,2010-12-19,2010,OTOÑO
AL41,20/12/2010,1.08,6.076,93.44,4.21,2.945,14.32,7.95,2.36,14.86,49.47,93.5,80.63,43.25,94.2,99.76,586.3,7.0,0.0,0.0,13.0,4.48,0.25,0.974438985,2010-12-20,2010,OTOÑO
AL41,21/12/2010,1.45,7.252,125.5,176.31,7.307,14.75,9.76,6.629,15.33,86.0,95.2,92.12,82.5,95.4,54.24,658.3,4.0,2.2,0.0,0.0,8.54,0.1,0.670684409,2010-12-21,2010,OTOÑO
AL41,22/12/2010,1.23,7.448,105.92,203.5,7.863,15.97,11.09,7.44,16.31,66.67,95.3,88.16,62.15,95.5,62.07,540.0,6.0,1.1,0.0,0.0,9.11,0.18,0.916262318,2010-12-22,2010,INVIERNO
AL41,23/12/2010,2.49,12.64,214.99,246.34,6.468,16.77,11.48,5.65,17.77,38.62,93.0,62.61,33.3,93.9,102.88,666.0,7.0,0.2,0.0,1.0,3.83,0.56,1.851150645,2010-12-23,2010,INVIERNO
AL41,24/12/2010,2.56,10.09,221.39,288.94,3.069,11.33,7.7,2.123,11.81,30.56,64.81,48.74,27.96,70.09,83.32,504.0,7.0,0.0,0.0,9.0,-2.79,0.56,1.921400215,2010-12-24,2010,INVIERNO
AL41,25/12/2010,2.3,8.72,198.48,4.33,3.673,13.76,8.09,2.495,14.19,17.29,54.22,37.21,14.45,60.99,101.96,694.3,7.0,0.0,0.0,9.0,-6.31,0.71,2.300658089,2010-12-25,2010,INVIERNO
AL41,26/12/2010,2.9,10.39,250.75,33.56,-3.35,10.52,4.33,-3.836,10.79,20.7,82.2,41.27,17.76,84.2,132.35,565.7,8.0,0.0,4.0,17.0,-8.87,0.55,1.937362306,2010-12-26,2010,INVIERNO
AL41,27/12/2010,1.08,6.664,93.48,175.91,-5.734,13.11,2.72,-6.232,13.51,41.25,93.3,74.58,30.32,93.9,129.15,545.1,8.0,0.0,12.0,17.0,-1.82,0.25,0.998794571,2010-12-27,2010,INVIERNO
AL41,28/12/2010,0.71,4.508,60.96,218.96,-2.165,15.24,5.02,-3.031,15.62,37.82,94.3,77.36,33.42,94.7,102.76,581.1,8.0,0.0,8.0,15.0,0.64,0.29,0.905902075,2010-12-28,2010,INVIERNO
AL41,29/12/2010,0.88,4.116,76.0,27.04,-0.965,12.98,5.01,-1.786,13.21,55.68,94.6,84.14,50.55,94.9,95.41,570.9,7.0,0.0,4.0,16.0,2.3,0.18,0.804408764,2010-12-29,2010,INVIERNO
AL41,30/12/2010,0.95,5.978,81.95,351.54,2.168,13.07,8.08,1.379,13.38,61.82,92.9,81.74,59.46,93.9,68.93,637.7,5.0,0.0,0.0,8.0,4.99,0.22,0.808784609,2010-12-30,2010,INVIERNO
AL41,31/12/2010,0.54,3.43,46.49,31.53,0.918,13.12,7.13,0.5,13.71,81.7,94.9,92.43,79.41,95.0,67.58,627.4,5.0,6.5,0.0,10.0,5.97,0.09,0.576209544,2010-12-31,2010,INVIERNO
AL41,01/01/2011,0.57,3.43,49.53,199.98,7.929,14.8,10.8,7.635,15.22,69.6,96.5,90.29,67.03,96.6,58.28,745.7,5.0,1.0,0.0,0.0,9.2,0.14,0.702741374,2011-01-01,2011,INVIERNO
AL41,02/01/2011,0.83,6.076,71.43,314.31,4.772,17.15,9.31,3.765,17.91,41.67,95.1,76.86,36.92,95.4,86.26,668.4,7.0,0.0,0.0,10.0,4.81,0.35,1.054315403,2011-01-02,2011,INVIERNO
AL41,03/01/2011,1.13,6.762,97.48,187.16,0.812,15.88,7.6,0.169,16.19,43.06,92.9,76.28,38.34,93.8,124.77,534.8,8.0,0.0,0.0,12.0,3.15,0.33,1.146609526,2011-01-03,2011,INVIERNO
AL41,04/01/2011,0.89,4.41,76.6,192.35,-0.219,14.98,6.88,-0.67,15.19,49.39,95.6,84.85,44.02,95.7,108.85,550.3,7.0,0.0,1.0,12.0,4.2,0.2,0.939004044,2011-01-04,2011,INVIERNO
AL41,05/01/2011,1.24,5.782,106.73,184.27,2.181,16.46,8.38,1.616,16.8,59.02,96.3,85.65,55.52,96.4,113.68,565.7,7.0,0.0,0.0,10.0,5.87,0.21,1.056552109,2011-01-05,2011,INVIERNO
AL41,06/01/2011,1.31,6.566,113.41,171.31,4.07,17.86,10.06,2.895,18.42,55.78,95.8,82.04,52.62,96.1,118.2,534.8,8.0,0.0,0.0,10.0,6.81,0.3,1.194364763,2011-01-06,2011,INVIERNO
AL41,07/01/2011,1.54,8.82,133.07,212.91,5.11,18.56,11.77,4.605,19.23,41.58,96.1,73.34,35.74,96.3,83.36,709.7,6.0,0.0,0.0,6.0,6.49,0.47,1.521125403,2011-01-07,2011,INVIERNO
AL41,08/01/2011,1.8,6.566,155.4,184.71,4.917,18.38,11.46,3.968,18.83,46.05,93.8,73.0,42.19,94.2,124.9,545.1,8.0,0.0,0.0,4.0,6.42,0.43,1.5882843,2011-01-08,2011,INVIERNO
AL41,09/01/2011,1.82,7.938,157.6,230.5,4.927,17.73,10.84,4.001,18.18,35.23,94.2,69.35,33.68,94.6,103.74,617.1,7.0,0.0,0.0,9.0,4.57,0.5,1.75004526,2011-01-09,2011,INVIERNO
AL41,10/01/2011,0.92,5.096,79.91,181.53,3.632,16.04,9.05,2.732,16.4,32.52,88.8,66.61,30.64,91.5,131.01,550.2,8.0,0.0,0.0,11.0,2.29,0.47,1.174572989,2011-01-10,2011,INVIERNO
AL41,11/01/2011,1.52,7.448,131.4,245.23,3.919,19.69,11.48,3.091,20.31,37.97,86.4,63.02,35.54,89.2,89.61,642.8,8.0,0.0,0.0,9.0,3.94,0.64,1.728515479,2011-01-11,2011,INVIERNO
AL41,12/01/2011,2.67,11.27,231.06,17.54,5.486,20.42,13.9,4.839,20.67,35.38,87.9,56.9,33.88,91.3,129.28,581.0,8.0,0.0,0.0,2.0,4.77,0.8,2.42540651,2011-01-12,2011,INVIERNO
AL41,13/01/2011,1.43,7.644,123.32,182.24,3.496,19.63,10.09,2.867,20.13,40.4,91.4,74.69,35.06,92.5,130.58,550.2,8.0,0.0,0.0,9.0,5.26,0.41,1.646566515,2011-01-13,2011,INVIERNO
AL41,14/01/2011,0.76,3.332,65.89,202.56,1.598,21.11,9.53,0.94,21.6,32.67,94.2,75.64,30.94,94.6,132.44,550.2,8.0,0.0,0.0,12.0,4.53,0.45,1.310032247,2011-01-14,2011,INVIERNO
AL41,15/01/2011,1.75,8.33,151.48,142.2,4.578,18.43,9.97,4.074,18.79,40.42,93.7,76.34,37.97,93.9,131.37,560.5,8.0,0.0,0.0,7.0,5.53,0.36,1.756744618,2011-01-15,2011,INVIERNO
AL41,16/01/2011,0.85,5.782,73.27,167.62,3.352,15.38,8.74,3.062,15.72,60.25,95.9,86.87,58.52,96.6,119.82,555.4,7.0,0.0,0.0,9.0,6.5,0.18,0.970226148,2011-01-16,2011,INVIERNO
AL41,17/01/2011,0.92,5.292,79.62,166.36,0.604,16.18,7.71,-0.041,16.46,57.83,96.9,86.39,55.65,97.2,97.54,385.8,7.0,0.1,0.0,11.0,5.35,0.2,1.010715153,2011-01-17,2011,INVIERNO
AL41,18/01/2011,1.25,4.998,108.19,30.03,8.17,12.58,10.32,8.01,12.87,62.97,91.6,78.79,61.56,91.9,62.63,380.6,6.0,0.0,0.0,0.0,6.68,0.28,0.981492743,2011-01-18,2011,INVIERNO
AL41,19/01/2011,1.53,5.096,132.11,45.56,9.07,13.8,11.21,8.74,14.15,53.69,86.0,70.58,52.5,87.7,47.66,288.0,5.0,0.0,0.0,0.0,5.91,0.41,1.250963084,2011-01-19,2011,INVIERNO
AL41,20/01/2011,1.11,6.076,95.86,169.53,1.504,15.26,8.69,0.838,15.86,48.84,93.7,79.66,46.17,94.1,88.92,401.1,8.0,0.0,0.0,9.0,5.03,0.28,1.170981161,2011-01-20,2011,INVIERNO
AL41,21/01/2011,2.35,9.11,202.85,21.99,-2.348,11.76,6.45,-3.031,12.1,25.76,93.1,61.3,22.66,94.0,104.65,411.4,8.0,0.0,2.0,12.0,-1.59,0.43,1.809742208,2011-01-21,2011,INVIERNO
AL41,22/01/2011,1.33,6.468,114.87,11.41,-3.63,9.96,2.11,-4.141,11.29,22.5,82.3,55.46,20.4,85.9,109.53,416.6,8.0,0.0,11.0,18.0,-7.24,0.39,1.374010358,2011-01-22,2011,INVIERNO
AL41,23/01/2011,2.4,7.546,207.62,19.92,-2.223,6.876,3.47,-2.963,7.103,44.86,85.8,68.13,43.42,90.0,25.53,385.8,1.0,0.0,6.0,24.0,-2.14,0.27,1.243960215,2011-01-23,2011,INVIERNO
AL41,24/01/2011,3.33,8.72,287.58,19.39,5.481,8.92,6.94,5.346,9.08,47.88,78.7,61.74,46.21,81.8,16.31,97.7,0.0,0.0,0.0,13.0,0.03,0.39,1.665438567,2011-01-24,2011,INVIERNO
AL41,25/01/2011,1.73,4.704,149.17,22.11,6.063,7.966,7.04,5.92,8.07,60.11,81.4,69.03,58.56,81.6,13.17,66.87,0.0,0.0,0.0,13.0,1.71,0.31,1.032641147,2011-01-25,2011,INVIERNO
AL41,26/01/2011,2.31,7.252,199.6,27.64,5.671,11.36,8.06,0.0,11.83,63.31,92.6,81.81,60.68,92.9,41.88,401.1,4.0,1.1,0.0,10.0,5.14,0.2,1.138860345,2011-01-26,2011,INVIERNO
AL41,27/01/2011,1.71,7.252,147.96,29.57,3.99,11.02,7.82,3.63,11.33,67.72,92.6,84.21,62.86,93.3,54.08,442.4,6.0,8.4,0.0,5.0,5.25,0.18,0.972034334,2011-01-27,2011,INVIERNO
AL41,28/01/2011,0.91,4.802,78.19,197.56,3.178,12.84,7.22,2.762,13.41,70.38,93.9,87.48,67.22,94.2,67.7,576.1,6.0,0.0,0.0,14.0,5.19,0.15,0.85591576,2011-01-28,2011,INVIERNO
AL41,29/01/2011,1.59,8.04,137.63,253.69,1.872,15.69,7.98,0.872,16.67,36.73,94.9,69.92,32.13,95.1,119.26,601.6,9.0,0.0,0.0,12.0,2.07,0.41,1.684280446,2011-01-29,2011,INVIERNO
AL41,30/01/2011,1.24,7.546,107.15,26.09,-0.929,13.92,6.67,-1.481,14.31,41.5,92.0,74.31,33.62,93.5,114.35,565.7,8.0,2.3,3.0,10.0,1.96,0.31,1.370781329,2011-01-30,2011,INVIERNO
AL41,31/01/2011,3.01,9.11,260.07,348.95,3.949,10.99,7.93,2.246,11.9,44.37,80.1,60.48,41.34,83.4,103.39,689.1,8.0,0.2,0.0,10.0,0.52,0.44,1.85333366,2011-01-31,2011,INVIERNO
AL41,01/02/2011,1.94,8.72,167.59,333.37,1.495,12.69,6.38,-0.276,13.05,35.49,81.4,61.71,33.6,88.4,115.45,653.2,8.0,0.0,0.0,15.0,-1.12,0.43,1.778679243,2011-02-01,2011,INVIERNO
AL41,02/02/2011,2.45,10.68,211.73,13.02,1.37,16.03,8.24,0.5,16.4,23.16,86.6,51.29,20.05,89.0,146.49,653.1,9.0,0.0,0.0,11.0,-2.23,0.61,2.511634102,2011-02-02,2011,INVIERNO
AL41,03/02/2011,2.09,8.13,180.67,54.9,1.028,16.23,7.92,0.027,16.5,20.73,87.3,54.92,17.82,90.6,156.75,565.7,9.0,0.0,0.0,12.0,-1.79,0.58,2.406094257,2011-02-03,2011,INVIERNO
AL41,04/02/2011,1.47,9.02,127.06,187.96,-0.41,17.83,7.27,-1.346,18.35,26.57,88.7,60.45,24.77,91.5,152.93,555.3,9.0,0.0,2.0,13.0,-1.14,0.56,2.074600331,2011-02-04,2011,INVIERNO
AL41,05/02/2011,1.3,7.84,112.6,175.65,-0.697,17.95,7.14,-1.847,18.45,31.0,90.7,69.8,27.64,93.2,152.9,557.9,9.0,0.0,3.0,14.0,1.0,0.44,1.912215345,2011-02-05,2011,INVIERNO
AL41,06/02/2011,1.06,6.664,91.76,162.61,0.455,19.6,7.76,-0.467,20.13,21.5,91.0,66.6,16.16,93.4,155.07,565.6,9.0,0.0,0.0,14.0,0.57,0.52,1.969093417,2011-02-06,2011,INVIERNO
AL41,07/02/2011,0.92,6.37,79.74,167.8,-1.418,16.15,6.31,-3.064,16.67,38.0,92.5,74.86,32.57,93.6,151.73,565.7,9.0,0.0,5.0,13.0,1.5,0.35,1.506398919,2011-02-07,2011,INVIERNO
AL41,08/02/2011,0.95,6.174,82.08,175.6,-1.871,13.97,5.21,-2.626,14.79,60.81,96.3,86.53,58.15,96.6,101.8,740.6,7.0,0.1,6.0,15.0,2.93,0.17,1.103309388,2011-02-08,2011,INVIERNO
AL41,09/02/2011,1.17,7.546,100.98,170.86,-1.159,16.79,6.85,-2.087,17.31,43.17,97.0,82.31,40.87,97.3,151.39,568.2,9.0,0.0,5.0,13.0,3.51,0.27,1.642744146,2011-02-09,2011,INVIERNO
AL41,10/02/2011,1.09,6.174,94.09,170.08,2.992,15.45,9.2,2.563,16.02,47.58,95.3,79.67,44.85,95.4,132.73,712.3,7.0,0.2,0.0,4.0,5.56,0.28,1.489687267,2011-02-10,2011,INVIERNO
AL41,11/02/2011,1.16,6.37,100.21,174.61,-2.314,15.38,5.73,-2.76,15.82,54.18,96.3,81.89,52.08,96.6,169.41,671.1,9.0,0.0,6.0,15.0,2.49,0.24,1.513917329,2011-02-11,2011,INVIERNO
AL41,12/02/2011,1.3,8.62,112.01,214.54,0.059,19.86,8.42,-0.365,20.3,25.43,94.3,72.05,23.79,94.8,177.0,678.7,9.0,0.0,0.0,13.0,2.43,0.47,2.267988326,2011-02-12,2011,INVIERNO
AL41,13/02/2011,2.07,11.37,178.9,173.47,0.543,18.03,9.16,-0.061,18.62,38.84,92.0,73.03,33.02,92.7,174.64,709.6,8.0,0.0,0.0,9.0,3.92,0.41,2.361092888,2011-02-13,2011,INVIERNO
AL41,14/02/2011,2.13,12.84,183.92,270.77,5.401,16.05,11.2,0.0,16.77,24.83,91.9,50.91,21.03,93.4,172.24,838.0,8.0,0.9,0.0,3.0,0.09,0.72,2.470857295,2011-02-14,2011,INVIERNO
AL41,15/02/2011,1.8,9.21,155.82,189.07,7.753,12.49,9.94,6.258,12.69,51.27,89.3,70.43,47.83,90.7,47.44,421.7,4.0,2.8,0.0,0.0,4.68,0.36,1.393712562,2011-02-15,2011,INVIERNO
AL41,16/02/2011,3.02,13.43,260.93,201.02,7.107,15.81,11.1,5.582,16.6,34.88,73.71,51.47,30.41,81.3,143.55,818.0,8.0,0.0,0.0,0.0,1.19,0.67,2.8099329,2011-02-16,2011,INVIERNO
AL41,17/02/2011,3.16,18.52,273.16,267.51,4.534,16.55,11.38,2.143,17.07,23.94,67.07,46.88,21.36,79.08,165.76,920.0,9.0,0.0,0.0,2.0,-0.16,0.77,3.270462113,2011-02-17,2011,INVIERNO
AL41,18/02/2011,2.51,12.15,217.13,139.56,4.571,17.96,12.01,4.001,18.75,27.97,84.2,50.22,24.67,87.5,198.83,725.0,9.0,0.2,0.0,2.0,1.23,0.76,2.964086215,2011-02-18,2011,INVIERNO
AL41,19/02/2011,1.15,6.076,99.62,184.37,4.475,18.26,10.28,3.462,18.72,29.38,87.2,62.37,27.23,90.9,151.52,1095.0,8.0,0.0,0.0,9.0,2.43,0.58,2.075389341,2011-02-19,2011,INVIERNO
AL41,20/02/2011,2.35,9.7,202.97,287.99,10.86,20.03,15.34,8.02,20.98,32.8,77.56,51.52,27.47,80.8,151.71,1080.0,9.0,0.1,0.0,0.0,4.81,0.9,2.997955251,2011-02-20,2011,INVIERNO
AL41,21/02/2011,2.8,10.39,241.89,313.71,8.84,20.2,15.49,8.21,20.47,24.53,68.77,41.61,23.45,71.72,185.33,833.0,9.0,0.0,0.0,0.0,1.79,1.1,3.608206221,2011-02-21,2011,INVIERNO
AL41,22/02/2011,2.83,11.56,244.31,301.82,13.51,22.65,17.38,12.99,23.25,29.63,55.67,42.49,27.83,57.61,148.9,818.0,9.0,0.0,0.0,0.0,4.19,1.2,3.99886213,2011-02-22,2011,INVIERNO
AL41,23/02/2011,3.96,12.54,342.18,14.81,10.13,21.22,16.2,9.55,21.97,29.83,71.84,45.11,28.31,74.62,184.7,856.0,9.0,0.0,0.0,0.0,3.87,1.06,4.207988124,2011-02-23,2011,INVIERNO
AL41,24/02/2011,1.53,7.84,132.38,161.09,3.277,21.17,11.46,2.495,21.93,33.53,88.2,67.33,31.55,91.2,198.81,740.5,9.0,0.0,0.0,9.0,4.87,0.58,2.721713536,2011-02-24,2011,INVIERNO
AL41,25/02/2011,1.87,8.04,161.26,122.27,3.587,19.13,11.02,2.563,19.83,38.26,91.2,70.86,36.14,93.9,202.37,745.6,9.0,0.0,0.0,8.0,5.2,0.5,2.670909919,2011-02-25,2011,INVIERNO
AL41,26/02/2011,2.16,9.51,186.42,53.75,2.709,28.04,14.47,1.988,28.43,13.22,94.3,56.31,12.44,94.7,208.6,941.0,9.0,0.0,0.0,7.0,2.59,1.14,4.544062056,2011-02-26,2011,INVIERNO
AL41,27/02/2011,2.35,14.31,202.73,353.16,3.212,16.24,10.31,2.934,16.51,31.84,80.8,53.35,28.11,84.2,86.9,823.0,5.0,0.0,0.0,6.0,0.44,0.65,2.437532222,2011-02-27,2011,INVIERNO
AL41,28/02/2011,3.43,16.46,295.96,350.08,3.041,14.78,9.66,1.582,15.83,22.54,57.05,38.69,20.25,62.68,150.48,962.0,10.0,0.0,0.0,6.0,-4.48,0.79,3.412351798,2011-02-28,2011,INVIERNO
AL41,01/03/2011,3.24,12.45,279.51,5.97,4.183,13.39,8.58,2.629,14.25,24.11,69.61,40.29,22.72,72.56,215.46,797.2,10.0,0.0,0.0,7.0,-4.9,0.7,3.239351146,2011-03-01,2011,INVIERNO
AL41,02/03/2011,2.06,9.11,177.61,151.53,-0.303,14.6,6.37,-1.61,15.35,22.44,78.6,53.53,20.82,85.4,201.71,828.0,10.0,0.0,1.0,13.0,-3.53,0.54,2.742589281,2011-03-02,2011,INVIERNO
AL41,03/03/2011,1.78,9.41,153.64,160.84,-0.192,14.98,7.58,-1.043,15.92,34.26,88.8,63.4,28.89,90.2,182.4,977.0,7.0,3.6,1.0,9.0,0.47,0.44,2.349907521,2011-03-03,2011,INVIERNO
AL41,04/03/2011,2.48,9.21,214.62,33.12,6.004,11.37,8.24,5.717,12.17,63.79,91.7,81.56,59.27,92.0,124.24,1065.0,8.0,0.5,0.0,8.0,5.18,0.21,1.6262992,2011-03-04,2011,INVIERNO
AL41,05/03/2011,2.13,7.742,184.17,27.36,5.05,13.05,8.73,4.001,13.96,53.59,92.7,77.29,51.76,93.6,93.33,1029.0,7.0,0.0,0.0,8.0,4.71,0.29,1.685924598,2011-03-05,2011,INVIERNO
AL41,06/03/2011,2.46,7.84,212.38,23.0,5.584,15.55,10.31,4.914,16.26,45.59,89.7,70.73,41.76,91.8,194.95,890.0,10.0,0.0,0.0,6.0,4.76,0.42,2.569501455,2011-03-06,2011,INVIERNO
AL41,07/03/2011,3.94,11.56,340.74,24.76,7.62,16.46,11.81,7.238,16.87,35.78,83.2,65.47,32.4,85.7,208.94,854.0,10.0,0.0,0.0,0.0,5.01,0.52,3.468594322,2011-03-07,2011,INVIERNO
AL41,08/03/2011,5.36,12.15,462.93,26.46,8.37,13.84,11.76,7.938,14.16,61.31,76.13,68.86,60.29,77.99,45.62,879.0,4.0,0.0,0.0,0.0,6.22,0.43,2.243608547,2011-03-08,2011,INVIERNO
AL41,09/03/2011,5.0,10.78,431.94,27.15,10.3,13.01,11.43,10.16,13.32,60.87,76.64,68.26,58.52,78.74,30.44,149.1,0.0,0.0,0.0,0.0,5.77,0.43,2.147513687,2011-03-09,2011,INVIERNO
AL41,10/03/2011,2.99,7.938,258.4,22.96,8.65,11.26,10.04,8.55,11.44,65.87,91.1,80.42,65.09,91.7,30.32,200.6,1.0,9.9,0.0,0.0,6.78,0.25,1.299591665,2011-03-10,2011,INVIERNO
AL41,11/03/2011,3.11,9.02,269.07,10.65,8.52,11.06,9.58,8.31,11.2,84.8,94.3,90.43,83.3,94.4,17.43,108.0,0.0,10.3,0.0,0.0,8.09,0.11,0.806714926,2011-03-11,2011,INVIERNO
AL41,12/03/2011,1.88,6.664,162.59,23.32,9.8,16.52,12.51,9.08,16.94,65.67,94.6,87.33,61.22,94.7,94.07,1049.0,7.0,0.0,0.0,0.0,10.37,0.2,1.665748385,2011-03-12,2011,INVIERNO
AL41,13/03/2011,2.11,10.88,181.94,168.06,6.079,17.79,11.9,5.147,18.35,56.12,92.5,78.69,48.3,93.7,240.08,848.0,10.0,0.0,0.0,4.0,8.03,0.36,2.777552113,2011-03-13,2011,INVIERNO
AL41,14/03/2011,2.48,7.938,213.88,23.12,10.08,16.88,13.23,9.65,17.41,64.89,93.9,81.43,61.86,94.2,151.71,1137.0,8.0,1.9,0.0,0.0,9.95,0.31,2.16914531,2011-03-14,2011,INVIERNO
AL41,15/03/2011,1.63,7.644,141.2,173.57,10.7,17.68,13.01,10.53,18.62,51.41,93.9,76.53,44.95,94.1,148.36,1064.0,9.0,1.6,0.0,0.0,8.64,0.38,2.26947707,2011-03-15,2011,INVIERNO
AL41,16/03/2011,2.71,11.07,233.76,254.64,4.2,19.7,13.26,3.332,20.21,24.45,81.8,46.61,19.57,86.8,241.95,1018.0,11.0,0.0,0.0,4.0,1.08,0.92,3.931026234,2011-03-16,2011,INVIERNO
AL41,17/03/2011,3.46,14.31,298.97,307.34,12.53,20.79,16.42,12.04,21.22,29.56,57.11,42.17,26.93,59.26,203.2,915.0,10.0,0.0,0.0,0.0,3.17,1.12,4.64574818,2011-03-17,2011,INVIERNO
AL41,18/03/2011,3.43,9.8,296.01,85.32,6.88,20.31,14.4,6.123,20.93,27.33,87.3,50.46,24.87,88.9,264.73,882.0,10.0,0.0,0.0,1.0,3.46,0.89,4.361777962,2011-03-18,2011,INVIERNO
AL41,19/03/2011,1.7,7.742,146.74,157.53,4.314,23.25,13.04,3.44,23.92,24.75,90.8,63.36,22.53,92.5,261.38,874.0,10.0,0.0,0.0,8.0,4.86,0.77,3.868181983,2011-03-19,2011,INVIERNO
AL41,20/03/2011,2.18,10.39,188.77,110.37,3.39,19.23,11.54,2.454,19.67,37.64,91.7,70.65,35.13,93.2,260.24,874.0,10.0,0.0,0.0,7.0,5.59,0.52,3.44037772,2011-03-20,2011,INVIERNO
AL41,21/03/2011,2.29,8.82,197.54,66.43,6.439,15.18,11.38,5.683,15.67,52.63,91.3,74.99,47.7,93.0,129.1,1101.0,10.0,0.0,0.0,1.0,6.82,0.37,2.177389879,2011-03-21,2011,PRIMAVERA
AL41,22/03/2011,4.18,11.56,360.78,38.89,8.65,14.41,11.25,8.34,14.93,45.23,89.6,66.14,39.03,90.0,136.0,977.0,11.0,0.3,0.0,0.0,4.8,0.48,2.754874236,2011-03-22,2011,PRIMAVERA
AL41,23/03/2011,4.59,12.35,396.28,30.36,8.86,15.98,11.94,8.65,16.45,68.98,92.3,83.79,66.17,93.2,89.32,951.0,7.0,5.1,0.0,0.0,9.22,0.24,1.950378466,2011-03-23,2011,PRIMAVERA
AL41,24/03/2011,3.67,8.92,317.24,21.61,11.26,14.86,12.63,11.07,15.2,77.99,92.0,86.87,75.46,92.8,49.54,396.0,5.0,1.7,0.0,0.0,10.49,0.2,1.36917872,2011-03-24,2011,PRIMAVERA
AL41,25/03/2011,2.29,5.88,198.22,46.56,9.61,16.6,13.3,8.67,16.97,65.05,90.1,81.16,62.88,91.7,126.9,1049.0,9.0,0.0,0.0,0.0,10.05,0.3,2.091284847,2011-03-25,2011,PRIMAVERA
AL41,26/03/2011,2.33,9.51,200.94,156.26,6.819,19.23,12.31,6.596,19.83,55.27,95.5,83.95,50.79,95.7,235.24,992.0,10.0,0.1,0.0,1.0,9.42,0.29,3.056787358,2011-03-26,2011,PRIMAVERA
AL41,27/03/2011,2.29,10.88,197.91,190.79,10.52,22.14,16.19,9.65,22.85,31.26,93.3,63.71,26.58,93.5,261.83,936.0,10.0,0.0,0.0,0.0,8.18,0.79,4.134765295,2011-03-27,2011,PRIMAVERA
AL41,28/03/2011,1.79,9.02,154.39,195.86,9.93,21.66,15.75,8.91,22.27,30.56,89.6,57.65,26.82,91.1,208.39,1095.0,11.0,0.0,0.0,0.0,6.69,0.84,3.533718419,2011-03-28,2011,PRIMAVERA
AL41,29/03/2011,1.28,7.644,110.43,196.83,9.06,18.98,13.43,8.58,19.57,52.06,90.1,78.47,45.56,91.0,102.03,1080.0,7.0,7.4,0.0,0.0,9.54,0.37,2.012565362,2011-03-29,2011,PRIMAVERA
AL41,30/03/2011,2.18,9.8,187.97,359.01,7.626,23.11,15.37,6.866,23.55,30.42,92.6,64.68,27.26,93.6,266.66,1095.0,11.0,0.0,0.0,0.0,7.61,0.79,4.250335464,2011-03-30,2011,PRIMAVERA
AL41,31/03/2011,1.85,8.92,159.42,169.9,6.973,23.31,15.34,6.461,23.69,39.36,91.3,67.4,35.12,92.5,278.55,905.0,11.0,0.0,0.0,1.0,8.59,0.72,4.034026138,2011-03-31,2011,PRIMAVERA
AL41,01/04/2011,1.44,6.86,124.58,165.72,6.056,23.43,14.78,5.689,24.02,34.19,92.6,64.89,32.62,93.3,284.8,920.0,11.0,0.0,0.0,3.0,7.06,0.79,3.952434385,2011-04-01,2011,PRIMAVERA
AL41,02/04/2011,1.49,6.86,129.09,172.51,5.181,24.76,15.09,4.347,25.24,30.98,90.2,63.0,28.98,91.4,241.66,956.0,10.0,0.0,0.0,6.0,6.97,0.86,3.867973725,2011-04-02,2011,PRIMAVERA
AL41,03/04/2011,1.99,10.19,171.76,14.94,12.76,24.77,18.29,12.31,25.14,34.85,87.1,63.81,33.16,88.0,111.63,622.2,9.0,0.0,0.0,0.0,10.64,0.88,3.243741967,2011-04-03,2011,PRIMAVERA
AL41,04/04/2011,3.05,10.39,263.68,41.45,13.68,25.29,19.07,12.98,25.85,28.48,79.34,51.54,23.11,82.8,273.07,905.0,11.0,0.0,0.0,0.0,8.19,1.16,5.391847471,2011-04-04,2011,PRIMAVERA
AL41,05/04/2011,3.78,8.62,326.65,29.95,12.49,20.9,16.23,12.18,21.18,40.17,85.8,62.53,38.5,86.9,185.53,1023.0,10.0,0.0,0.0,0.0,8.65,0.75,4.026202262,2011-04-05,2011,PRIMAVERA
AL41,06/04/2011,3.94,9.6,340.47,23.67,10.7,22.77,17.14,10.26,23.28,29.91,71.29,49.3,27.15,73.91,237.26,864.0,10.0,0.0,0.0,0.0,5.94,1.07,5.224638311,2011-04-06,2011,PRIMAVERA
AL41,07/04/2011,2.64,8.33,227.95,31.68,8.83,25.41,17.7,7.708,25.95,13.53,67.42,38.49,12.41,73.46,278.76,905.0,11.0,0.0,0.0,0.0,1.58,1.41,5.646567502,2011-04-07,2011,PRIMAVERA
AL41,08/04/2011,1.62,8.04,139.99,162.88,4.43,26.12,15.12,3.907,26.62,13.36,80.7,46.3,12.04,82.9,289.44,925.0,11.0,0.0,0.0,6.0,1.14,1.25,4.842150015,2011-04-08,2011,PRIMAVERA
AL41,09/04/2011,1.74,10.0,150.04,168.43,8.02,32.91,19.7,7.508,33.57,14.66,76.87,47.44,12.0,80.3,289.4,928.0,11.0,0.0,0.0,0.0,5.99,1.66,5.931786654,2011-04-09,2011,PRIMAVERA
AL41,10/04/2011,3.03,10.88,262.2,135.91,16.6,28.92,21.76,15.31,29.84,23.74,68.61,40.7,20.76,71.24,288.15,910.0,11.0,0.0,0.0,0.0,7.16,1.65,6.500928019,2011-04-10,2011,PRIMAVERA
AL41,11/04/2011,2.87,10.68,248.0,78.47,12.04,22.06,17.55,11.58,22.79,42.16,78.17,59.04,40.15,80.1,216.34,1229.0,11.0,0.0,0.0,0.0,9.18,0.87,4.152331754,2011-04-11,2011,PRIMAVERA
AL41,12/04/2011,1.69,9.51,146.05,175.25,7.565,23.87,15.95,7.035,24.73,34.15,88.4,62.55,32.79,90.3,280.16,1095.0,11.0,0.0,0.0,0.0,7.84,0.86,4.292699967,2011-04-12,2011,PRIMAVERA
AL41,13/04/2011,2.37,9.31,204.63,167.71,7.156,23.76,15.8,6.156,24.43,36.99,88.5,64.37,33.87,90.8,305.73,956.0,12.0,0.0,0.0,0.0,8.33,0.81,4.734117129,2011-04-13,2011,PRIMAVERA
AL41,14/04/2011,2.03,9.02,175.31,166.86,9.35,26.06,17.26,8.69,26.86,26.4,93.7,62.6,24.66,94.0,301.21,946.0,11.0,0.0,0.0,0.0,8.48,0.96,5.066481596,2011-04-14,2011,PRIMAVERA
AL41,15/04/2011,2.38,9.21,205.38,112.23,8.92,21.14,16.19,8.32,21.92,49.82,92.3,69.47,48.22,93.8,214.24,1250.0,11.0,0.0,0.0,0.0,10.17,0.65,3.49956136,2011-04-15,2011,PRIMAVERA
AL41,16/04/2011,2.62,9.02,226.39,87.65,8.42,18.56,15.6,7.576,19.5,42.22,78.81,59.74,38.34,82.6,142.04,1018.0,11.0,0.0,0.0,0.0,7.43,0.75,3.133432505,2011-04-16,2011,PRIMAVERA
AL41,17/04/2011,2.73,11.47,235.63,70.07,7.351,20.08,13.56,7.136,20.61,34.9,90.8,63.11,32.46,91.1,276.35,1224.0,12.0,0.0,0.0,0.0,5.83,0.69,4.259695043,2011-04-17,2011,PRIMAVERA
AL41,18/04/2011,2.59,8.82,223.7,31.08,8.77,20.08,14.02,7.947,20.67,40.96,86.6,65.29,39.11,87.9,243.16,1142.0,11.0,0.0,0.0,0.0,7.11,0.64,3.926904346,2011-04-18,2011,PRIMAVERA
AL41,19/04/2011,1.86,7.154,160.27,159.52,7.471,18.17,12.74,6.663,19.03,65.29,90.7,82.98,61.63,92.5,133.6,1368.0,6.0,4.2,0.0,0.0,9.84,0.28,2.217397471,2011-04-19,2011,PRIMAVERA
AL41,20/04/2011,2.57,8.53,222.39,32.26,9.56,21.05,15.51,8.88,21.55,41.04,93.0,72.96,37.66,94.0,216.28,1162.0,12.0,0.0,0.0,0.0,10.23,0.54,3.791486396,2011-04-20,2011,PRIMAVERA
AL41,21/04/2011,2.58,9.6,223.24,23.75,12.92,18.01,15.97,12.41,18.52,62.03,88.8,76.95,60.36,90.3,104.93,1203.0,6.0,8.5,0.0,0.0,11.86,0.42,2.309422122,2011-04-21,2011,PRIMAVERA
AL41,22/04/2011,2.33,9.11,201.15,169.9,7.052,20.59,14.42,6.461,21.04,37.64,93.9,68.42,32.8,94.2,253.47,1219.0,12.0,0.1,0.0,0.0,8.03,0.62,3.982468059,2011-04-22,2011,PRIMAVERA
AL41,23/04/2011,1.84,9.7,159.35,140.3,6.751,20.48,14.13,6.089,21.43,38.7,92.1,72.35,34.85,92.7,268.1,1339.0,11.0,0.0,0.0,1.0,8.64,0.55,3.907284535,2011-04-23,2011,PRIMAVERA
AL41,24/04/2011,2.58,9.9,222.65,24.12,11.52,19.63,15.26,10.7,20.44,49.92,92.3,75.02,44.37,92.8,144.23,1116.0,9.0,0.0,0.0,0.0,10.58,0.47,2.948030942,2011-04-24,2011,PRIMAVERA
AL41,25/04/2011,3.24,11.37,280.33,354.81,12.21,19.85,16.19,11.57,20.65,51.9,91.7,68.47,48.73,92.6,121.34,1316.0,10.0,2.6,0.0,0.0,10.2,0.6,2.92450713,2011-04-25,2011,PRIMAVERA
AL41,26/04/2011,1.64,6.86,141.87,236.33,9.73,24.11,16.48,9.02,25.14,35.99,93.1,67.41,32.18,93.7,246.23,1290.0,11.0,0.2,0.0,0.0,9.56,0.77,4.111634967,2011-04-26,2011,PRIMAVERA
AL41,27/04/2011,1.66,7.742,143.79,161.52,9.42,24.61,16.9,8.41,25.24,39.33,91.2,65.29,35.72,92.4,304.39,1075.0,11.0,0.0,0.0,0.0,9.58,0.82,4.631585808,2011-04-27,2011,PRIMAVERA
AL41,28/04/2011,1.85,7.154,159.9,122.5,7.134,25.05,16.53,6.461,25.61,25.57,90.8,61.98,23.01,91.7,331.98,1008.0,12.0,0.0,0.0,0.0,7.69,0.96,5.208881606,2011-04-28,2011,PRIMAVERA
AL41,29/04/2011,,,,,,,,,,,,,,,,,,,,,,,,2011-04-29,2011,PRIMAVERA
AL41,30/04/2011,,,,,,,,,,,,,,,,,,,,,,,,2011-04-30,2011,PRIMAVERA
AL41,01/05/2011,,,,,,,,,,,,,,,,,,,,,,,,2011-05-01,2011,PRIMAVERA
AL41,02/05/2011,2.32,9.31,200.52,25.43,13.62,20.11,15.92,13.28,20.91,61.61,93.3,81.41,58.89,93.6,114.22,1424.0,5.0,12.2,0.0,0.0,12.65,0.36,2.424901704,2011-05-02,2011,PRIMAVERA
AL41,03/05/2011,1.09,6.762,94.57,183.95,12.67,23.31,17.21,12.18,23.72,51.78,95.8,80.21,47.09,95.9,190.1,1296.0,11.0,5.9,0.0,0.0,13.45,0.46,3.132126951,2011-05-03,2011,PRIMAVERA
AL41,04/05/2011,1.8,9.11,155.13,170.79,10.44,24.98,18.07,9.96,25.51,37.57,93.6,69.19,33.26,94.1,272.99,1157.0,12.0,0.0,0.0,0.0,11.45,0.81,4.558484887,2011-05-04,2011,PRIMAVERA
AL41,05/05/2011,2.27,8.72,195.88,116.86,11.16,24.54,18.51,10.84,25.1,38.38,94.2,69.02,35.01,94.6,331.93,1090.0,12.0,0.0,0.0,0.0,11.93,0.81,5.224236586,2011-05-05,2011,PRIMAVERA
AL41,06/05/2011,3.67,8.82,317.02,23.17,14.4,22.76,18.32,14.03,23.28,56.69,89.2,73.12,54.24,90.2,195.14,1234.0,11.0,0.0,0.0,0.0,13.24,0.61,3.83551896,2011-05-06,2011,PRIMAVERA
AL41,07/05/2011,3.04,10.39,229.6,31.88,16.94,23.16,19.91,16.67,24.23,39.04,75.49,59.62,28.2,76.74,278.93,1301.0,12.0,0.0,0.0,0.0,11.43,0.99,5.297052622,2011-05-07,2011,PRIMAVERA
AL41,08/05/2011,2.15,10.29,185.91,181.5,9.18,26.74,17.65,8.32,27.55,23.28,83.4,49.21,21.08,86.4,365.58,1028.0,14.0,0.0,0.0,1.0,6.29,1.23,6.180554744,2011-05-08,2011,PRIMAVERA
AL41,09/05/2011,2.24,10.98,193.53,110.77,8.68,26.31,17.8,7.677,26.99,34.4,86.6,61.93,32.25,88.4,309.67,1003.0,11.0,0.0,0.0,0.0,9.41,1.0,5.362270168,2011-05-09,2011,PRIMAVERA
AL41,10/05/2011,2.88,10.09,249.01,64.25,11.72,25.31,18.58,10.94,25.88,37.37,91.3,64.3,30.39,92.7,327.74,1291.0,12.0,0.0,0.0,0.0,10.87,0.92,5.592410509,2011-05-10,2011,PRIMAVERA
AL41,11/05/2011,2.26,8.62,195.38,45.58,10.02,26.13,18.43,9.46,26.85,23.75,81.2,53.1,21.32,83.8,319.25,1100.0,12.0,0.0,0.0,0.0,7.57,1.18,5.762954049,2011-05-11,2011,PRIMAVERA
AL41,12/05/2011,2.65,9.02,228.99,33.43,14.95,25.8,19.92,14.4,26.45,21.44,72.7,42.68,20.1,74.83,200.03,1188.0,12.0,0.0,0.0,0.0,5.42,1.46,5.267017066,2011-05-12,2011,PRIMAVERA
AL41,13/05/2011,1.82,10.78,157.07,79.39,10.94,26.57,18.88,10.43,27.05,25.81,71.26,46.1,24.22,73.41,265.5,982.0,12.0,0.0,0.0,0.0,6.0,1.34,5.127596909,2011-05-13,2011,PRIMAVERA
AL41,14/05/2011,2.26,10.0,195.39,165.08,10.83,27.24,19.9,9.65,27.93,26.03,83.6,48.96,23.17,85.0,331.26,997.0,12.0,0.0,0.0,0.0,7.55,1.41,5.983471622,2011-05-14,2011,PRIMAVERA
AL41,15/05/2011,2.66,9.02,229.64,73.88,12.89,21.23,17.18,12.25,21.93,40.31,85.3,74.64,31.49,86.9,97.38,951.0,7.0,0.0,0.0,0.0,12.43,0.52,3.153173386,2011-05-15,2011,PRIMAVERA
AL41,16/05/2011,2.23,8.92,192.87,100.17,11.27,21.63,16.96,10.77,22.3,42.28,91.5,64.92,38.96,92.0,263.69,1188.0,11.0,0.0,0.0,0.0,9.65,0.77,4.287365723,2011-05-16,2011,PRIMAVERA
AL41,17/05/2011,2.03,10.09,175.64,105.64,11.6,23.66,17.68,11.14,24.23,31.71,79.23,59.65,29.21,82.6,269.35,1327.0,11.0,0.0,0.0,0.0,9.12,0.91,4.818077249,2011-05-17,2011,PRIMAVERA
AL41,18/05/2011,2.93,7.448,252.79,33.85,14.94,20.9,17.55,14.67,21.28,51.86,81.4,70.63,49.57,83.2,124.13,833.0,8.0,2.9,0.0,0.0,12.0,0.62,3.233425654,2011-05-18,2011,PRIMAVERA
AL41,19/05/2011,2.59,9.7,223.5,49.38,15.1,23.5,18.51,14.9,24.23,30.1,86.0,61.07,27.15,88.3,215.72,1424.0,11.0,1.8,0.0,0.0,10.23,0.9,4.664427123,2011-05-19,2011,PRIMAVERA
AL41,20/05/2011,2.88,9.31,249.09,23.74,12.8,23.64,18.85,11.57,24.53,38.06,84.9,59.55,34.14,87.0,248.33,1424.0,11.0,0.0,0.0,0.0,10.41,0.94,4.833655355,2011-05-20,2011,PRIMAVERA
AL41,21/05/2011,2.61,10.39,225.76,148.14,9.77,25.9,17.92,8.64,27.26,22.39,91.2,55.64,20.17,92.6,361.16,1041.0,12.0,0.0,0.0,0.0,7.28,1.15,6.265064224,2011-05-21,2011,PRIMAVERA
AL41,22/05/2011,2.13,9.8,184.22,165.78,8.61,26.46,18.32,7.44,27.12,27.67,82.1,52.93,24.52,85.2,352.47,1015.0,12.0,0.0,0.0,0.0,7.18,1.24,5.944377731,2011-05-22,2011,PRIMAVERA
AL41,23/05/2011,1.91,10.29,164.81,170.42,7.928,29.05,19.52,7.373,29.8,18.29,79.71,45.52,16.66,84.3,359.6,1028.0,12.0,0.0,0.0,0.0,5.24,1.6,6.409047915,2011-05-23,2011,PRIMAVERA
AL41,24/05/2011,2.05,11.07,176.84,141.97,11.16,30.96,22.32,10.36,31.95,19.08,73.01,39.72,17.67,76.88,356.77,1028.0,12.0,0.0,0.0,0.0,5.98,1.96,6.862339965,2011-05-24,2011,PRIMAVERA
AL41,25/05/2011,2.41,9.51,208.56,168.47,10.31,30.15,21.65,9.66,30.78,20.39,73.97,42.04,19.16,79.75,363.34,1044.0,12.0,0.0,0.0,0.0,6.34,1.84,7.050837942,2011-05-25,2011,PRIMAVERA
AL41,26/05/2011,2.98,9.9,257.78,175.87,12.75,31.48,23.54,11.91,32.02,16.68,61.4,36.14,14.94,64.61,267.32,1280.0,11.0,0.0,0.0,0.0,6.25,2.1,7.181828795,2011-05-26,2011,PRIMAVERA
AL41,27/05/2011,2.56,9.31,221.26,161.99,17.97,29.22,24.18,17.43,30.22,25.8,73.87,43.72,23.06,76.38,237.93,1347.0,12.0,0.0,0.0,0.0,10.22,1.82,5.89666108,2011-05-27,2011,PRIMAVERA
AL41,28/05/2011,2.07,10.0,178.77,83.4,14.38,27.85,21.55,13.72,28.46,40.33,88.6,65.77,38.68,90.1,306.56,1152.0,11.0,0.0,0.0,0.0,14.35,1.01,5.518678443,2011-05-28,2011,PRIMAVERA
AL41,29/05/2011,2.42,8.82,209.09,91.9,15.5,27.11,21.03,14.87,27.67,45.85,88.2,70.32,43.78,89.7,237.81,1152.0,12.0,0.0,0.0,0.0,15.02,0.84,4.781097759,2011-05-29,2011,PRIMAVERA
AL41,30/05/2011,2.32,8.72,200.51,125.45,16.2,25.11,20.83,15.71,25.98,52.13,88.8,72.02,48.34,90.1,194.96,1363.0,11.0,0.0,0.0,0.0,15.34,0.75,3.961232942,2011-05-30,2011,PRIMAVERA
AL41,31/05/2011,2.5,9.8,216.05,135.66,16.66,27.84,22.3,16.04,28.9,30.33,89.3,59.39,28.6,90.0,274.31,1275.0,12.0,0.0,0.0,0.0,12.96,1.25,5.70054405,2011-05-31,2011,PRIMAVERA
AL41,01/06/2011,2.32,6.664,200.82,28.16,15.36,20.94,18.26,15.2,21.39,64.13,94.2,81.22,62.81,94.4,65.63,558.0,5.0,6.1,0.0,0.0,14.86,0.42,2.003417125,2011-06-01,2011,PRIMAVERA
AL41,02/06/2011,2.08,9.11,180.0,110.94,15.23,21.43,17.75,14.97,22.09,50.64,94.1,74.53,45.79,94.2,194.96,1188.0,10.0,0.0,0.0,0.0,12.82,0.56,3.513557999,2011-06-02,2011,PRIMAVERA
AL41,03/06/2011,1.6,8.33,138.07,138.84,11.57,21.67,17.03,11.14,22.52,45.28,91.2,68.52,40.86,92.0,202.97,1193.0,12.0,0.0,0.0,0.0,10.76,0.68,3.539947392,2011-06-03,2011,PRIMAVERA
AL41,04/06/2011,2.27,11.66,196.48,143.95,9.49,23.21,17.05,8.61,24.09,32.13,92.1,64.27,29.65,93.6,325.35,1260.0,12.0,0.0,0.0,0.0,9.33,0.84,5.232653999,2011-06-04,2011,PRIMAVERA
AL41,05/06/2011,2.62,10.09,226.69,164.9,8.05,24.75,17.78,7.711,25.44,36.83,89.0,62.57,32.82,91.0,364.69,1054.0,13.0,0.0,0.0,0.0,9.68,0.94,5.797672409,2011-06-05,2011,PRIMAVERA
AL41,06/06/2011,1.75,14.31,150.86,182.06,11.93,25.35,18.97,10.77,26.01,34.15,87.6,61.85,29.95,88.5,233.4,1219.0,12.0,0.0,0.0,0.0,10.58,0.98,4.460362674,2011-06-06,2011,PRIMAVERA
AL41,07/06/2011,1.76,11.17,152.1,102.51,13.09,26.54,18.66,12.52,27.66,29.27,89.7,67.18,27.49,91.6,239.5,1260.0,9.0,1.5,0.0,0.0,11.42,0.87,4.743877866,2011-06-07,2011,PRIMAVERA
AL41,08/06/2011,2.52,10.0,217.52,160.48,14.58,25.14,19.98,13.79,25.98,33.75,91.4,60.54,30.73,92.0,251.67,1347.0,12.0,1.2,0.0,0.0,11.07,1.07,5.005254386,2011-06-08,2011,PRIMAVERA
AL41,09/06/2011,2.26,9.9,195.04,161.19,11.26,28.3,20.68,10.53,29.0,28.95,89.7,54.41,26.98,91.6,345.21,1188.0,12.0,0.0,0.0,0.0,9.76,1.36,6.248999902,2011-06-09,2011,PRIMAVERA
AL41,10/06/2011,2.63,9.9,227.03,123.19,17.44,28.83,22.34,17.26,29.47,25.51,84.1,55.61,23.94,85.4,290.65,1085.0,11.0,1.4,0.0,0.0,11.86,1.35,6.326610366,2011-06-10,2011,PRIMAVERA
AL41,11/06/2011,2.36,8.53,203.78,144.36,15.63,27.38,21.34,14.94,28.06,39.52,85.4,66.17,35.38,86.9,266.77,1142.0,12.0,0.0,0.0,0.0,14.36,0.95,5.302975372,2011-06-11,2011,PRIMAVERA
AL41,12/06/2011,2.45,9.9,212.03,163.15,12.66,29.82,22.12,11.77,30.71,29.9,89.8,56.94,26.98,91.3,353.0,1039.0,12.0,0.0,0.0,0.0,11.64,1.42,6.667948448,2011-06-12,2011,PRIMAVERA
AL41,13/06/2011,2.45,10.09,211.91,166.25,13.77,31.19,23.6,12.72,31.99,25.92,81.0,49.6,24.41,83.6,350.45,1010.0,12.0,0.0,0.0,0.0,11.14,1.75,7.057106843,2011-06-13,2011,PRIMAVERA
AL41,14/06/2011,3.18,9.41,274.84,108.78,18.48,30.0,23.83,16.85,30.71,36.42,85.9,62.34,34.8,88.8,353.4,1013.0,12.0,0.0,0.0,0.0,15.54,1.26,7.085562292,2011-06-14,2011,PRIMAVERA
AL41,15/06/2011,2.46,9.9,212.66,164.05,15.57,30.17,23.32,14.47,30.68,39.34,90.6,64.14,34.7,91.9,355.65,1015.0,12.0,0.0,0.0,0.0,15.38,1.23,6.57608702,2011-06-15,2011,PRIMAVERA
AL41,16/06/2011,2.36,10.09,203.56,148.08,14.3,31.32,24.03,13.39,32.02,30.17,87.0,54.18,26.33,89.2,354.09,1003.0,12.0,0.0,0.0,0.0,12.88,1.67,6.908980351,2011-06-16,2011,PRIMAVERA
AL41,17/06/2011,2.75,10.0,237.31,159.3,16.12,31.46,24.06,15.04,32.79,34.36,87.3,60.67,30.34,88.6,356.52,1005.0,13.0,0.0,0.0,0.0,15.18,1.39,7.116413916,2011-06-17,2011,PRIMAVERA
AL41,18/06/2011,2.94,11.37,253.63,140.46,14.69,34.45,26.09,13.93,35.29,16.51,89.5,47.97,14.97,91.3,352.01,1008.0,12.0,0.0,0.0,0.0,11.14,2.26,8.211965057,2011-06-18,2011,PRIMAVERA
AL41,19/06/2011,3.64,11.17,314.33,61.71,21.29,29.91,24.84,20.85,30.71,41.57,81.5,64.04,37.87,83.6,306.04,1167.0,12.0,0.0,0.0,0.0,17.15,1.22,6.79338264,2011-06-19,2011,PRIMAVERA
AL41,20/06/2011,2.33,9.8,201.18,133.9,15.64,29.47,23.44,15.17,29.87,42.26,83.7,64.07,39.93,87.3,312.05,1090.0,12.0,0.0,0.0,0.0,15.7,1.18,5.969828593,2011-06-20,2011,PRIMAVERA
AL41,21/06/2011,2.27,10.88,196.17,158.54,14.95,31.06,24.07,14.33,32.36,29.62,89.0,61.35,26.67,90.9,347.29,992.0,12.0,0.0,0.0,0.0,15.22,1.4,6.756257917,2011-06-21,2011,VERANO
AL41,22/06/2011,2.26,10.39,195.65,166.42,16.33,32.43,23.97,15.74,33.53,33.12,91.5,67.08,30.82,92.5,277.63,992.0,11.0,0.0,0.0,0.0,16.61,1.2,6.132388001,2011-06-22,2011,VERANO
AL41,23/06/2011,2.82,10.39,243.29,114.81,16.74,30.3,24.23,15.91,31.21,44.88,90.2,68.97,43.19,93.8,319.04,1080.0,12.0,0.0,0.0,0.0,17.63,1.1,6.237181671,2011-06-23,2011,VERANO
AL41,24/06/2011,3.12,9.6,269.54,67.65,21.54,28.49,24.61,21.19,29.14,47.58,80.4,65.17,45.63,81.2,174.56,1260.0,10.0,0.0,0.0,0.0,17.4,1.13,4.80282747,2011-06-24,2011,VERANO
AL41,25/06/2011,3.41,10.98,294.69,83.47,19.61,30.45,24.5,19.14,31.15,33.85,83.2,57.39,32.57,85.5,349.51,982.0,12.0,0.0,0.0,0.0,14.71,1.47,7.404624569,2011-06-25,2011,VERANO
AL41,26/06/2011,2.28,9.51,196.7,165.6,16.75,31.7,24.52,15.64,32.32,23.44,74.7,49.9,22.29,78.39,349.23,987.0,12.0,0.0,0.0,0.0,12.24,1.79,7.194676664,2011-06-26,2011,VERANO
AL41,27/06/2011,2.16,9.6,186.54,159.4,14.62,32.44,24.16,13.79,33.23,29.68,80.3,55.77,28.46,83.8,345.34,982.0,12.0,0.0,0.0,0.0,13.83,1.58,6.92301408,2011-06-27,2011,VERANO
AL41,28/06/2011,2.58,9.7,222.8,162.42,16.03,32.24,24.76,15.31,32.72,35.94,84.0,59.6,34.05,86.9,344.77,982.0,12.0,0.0,0.0,0.0,15.57,1.5,7.001812162,2011-06-28,2011,VERANO
AL41,29/06/2011,3.07,10.49,265.44,117.03,15.84,31.54,24.79,14.63,32.46,44.66,84.9,63.39,42.75,88.1,321.04,956.0,12.0,0.0,0.0,0.0,16.9,1.33,6.588678505,2011-06-29,2011,VERANO
AL41,30/06/2011,3.34,9.8,288.34,84.81,21.92,29.24,25.25,21.26,29.91,47.47,84.7,64.37,45.16,86.9,268.52,1149.0,12.0,0.0,0.0,0.0,17.71,1.22,5.906011132,2011-06-30,2011,VERANO
AL41,01/07/2011,2.27,10.0,196.47,152.58,16.14,30.33,23.91,15.5,31.08,40.42,82.3,63.16,35.5,84.1,285.17,1039.0,11.0,0.0,0.0,0.0,16.0,1.23,5.825320913,2011-07-01,2011,VERANO
AL41,02/07/2011,2.95,10.68,254.73,161.66,18.32,32.19,25.58,17.59,33.1,41.65,90.3,65.19,37.73,91.6,339.61,972.0,12.0,0.0,0.0,0.0,17.83,1.35,6.929844625,2011-07-02,2011,VERANO
AL41,03/07/2011,2.47,11.66,213.54,125.17,18.96,31.78,25.15,18.29,32.52,42.42,87.5,66.35,39.21,89.1,240.46,1188.0,11.0,0.0,0.0,0.0,17.97,1.22,5.562427719,2011-07-03,2011,VERANO
AL41,04/07/2011,2.4,10.39,207.39,161.87,17.2,31.81,25.07,16.68,32.62,19.25,82.0,46.64,17.57,85.7,352.51,997.0,12.0,0.0,0.0,0.0,11.05,1.97,7.357060262,2011-07-04,2011,VERANO
AL41,05/07/2011,3.07,12.25,265.4,162.6,14.72,33.14,25.12,13.66,33.97,19.94,62.67,40.39,17.84,68.41,347.6,982.0,13.0,0.0,0.0,0.0,9.42,2.19,8.201064658,2011-07-05,2011,VERANO
AL41,06/07/2011,3.26,13.72,281.6,161.27,15.19,35.32,26.28,14.74,36.2,18.68,62.88,41.11,14.5,68.3,350.82,982.0,13.0,0.0,0.0,0.0,10.57,2.4,8.884645362,2011-07-06,2011,VERANO
AL41,07/07/2011,2.42,11.27,208.98,156.82,15.92,34.95,26.22,15.04,35.79,21.55,76.32,47.2,19.32,81.0,359.04,1023.0,13.0,0.0,0.0,0.0,12.57,2.18,7.89899252,2011-07-07,2011,VERANO
AL41,08/07/2011,3.34,11.37,288.34,150.38,16.53,33.65,26.59,14.73,34.61,14.27,79.6,38.25,13.39,82.8,364.32,1023.0,13.0,0.0,0.0,0.0,9.54,2.35,8.664847135,2011-07-08,2011,VERANO
AL41,09/07/2011,2.49,9.02,214.85,116.89,19.3,33.52,26.12,18.9,34.38,31.23,87.5,61.11,27.51,88.9,295.11,1203.0,13.0,0.0,0.0,0.0,17.1,1.53,6.757375207,2011-07-09,2011,VERANO
AL41,10/07/2011,2.69,10.29,232.21,167.14,19.3,31.17,25.61,18.97,31.95,43.01,86.2,65.32,37.73,87.8,297.17,1100.0,12.0,0.0,0.0,0.0,18.22,1.26,6.223073356,2011-07-10,2011,VERANO
AL41,11/07/2011,2.61,9.7,225.59,138.01,17.61,32.49,25.7,17.12,33.06,41.09,85.5,65.24,39.51,89.4,323.85,1188.0,12.0,0.0,0.0,0.0,18.12,1.33,6.677469358,2011-07-11,2011,VERANO
AL41,12/07/2011,3.06,11.47,264.42,150.94,22.3,30.69,25.55,21.46,31.62,53.24,84.7,72.94,48.8,87.3,192.95,1085.0,9.0,0.0,0.0,0.0,20.11,0.96,4.922327211,2011-07-12,2011,VERANO
AL41,13/07/2011,3.24,10.58,280.27,89.16,20.19,32.05,26.3,18.53,32.72,20.53,88.3,40.13,19.49,92.3,354.42,1013.0,13.0,0.0,0.0,0.0,10.37,2.21,7.961974692,2011-07-13,2011,VERANO
AL41,14/07/2011,2.39,12.05,206.88,154.87,17.72,29.9,24.36,16.85,30.81,32.79,78.84,56.04,30.75,83.6,324.96,1172.0,12.0,0.0,0.0,0.0,14.4,1.49,6.497994516,2011-07-14,2011,VERANO
AL41,15/07/2011,2.59,11.17,223.61,117.99,18.58,30.33,24.72,16.99,31.01,34.43,82.2,58.46,32.13,85.9,335.56,1080.0,12.0,0.0,0.0,0.0,15.32,1.45,6.72810823,2011-07-15,2011,VERANO
AL41,16/07/2011,3.01,10.39,260.43,161.15,15.74,31.98,25.01,14.7,32.76,24.31,83.7,55.53,22.73,87.0,338.4,992.0,12.0,0.0,0.0,0.0,14.06,1.69,7.457208259,2011-07-16,2011,VERANO
AL41,17/07/2011,3.52,12.94,304.24,152.82,17.61,33.89,26.74,16.82,34.48,31.66,87.8,57.8,28.56,90.2,350.03,1000.0,13.0,0.0,0.0,0.0,16.66,1.78,7.955844687,2011-07-17,2011,VERANO
AL41,18/07/2011,3.35,11.27,289.39,149.48,22.28,30.67,25.99,21.76,31.58,41.3,84.4,61.45,36.85,86.1,299.7,1260.0,11.0,0.0,0.0,0.0,17.68,1.36,6.64688806,2011-07-18,2011,VERANO
AL41,19/07/2011,2.51,10.0,217.12,107.31,18.18,33.43,26.38,17.8,34.04,20.05,88.2,50.82,18.75,91.2,341.75,1075.0,12.0,0.0,0.0,0.0,13.13,2.03,7.474886012,2011-07-19,2011,VERANO
AL41,20/07/2011,2.66,10.68,229.92,138.15,20.56,29.84,24.96,20.11,30.95,34.09,73.73,56.12,32.14,75.06,342.99,1152.0,12.0,0.0,0.0,0.0,15.11,1.5,6.961242857,2011-07-20,2011,VERANO
AL41,21/07/2011,2.66,10.29,230.11,115.19,15.98,31.79,24.45,15.37,32.39,27.94,81.7,54.94,24.17,84.5,336.63,982.0,12.0,0.0,0.0,0.0,13.61,1.63,7.083101776,2011-07-21,2011,VERANO
AL41,22/07/2011,3.26,9.7,281.65,89.79,20.2,29.86,24.89,19.5,30.62,34.02,80.5,60.5,31.94,82.9,263.58,1208.0,12.0,0.0,0.0,0.0,16.17,1.35,6.361752886,2011-07-22,2011,VERANO
AL41,23/07/2011,3.72,11.47,321.0,159.83,21.11,29.63,24.54,20.61,30.31,46.85,86.7,68.31,44.82,87.7,276.29,1177.0,10.0,0.0,0.0,0.0,18.03,1.05,6.085955035,2011-07-23,2011,VERANO
AL41,24/07/2011,3.02,12.15,260.99,114.11,18.13,32.22,24.99,17.63,33.4,28.67,86.6,65.56,25.72,89.7,315.33,1105.0,12.0,0.0,0.0,0.0,17.36,1.27,7.145206877,2011-07-24,2011,VERANO
AL41,25/07/2011,3.0,11.86,259.15,159.89,20.35,30.77,25.6,20.04,31.49,37.32,83.6,62.89,33.72,86.5,324.19,1116.0,12.0,0.0,0.0,0.0,17.42,1.35,6.80388311,2011-07-25,2011,VERANO
AL41,26/07/2011,3.04,11.37,263.03,160.79,16.8,33.06,25.59,16.11,33.87,23.72,87.1,53.81,22.25,89.0,330.47,959.0,12.0,0.0,0.0,0.0,13.72,1.86,7.554848718,2011-07-26,2011,VERANO
AL41,27/07/2011,3.36,12.74,290.34,88.93,17.41,32.19,25.08,16.82,32.99,32.86,75.37,55.88,26.67,81.0,320.04,931.0,12.0,0.0,0.0,0.0,15.14,1.55,7.374842936,2011-07-27,2011,VERANO
AL41,28/07/2011,2.56,9.02,220.87,106.01,21.61,29.58,25.12,20.78,30.21,44.75,89.2,65.48,42.76,89.4,220.02,1270.0,11.0,0.0,0.0,0.0,17.79,1.19,5.021213221,2011-07-28,2011,VERANO
AL41,29/07/2011,3.11,9.51,268.97,159.43,17.75,30.39,24.42,17.43,31.32,44.87,78.06,63.69,42.52,81.0,326.58,967.0,12.0,0.0,0.0,0.0,16.73,1.24,6.557555495,2011-07-29,2011,VERANO
AL41,30/07/2011,2.62,10.58,226.72,159.25,19.18,30.41,25.01,18.57,31.08,47.17,84.6,67.74,45.11,86.2,306.2,1059.0,11.0,0.0,0.0,0.0,18.28,1.13,6.022670803,2011-07-30,2011,VERANO
AL41,31/07/2011,2.43,9.7,210.19,162.24,19.54,31.12,25.09,18.6,31.95,42.38,88.2,66.76,40.33,89.3,311.87,972.0,11.0,0.0,0.0,0.0,17.96,1.2,6.177247704,2011-07-31,2011,VERANO
AL41,01/08/2011,2.72,9.41,235.36,87.74,21.26,32.27,26.22,20.58,32.83,31.88,83.8,59.96,29.27,85.3,300.31,936.0,12.0,0.0,0.0,0.0,17.03,1.53,6.774576486,2011-08-01,2011,VERANO
AL41,02/08/2011,3.11,10.19,268.74,147.16,20.62,31.21,25.98,20.07,31.92,33.99,74.61,59.02,29.23,76.34,295.02,905.0,12.0,0.0,0.0,0.0,16.87,1.49,6.851163012,2011-08-02,2011,VERANO
AL41,03/08/2011,2.74,11.37,236.8,138.07,19.48,34.62,27.14,19.0,35.68,20.39,80.1,52.49,17.19,83.0,323.01,982.0,12.0,0.0,0.0,0.0,15.05,2.02,7.70813057,2011-08-03,2011,VERANO
AL41,04/08/2011,2.34,9.41,202.41,163.51,17.33,32.69,25.5,16.65,33.67,36.59,81.8,64.07,34.25,83.7,297.37,1013.0,12.0,0.0,0.0,0.0,17.7,1.34,6.311064656,2011-08-04,2011,VERANO
AL41,05/08/2011,2.95,9.8,255.24,157.89,19.87,30.27,25.54,19.24,30.88,50.61,87.3,67.84,47.82,88.3,282.71,1100.0,12.0,0.0,0.0,0.0,18.81,1.16,5.722868995,2011-08-05,2011,VERANO
AL41,06/08/2011,2.77,12.35,239.36,165.69,18.24,34.87,26.97,17.66,35.56,26.03,85.8,57.7,21.04,87.4,313.78,962.0,12.0,0.0,0.0,0.0,16.48,1.83,7.390371395,2011-08-06,2011,VERANO
AL41,07/08/2011,2.67,13.52,231.02,156.19,19.93,36.71,28.51,19.31,37.26,21.75,76.32,48.23,21.0,79.38,324.88,962.0,12.0,0.0,0.0,0.0,14.86,2.38,7.984638037,2011-08-07,2011,VERANO
AL41,08/08/2011,3.57,11.47,308.4,106.68,18.67,34.41,27.24,18.03,35.79,17.61,80.9,56.29,15.64,84.7,319.58,951.0,12.0,0.0,0.0,0.0,16.36,1.86,8.346915226,2011-08-08,2011,VERANO
AL41,09/08/2011,2.98,10.39,257.66,100.69,23.05,30.51,26.2,22.2,31.05,36.3,81.2,57.93,34.8,83.0,260.3,1280.0,12.0,0.0,0.0,0.0,16.72,1.51,6.176798031,2011-08-09,2011,VERANO
AL41,10/08/2011,2.7,10.78,233.7,106.25,19.56,29.38,24.69,18.94,30.08,35.53,77.0,57.72,32.44,79.43,292.43,951.0,11.0,0.0,0.0,0.0,15.27,1.42,6.154269733,2011-08-10,2011,VERANO
AL41,11/08/2011,2.15,8.82,186.02,142.76,17.2,30.52,24.27,16.62,31.38,38.07,82.3,59.63,34.9,84.1,308.46,951.0,12.0,0.0,0.0,0.0,15.28,1.39,5.936751222,2011-08-11,2011,VERANO
AL41,12/08/2011,2.31,8.43,199.43,101.31,15.97,33.38,24.94,15.24,33.84,19.64,83.9,53.03,18.11,85.4,304.66,925.0,12.0,0.0,0.0,0.0,12.78,1.81,6.796747728,2011-08-12,2011,VERANO
AL41,13/08/2011,2.31,9.51,199.48,165.69,18.23,32.0,25.42,17.06,32.66,14.37,77.9,44.5,13.59,82.5,320.55,972.0,12.0,0.0,0.0,0.0,11.0,2.04,6.923803885,2011-08-13,2011,VERANO
AL41,14/08/2011,2.49,10.98,214.79,162.41,17.17,36.17,26.69,16.79,37.16,22.96,69.83,44.53,19.89,78.06,294.29,1039.0,12.0,0.0,0.0,0.0,12.51,2.27,7.363178973,2011-08-14,2011,VERANO
AL41,15/08/2011,2.32,10.78,200.32,156.01,17.59,35.41,26.75,16.95,36.32,30.28,83.5,56.37,28.52,86.3,309.44,941.0,12.0,0.0,0.0,0.0,16.2,1.85,6.885217832,2011-08-15,2011,VERANO
AL41,16/08/2011,2.25,10.0,194.81,128.38,18.72,34.4,27.15,18.03,34.88,25.82,88.5,55.85,24.65,90.0,309.19,936.0,12.0,0.0,0.0,0.0,16.04,1.88,6.730715027,2011-08-16,2011,VERANO
AL41,17/08/2011,2.17,8.72,187.49,111.68,17.83,35.52,27.01,17.19,36.23,19.15,80.6,49.7,17.3,82.8,300.96,920.0,12.0,0.0,0.0,0.0,13.7,2.19,6.939840884,2011-08-17,2011,VERANO
AL41,18/08/2011,2.73,9.51,235.54,28.56,21.02,34.53,27.42,20.18,35.29,30.78,72.46,50.96,28.96,76.92,294.7,1059.0,11.0,0.0,0.0,0.0,15.75,1.97,7.114441362,2011-08-18,2011,VERANO
AL41,19/08/2011,2.83,10.19,244.55,104.05,21.04,33.75,27.46,20.58,34.28,32.71,73.7,54.34,31.15,78.87,290.6,892.0,12.0,0.0,0.0,0.0,16.84,1.84,6.927918902,2011-08-19,2011,VERANO
AL41,20/08/2011,2.93,9.7,252.73,41.72,20.02,35.4,28.1,19.14,35.96,26.23,73.32,49.61,24.85,75.08,296.79,915.0,12.0,0.0,0.0,0.0,15.44,2.17,7.487383627,2011-08-20,2011,VERANO
AL41,21/08/2011,3.57,11.17,308.46,51.29,22.34,35.57,28.17,21.86,36.97,17.1,68.79,44.77,15.1,70.29,297.11,915.0,12.0,0.0,0.0,0.0,13.44,2.36,8.648425092,2011-08-21,2011,VERANO
AL41,22/08/2011,2.11,9.21,182.21,166.51,18.8,32.86,25.78,17.8,33.77,27.07,82.5,55.95,25.35,85.3,274.25,895.0,11.0,0.0,0.0,0.0,15.51,1.65,6.03767117,2011-08-22,2011,VERANO
AL41,23/08/2011,2.57,10.29,221.7,159.24,18.12,34.08,26.41,17.06,35.25,30.37,84.9,60.12,21.14,88.5,288.7,905.0,12.0,0.0,0.0,0.0,17.12,1.63,6.583308384,2011-08-23,2011,VERANO
AL41,24/08/2011,2.4,10.19,207.53,155.74,18.32,34.31,26.18,17.6,35.22,29.26,85.6,59.84,23.06,87.0,292.48,910.0,11.0,0.0,0.0,0.0,16.5,1.67,6.554232962,2011-08-24,2011,VERANO
AL41,25/08/2011,2.36,11.07,203.99,157.94,18.37,34.35,26.02,16.92,35.19,21.03,83.4,55.75,16.62,86.5,297.72,931.0,12.0,0.0,0.0,0.0,14.83,1.83,6.80826952,2011-08-25,2011,VERANO
AL41,26/08/2011,2.49,11.56,214.76,144.05,16.57,35.24,26.46,15.65,36.57,16.25,84.9,45.65,10.92,87.5,299.78,931.0,12.0,0.0,0.0,0.0,11.21,2.32,7.131582262,2011-08-26,2011,VERANO
AL41,27/08/2011,3.79,11.27,327.29,86.69,19.83,30.49,26.4,18.4,31.26,19.86,74.58,39.23,18.02,75.45,268.58,1080.0,11.0,0.0,0.0,0.0,10.22,2.14,7.129888252,2011-08-27,2011,VERANO
AL41,28/08/2011,2.64,9.7,228.02,115.36,21.84,30.04,25.55,21.73,31.09,37.72,80.6,61.99,34.36,81.7,235.19,1129.0,11.0,0.0,0.0,0.0,17.17,1.34,5.452942103,2011-08-28,2011,VERANO
AL41,29/08/2011,1.92,10.39,165.79,163.44,19.05,32.5,24.96,18.03,33.13,36.49,88.6,67.35,32.74,89.9,217.22,1085.0,10.0,0.0,0.0,0.0,17.97,1.18,4.945511287,2011-08-29,2011,VERANO
AL41,30/08/2011,2.36,9.51,204.11,169.67,19.01,31.47,25.56,18.63,32.59,34.0,80.4,58.93,31.93,82.0,237.9,931.0,11.0,0.0,0.0,0.0,16.43,1.49,5.46758242,2011-08-30,2011,VERANO
AL41,31/08/2011,2.45,10.68,211.64,171.12,18.06,33.07,25.38,17.56,34.04,21.65,81.0,52.17,19.08,84.5,283.36,910.0,12.0,0.0,0.0,0.0,13.15,1.88,6.48877859,2011-08-31,2011,VERANO
AL41,01/09/2011,2.45,11.47,211.96,149.61,19.79,32.15,25.66,19.44,32.93,32.63,82.0,56.42,28.49,83.8,267.6,848.0,11.0,0.0,0.0,0.0,15.52,1.61,5.93731912,2011-09-01,2011,VERANO
AL41,02/09/2011,1.67,10.09,144.36,188.48,17.68,23.53,20.6,17.39,24.12,65.96,91.9,84.1,62.4,92.2,57.29,617.2,3.0,9.6,0.0,0.0,17.8,0.39,1.798774426,2011-09-02,2011,VERANO
AL41,03/09/2011,1.29,5.88,111.54,214.69,13.37,26.32,20.22,12.52,27.26,35.81,92.0,64.46,33.06,92.8,225.31,1216.0,10.0,0.0,0.0,0.0,12.49,1.0,3.847249639,2011-09-03,2011,VERANO
AL41,04/09/2011,2.46,10.68,212.51,171.48,14.7,29.56,22.48,14.33,30.08,31.06,87.5,58.32,28.53,89.3,287.82,915.0,11.0,0.0,0.0,0.0,12.66,1.37,5.608119216,2011-09-04,2011,VERANO
AL41,05/09/2011,2.68,10.19,231.61,95.55,16.23,32.07,24.69,15.21,33.1,27.07,87.1,53.9,25.72,89.2,286.13,1018.0,11.0,0.0,0.0,0.0,13.53,1.68,6.219102986,2011-09-05,2011,VERANO
AL41,06/09/2011,1.7,8.82,146.61,160.06,17.9,30.57,23.86,16.85,31.11,38.49,87.9,66.57,34.93,88.9,254.75,1033.0,11.0,0.0,0.0,0.0,16.61,1.17,4.822443291,2011-09-06,2011,VERANO
AL41,07/09/2011,2.04,9.41,176.47,170.82,15.3,32.35,23.79,14.4,33.06,30.11,88.8,62.0,27.58,90.4,279.8,884.0,11.0,0.0,0.0,0.0,14.81,1.43,5.600792587,2011-09-07,2011,VERANO
AL41,08/09/2011,2.3,9.9,198.45,160.26,14.74,32.07,23.48,13.9,32.56,24.85,89.1,61.38,20.63,90.9,281.1,895.0,11.0,0.0,0.0,0.0,14.18,1.43,5.882210512,2011-09-08,2011,VERANO
AL41,09/09/2011,2.06,8.43,178.03,170.32,13.1,33.88,23.96,12.45,34.38,14.32,85.8,49.58,13.49,87.9,285.86,910.0,11.0,0.0,0.0,0.0,9.83,1.99,6.166645061,2011-09-09,2011,VERANO
AL41,10/09/2011,2.32,9.11,200.22,167.38,13.24,32.48,22.94,11.95,32.93,19.64,82.8,54.29,14.94,84.5,279.47,900.0,10.0,0.0,0.0,0.0,11.88,1.58,6.093315343,2011-09-10,2011,VERANO
AL41,11/09/2011,1.92,9.41,166.05,174.37,12.67,34.65,23.62,11.98,35.56,16.08,81.3,53.24,14.5,84.2,258.42,962.0,11.0,0.0,0.0,0.0,11.62,1.77,5.894483632,2011-09-11,2011,VERANO
AL41,12/09/2011,2.83,10.58,244.41,75.96,20.21,32.22,25.86,19.11,33.23,28.47,79.45,47.23,25.26,80.1,266.73,859.0,10.0,0.0,0.0,0.0,13.08,1.88,6.236885382,2011-09-12,2011,VERANO
AL41,13/09/2011,2.45,10.19,211.93,83.12,16.41,30.66,23.61,15.2,31.49,36.26,90.8,66.2,33.08,92.1,262.37,967.0,10.0,0.0,0.0,0.0,16.13,1.18,5.272576355,2011-09-13,2011,VERANO
AL41,14/09/2011,2.8,10.68,241.94,49.38,17.18,31.7,24.05,16.21,32.39,30.02,88.1,61.4,27.71,89.7,268.29,879.0,10.0,0.0,0.0,0.0,15.22,1.38,5.920411037,2011-09-14,2011,VERANO
AL41,15/09/2011,2.25,10.09,194.3,103.45,16.7,30.66,23.64,16.21,31.58,35.14,83.2,61.67,31.26,85.9,260.48,982.0,10.0,0.0,0.0,0.0,15.1,1.31,5.211994474,2011-09-15,2011,VERANO
AL41,16/09/2011,1.9,8.13,164.21,162.82,14.9,31.04,22.98,14.13,31.85,34.04,83.7,65.84,31.02,85.4,257.84,864.0,10.0,0.0,0.0,0.0,15.59,1.15,4.952930746,2011-09-16,2011,VERANO
AL41,17/09/2011,2.23,8.92,192.93,160.98,16.62,29.43,22.81,15.44,30.21,48.76,89.1,73.41,46.03,90.4,235.37,1003.0,10.0,0.0,0.0,0.0,17.4,0.87,4.427767315,2011-09-17,2011,VERANO
AL41,18/09/2011,2.18,9.31,188.69,153.43,15.27,33.38,24.02,14.7,33.84,21.42,89.3,57.0,19.32,90.5,229.44,884.0,10.0,0.0,0.0,0.0,13.12,1.63,5.493522099,2011-09-18,2011,VERANO
AL41,19/09/2011,2.22,10.0,191.76,137.39,16.66,28.66,23.09,15.17,29.2,33.4,77.16,53.33,31.6,80.7,231.06,900.0,10.0,0.0,0.0,0.0,12.71,1.39,4.741945384,2011-09-19,2011,VERANO
AL41,20/09/2011,1.86,9.41,160.67,94.45,15.05,28.01,21.11,13.87,29.1,35.58,81.4,60.2,33.25,83.1,253.61,874.0,10.0,0.0,0.0,0.0,12.41,1.15,4.490962568,2011-09-20,2011,VERANO
AL41,21/09/2011,1.89,8.23,163.26,112.52,14.43,28.41,21.51,13.73,29.0,40.44,86.2,65.35,39.12,88.7,230.72,859.0,10.0,0.0,0.0,0.0,14.21,1.04,4.208952281,2011-09-21,2011,VERANO
AL41,22/09/2011,2.1,9.11,181.56,152.3,17.53,27.43,22.2,17.26,28.5,52.26,83.7,69.96,47.86,85.1,228.29,946.0,10.0,0.0,0.0,0.0,16.23,0.88,4.048590299,2011-09-22,2011,VERANO
AL41,23/09/2011,2.1,8.62,181.74,169.55,17.66,26.71,21.66,17.12,27.29,47.51,90.0,71.79,44.49,90.4,160.22,997.0,9.0,2.5,0.0,0.0,16.0,0.8,3.423552738,2011-09-23,2011,OTOÑO
AL41,24/09/2011,2.41,9.8,208.38,169.86,17.29,28.08,21.99,16.75,28.5,33.94,91.6,66.16,31.84,92.0,235.98,823.0,10.0,0.2,0.0,0.0,14.46,1.04,4.624037837,2011-09-24,2011,OTOÑO
AL41,25/09/2011,2.05,8.33,177.06,120.1,15.08,27.87,21.52,14.13,28.63,44.74,90.2,70.91,41.75,91.3,218.66,946.0,10.0,0.0,0.0,0.0,15.56,0.88,3.977094295,2011-09-25,2011,OTOÑO
AL41,26/09/2011,2.33,9.21,201.57,61.15,14.61,28.13,21.82,13.69,28.7,42.21,89.7,68.43,40.64,91.1,205.73,910.0,10.0,0.0,0.0,0.0,15.15,0.97,4.085157257,2011-09-26,2011,OTOÑO
AL41,27/09/2011,2.46,9.02,212.88,50.78,16.31,28.23,22.29,15.27,29.49,39.34,89.3,65.75,37.47,91.6,217.18,946.0,10.0,0.0,0.0,0.0,14.89,1.06,4.345199499,2011-09-27,2011,OTOÑO
AL41,28/09/2011,2.53,11.17,218.92,58.48,17.39,27.78,21.85,16.55,28.38,35.83,87.0,64.02,33.4,88.8,173.73,925.0,10.0,0.0,0.0,0.0,14.05,1.06,4.158310936,2011-09-28,2011,OTOÑO
AL41,29/09/2011,2.55,9.02,220.44,43.17,16.86,27.0,21.78,15.64,27.67,43.7,83.4,65.53,41.36,86.4,112.81,866.0,5.0,0.0,0.0,0.0,14.63,0.99,3.438031635,2011-09-29,2011,OTOÑO
AL41,30/09/2011,2.69,10.78,232.43,49.48,16.6,26.85,21.55,15.5,27.57,39.89,83.3,63.86,37.34,84.5,138.58,869.0,10.0,0.0,0.0,0.0,13.92,1.03,3.793959492,2011-09-30,2011,OTOÑO
AL41,01/10/2011,2.97,10.39,256.61,42.62,18.39,27.37,22.08,17.96,28.0,29.91,81.1,61.76,25.77,82.7,152.34,818.0,10.0,0.0,0.0,0.0,13.78,1.11,4.496166467,2011-10-01,2011,OTOÑO
AL41,02/10/2011,2.42,8.33,208.95,55.28,16.45,26.98,21.11,15.13,27.96,42.94,87.7,67.28,39.63,88.6,167.96,910.0,9.0,0.0,0.0,0.0,14.43,0.92,3.7052486,2011-10-02,2011,OTOÑO
AL41,03/10/2011,1.75,8.04,151.25,165.54,13.06,27.75,20.14,12.45,28.39,37.77,90.0,72.14,33.92,91.5,215.02,823.0,10.0,0.0,0.0,0.0,14.36,0.81,3.750310722,2011-10-03,2011,OTOÑO
AL41,04/10/2011,1.2,7.448,103.49,150.99,12.47,27.48,19.29,11.57,28.16,34.77,91.3,71.22,32.41,92.4,199.84,825.0,10.0,0.0,0.0,0.0,13.2,0.82,3.241495584,2011-10-04,2011,OTOÑO
AL41,05/10/2011,1.33,7.448,115.1,163.37,8.65,29.3,18.71,7.981,29.84,19.65,85.3,54.15,18.18,89.0,225.74,791.8,10.0,0.0,0.0,0.0,7.2,1.35,3.816904678,2011-10-05,2011,OTOÑO
AL41,06/10/2011,2.02,8.82,174.95,165.26,9.7,28.57,19.09,8.79,29.34,25.04,74.66,53.73,22.93,80.1,223.09,786.6,10.0,0.0,0.0,0.0,8.35,1.25,4.368102661,2011-10-06,2011,OTOÑO
AL41,07/10/2011,1.75,6.566,151.43,72.22,9.76,29.28,19.42,8.69,29.94,20.43,83.1,61.64,18.89,89.0,175.58,802.0,9.0,0.0,0.0,0.0,10.8,1.08,3.971202294,2011-10-07,2011,OTOÑO
AL41,08/10/2011,3.02,11.37,260.98,34.06,13.07,24.19,19.42,12.55,24.63,26.17,76.07,44.72,24.62,80.8,210.08,905.0,10.0,0.0,0.0,0.0,6.09,1.31,4.405328513,2011-10-08,2011,OTOÑO
AL41,09/10/2011,1.55,8.33,133.97,177.99,9.2,25.02,16.97,8.08,25.51,31.19,87.0,64.19,28.07,89.2,220.16,778.9,10.0,0.0,0.0,0.0,9.19,0.87,3.353454142,2011-10-09,2011,OTOÑO
AL41,10/10/2011,1.27,7.154,109.54,157.4,8.62,26.75,17.78,7.98,27.29,35.66,86.2,65.72,33.16,90.1,215.32,766.1,10.0,0.0,0.0,0.0,10.46,0.9,3.1822539,2011-10-10,2011,OTOÑO
AL41,11/10/2011,1.86,9.21,160.34,172.97,9.91,30.91,19.76,9.09,31.45,20.88,84.6,50.89,19.56,87.7,216.62,766.1,10.0,0.0,0.0,0.0,7.34,1.49,4.412063794,2011-10-11,2011,OTOÑO
AL41,12/10/2011,1.43,8.13,123.45,162.99,9.79,30.87,19.22,9.03,31.51,18.19,69.53,48.15,16.99,74.7,214.24,755.8,10.0,0.0,0.0,0.0,6.4,1.48,3.983043954,2011-10-12,2011,OTOÑO
AL41,13/10/2011,1.52,8.43,131.17,163.72,9.85,31.49,19.26,8.69,31.92,14.52,73.87,48.72,13.69,78.73,214.79,760.9,10.0,0.0,0.0,0.0,6.08,1.53,4.200775808,2011-10-13,2011,OTOÑO
AL41,14/10/2011,2.15,9.51,185.46,112.49,8.17,26.87,18.5,7.677,27.42,38.96,78.57,63.07,36.63,80.3,203.07,755.8,10.0,0.0,0.0,0.0,10.97,0.92,3.645419434,2011-10-14,2011,OTOÑO
AL41,15/10/2011,1.7,8.23,146.46,106.23,14.65,25.42,20.0,13.76,26.01,32.97,81.9,63.97,31.2,83.0,162.19,828.0,8.0,0.0,0.0,0.0,12.34,0.94,3.137325883,2011-10-15,2011,OTOÑO
AL41,16/10/2011,1.64,9.7,141.59,168.4,11.52,24.62,18.06,10.46,25.41,44.79,83.3,67.89,41.59,87.6,175.5,812.0,10.0,0.0,0.0,0.0,11.72,0.76,2.855507291,2011-10-16,2011,OTOÑO
AL41,17/10/2011,1.54,7.448,133.21,102.62,12.51,23.32,17.62,11.88,23.92,36.16,82.5,64.5,34.58,85.2,143.17,838.0,9.0,0.0,0.0,0.0,10.35,0.79,2.672857127,2011-10-17,2011,OTOÑO
AL41,18/10/2011,1.23,6.86,106.02,89.51,10.02,23.57,16.01,8.55,24.23,33.38,85.7,63.16,31.64,89.2,163.65,864.0,8.0,0.0,0.0,0.0,8.24,0.81,2.552824671,2011-10-18,2011,OTOÑO
AL41,19/10/2011,1.95,8.92,168.08,172.3,7.849,25.21,16.2,7.001,25.74,36.59,85.0,65.85,35.05,87.1,189.34,699.3,9.0,0.0,0.0,0.0,9.12,0.79,3.230931445,2011-10-19,2011,OTOÑO
AL41,20/10/2011,1.98,7.84,170.78,86.47,10.66,23.27,17.41,9.66,23.69,47.14,88.5,67.29,45.57,90.4,115.82,810.0,8.0,0.0,0.0,0.0,10.97,0.73,2.471955259,2011-10-20,2011,OTOÑO
AL41,21/10/2011,2.4,10.88,207.41,42.89,13.33,23.68,18.29,12.79,24.33,41.04,84.3,69.63,38.46,86.9,166.01,776.5,8.0,0.0,0.0,0.0,12.3,0.7,3.149633582,2011-10-21,2011,OTOÑO
AL41,22/10/2011,1.8,7.154,155.46,41.45,14.48,22.11,17.82,13.66,22.85,50.32,88.9,72.35,48.24,90.2,118.79,900.0,8.0,0.0,0.0,0.0,12.48,0.62,2.275501963,2011-10-22,2011,OTOÑO
AL41,23/10/2011,1.94,8.23,167.91,172.29,15.13,23.94,18.74,14.53,24.6,46.13,83.4,69.39,43.35,84.9,151.74,760.9,8.0,0.0,0.0,0.0,12.7,0.73,2.771498639,2011-10-23,2011,OTOÑO
AL41,24/10/2011,1.87,8.13,161.94,200.5,10.87,19.67,15.66,10.19,20.48,63.36,88.8,77.85,53.8,90.9,62.27,416.6,6.0,0.4,0.0,0.0,11.69,0.43,1.59894097,2011-10-24,2011,OTOÑO
AL41,25/10/2011,1.88,9.21,162.72,231.9,9.18,23.33,16.08,7.972,23.59,21.38,85.8,54.74,20.11,87.8,193.9,714.8,10.0,0.0,0.0,0.0,5.5,0.98,3.160764433,2011-10-25,2011,OTOÑO
AL41,26/10/2011,2.0,9.8,172.57,170.66,6.882,21.81,13.97,6.123,22.28,37.54,77.66,60.54,34.83,80.2,139.9,776.5,9.0,0.0,0.0,1.0,6.09,0.72,2.694222423,2011-10-26,2011,OTOÑO
AL41,27/10/2011,1.86,6.37,160.72,178.65,9.55,19.84,14.81,8.21,20.34,63.83,89.4,77.58,59.43,90.8,80.54,854.0,7.0,1.2,0.0,0.0,10.86,0.41,1.64524412,2011-10-27,2011,OTOÑO
AL41,28/10/2011,1.96,7.448,169.1,21.12,12.76,21.27,16.6,11.88,22.16,49.03,86.3,70.57,44.41,87.6,98.19,931.0,6.0,0.1,0.0,0.0,10.98,0.6,2.17619739,2011-10-28,2011,OTOÑO
AL41,29/10/2011,4.83,13.92,417.27,354.86,17.13,22.34,19.06,16.55,23.1,49.59,81.8,60.48,45.75,88.6,88.09,755.9,8.0,0.0,0.0,0.0,11.14,0.89,3.411505695,2011-10-29,2011,OTOÑO
AL41,30/10/2011,2.99,9.11,258.46,29.58,15.79,24.1,19.97,15.17,24.6,43.73,83.4,63.0,41.59,85.0,137.38,833.0,7.0,0.0,0.0,0.0,12.46,0.91,3.182154339,2011-10-30,2011,OTOÑO
AL41,31/10/2011,1.77,7.938,153.3,166.76,11.43,23.49,16.64,10.77,23.96,47.79,88.3,74.97,42.33,89.1,151.8,668.4,9.0,0.0,0.0,0.0,11.84,0.56,2.410120474,2011-10-31,2011,OTOÑO
AL41,01/11/2011,2.02,8.43,174.92,164.97,10.42,23.15,16.49,9.62,23.69,53.16,90.4,76.59,51.64,91.4,160.75,658.2,8.0,0.0,0.0,0.0,12.05,0.53,2.384947277,2011-11-01,2011,OTOÑO
AL41,02/11/2011,1.16,4.41,100.25,184.41,10.39,20.97,15.51,9.32,21.15,57.01,89.9,78.39,54.91,90.8,68.01,354.8,7.0,0.0,0.0,0.0,11.57,0.44,1.458580533,2011-11-02,2011,OTOÑO
AL41,03/11/2011,2.04,10.39,176.66,197.61,14.4,22.52,17.51,13.93,22.9,51.45,92.3,74.22,47.85,92.5,89.65,869.0,5.0,1.8,0.0,0.0,12.55,0.57,2.092362762,2011-11-03,2011,OTOÑO
AL41,04/11/2011,2.12,8.33,183.21,196.44,11.2,17.14,14.62,9.86,17.43,63.69,92.0,80.42,58.48,92.5,46.88,807.0,5.0,9.5,0.0,0.0,11.2,0.32,1.398052986,2011-11-04,2011,OTOÑO
AL41,05/11/2011,2.63,11.86,227.19,262.76,10.27,15.75,13.64,8.85,16.04,42.44,69.91,54.03,40.04,78.03,40.77,236.6,2.0,0.0,0.0,0.0,4.31,0.74,2.215552798,2011-11-05,2011,OTOÑO
AL41,06/11/2011,4.0,15.78,345.78,319.88,14.09,20.73,17.06,13.55,21.28,28.46,52.5,37.55,26.56,65.24,146.49,719.9,8.0,0.5,0.0,0.0,2.22,1.24,4.299021748,2011-11-06,2011,OTOÑO
AL41,07/11/2011,1.27,6.762,109.81,157.65,11.3,19.09,14.69,10.87,19.53,44.2,81.1,65.47,41.85,83.0,97.51,781.6,7.0,0.1,0.0,0.0,8.03,0.61,1.717663624,2011-11-07,2011,OTOÑO
AL41,08/11/2011,1.27,6.762,109.55,194.11,7.211,21.61,14.09,6.325,22.2,35.15,86.5,66.32,33.46,90.7,158.94,627.3,8.0,0.0,0.0,0.0,7.26,0.65,2.016958995,2011-11-08,2011,OTOÑO
AL41,09/11/2011,1.46,7.056,126.02,188.63,8.29,21.44,13.43,7.373,21.9,37.78,86.6,70.12,34.85,89.8,159.25,622.2,8.0,0.0,0.0,0.0,7.52,0.57,2.113824419,2011-11-09,2011,OTOÑO
AL41,10/11/2011,1.36,7.35,117.75,165.45,5.355,20.7,12.44,4.813,21.14,50.51,88.9,76.88,47.31,92.1,153.66,606.8,8.0,0.0,0.0,5.0,8.15,0.42,1.777791761,2011-11-10,2011,OTOÑO
AL41,11/11/2011,1.15,6.762,99.03,175.29,5.3,22.08,13.08,4.88,22.41,44.17,92.2,75.15,41.79,93.0,149.81,601.6,8.0,0.0,0.0,4.0,8.19,0.5,1.775759068,2011-11-11,2011,OTOÑO
AL41,12/11/2011,2.2,7.742,189.97,26.35,5.827,21.13,13.94,4.671,21.37,56.39,93.5,81.05,55.13,93.9,124.4,849.0,8.0,0.0,0.0,2.0,10.51,0.37,1.920133113,2011-11-12,2011,OTOÑO
AL41,13/11/2011,3.33,8.23,287.82,25.71,16.18,21.54,17.98,15.84,21.99,54.97,89.3,76.71,47.07,89.8,91.16,812.0,8.0,0.0,0.0,0.0,13.7,0.5,2.377924165,2011-11-13,2011,OTOÑO
AL41,14/11/2011,2.83,7.938,244.27,19.26,15.33,19.57,16.77,14.49,19.74,61.93,91.0,78.76,59.33,91.7,60.02,329.1,7.0,0.6,0.0,0.0,12.98,0.42,1.769303673,2011-11-14,2011,OTOÑO
AL41,15/11/2011,1.27,4.998,110.02,95.44,8.92,20.09,14.58,7.474,22.17,31.48,92.3,65.5,29.4,93.3,131.11,673.6,7.0,0.3,0.0,0.0,7.19,0.65,1.779666313,2011-11-15,2011,OTOÑO
AL41,16/11/2011,1.07,7.252,92.74,355.59,4.141,20.03,11.57,3.205,20.54,34.12,87.2,62.7,33.1,88.8,149.96,601.6,8.0,0.0,0.0,8.0,3.89,0.64,1.633676833,2011-11-16,2011,OTOÑO
AL41,17/11/2011,1.69,6.37,145.89,353.84,7.039,17.46,12.66,6.536,17.78,46.98,81.9,67.22,44.72,83.9,74.6,694.3,6.0,0.0,0.0,0.0,6.48,0.53,1.638330392,2011-11-17,2011,OTOÑO
AL41,18/11/2011,2.28,6.37,197.33,18.66,12.7,15.35,14.13,12.55,15.57,69.88,89.9,84.03,68.2,90.3,46.86,221.1,4.0,0.4,0.0,0.0,11.46,0.26,1.231117232,2011-11-18,2011,OTOÑO
AL41,19/11/2011,1.36,6.37,117.91,24.54,11.5,17.96,14.4,10.94,18.28,63.33,92.9,82.45,61.49,93.2,105.75,604.2,7.0,0.2,0.0,0.0,11.33,0.31,1.293978608,2011-11-19,2011,OTOÑO
AL41,20/11/2011,1.79,6.664,154.94,31.88,11.67,18.74,15.13,11.1,19.13,61.76,93.7,84.33,58.99,94.0,62.55,709.7,5.0,2.7,0.0,0.0,12.39,0.29,1.360012623,2011-11-20,2011,OTOÑO
AL41,21/11/2011,3.23,10.49,279.49,3.89,12.52,17.55,15.01,12.28,18.19,58.36,88.1,71.24,52.84,91.0,74.97,792.0,6.0,15.9,0.0,0.0,9.69,0.51,1.865618304,2011-11-21,2011,OTOÑO
AL41,22/11/2011,2.05,7.546,176.69,11.96,11.84,18.96,14.69,11.13,19.76,50.6,88.5,66.95,46.4,90.0,76.24,745.6,4.0,0.7,0.0,0.0,8.27,0.59,1.749640736,2011-11-22,2011,OTOÑO
